date,title,link,description
"22/10/2024, 05:00 GMT0",EUR/USD Forecast: Faces Key Support,https://www.dailyforex.com/forex-technical-analysis/2024/10/eurusd-forecast-22-october-2024/219291,"The euro initially did try to rally a bit during the trading session on Monday, but then gave back quite a bit of the gains to continue to see a lot of sideways action."
"21/10/2024, 13:25 GMT0",EUR/USD Analysis: Downward Trend May Continue,https://www.dailyforex.com/forex-technical-analysis/2024/10/eurusd-analysis-21-october-2024/219271,"The Euro attempted to rebound on Friday, but its gains did not exceed the 1.0869 level, recovering from the significant losses it suffered last week, reaching a support level of 1.0810, the lowest for the currency pair in more than two months."
"21/10/2024, 09:59 GMT0",EUR/USD Signal: Euro Weakness May Persist for a While,https://www.dailyforex.com/forex-technical-analysis/2024/10/eurusd-signal-21-october-2024/219245,The EUR/USD exchange rate slumped to its lowest point in over two months after the European Central Bank (ECB) slashed interest rates for the third time this year.
"17/10/2024, 10:52 GMT0",EUR/USD Signal: Crashes Below 200 EMA Ahead of ECB Decision,https://www.dailyforex.com/forex-technical-analysis/2024/10/eurusd-signal-17-october-2024/219161,"The EUR/USD exchange rate fell for three straight days, continuing the downtrend that started on 1.1213, when it peaked at 1.1213."
"17/10/2024, 09:46 GMT0",EUR/USD Analysis: Will the ECB Offer Anything New Today?,https://www.dailyforex.com/forex-technical-analysis/2024/10/eur-usd-analysis-17-october-2024/219148,"Today is an important day for the euro against other major currencies, especially against the US dollar, which has plummeted to a support level of 1.0850, the"
"16/10/2024, 12:45 GMT0",EUR/USD Analysis: Has it reached buying levels?,https://www.dailyforex.com/forex-technical-analysis/2024/10/eur-usd-analysis-today-16-10-24/219120,"The EUR/USD pair is likely to continue to decline as traders target the next major support at 1.0800, which connects the lowest levels since October 2023. Decisively, this is an important level as it connects the lowest volatility since August."
"16/10/2024, 06:59 GMT0",EUR/USD Forex Signal: Euro Pummeled Ahead of ECB Decision,https://www.dailyforex.com/forex-technical-analysis/2024/10/eurusd-signal-16-october-2024/219082,"The EUR/USD continued its plunge, reaching its lowest level in two years as the focus shifted to the upcoming European inflation."
"15/10/2024, 11:40 GMT0",EUR/USD Analysis: Euro at a Two-Month Low,https://www.dailyforex.com/forex-technical-analysis/2024/10/eurusd-analysis-15-october-2024/219056,"At the beginning of this week, the euro continued to decline, reaching a support level of $1.0887, its lowest level in two months."
"15/10/2024, 07:22 GMT0",EUR/USD Froex Signal: Double-Top Points to a Drop to 1.0785,https://www.dailyforex.com/forex-technical-analysis/2024/10/eurusd-signal-15-october-2024/219021,The EUR/USD exchange rate continued its strong downward trend ahead of the upcoming US retail sales data and European Central Bank (ECB) decision.
"14/10/2024, 12:42 GMT0",EUR/USD Analysis: Facing Selling Pressure Ahead of ECB Decisions,https://www.dailyforex.com/forex-technical-analysis/2024/10/eurusd-analysis-14-october-2024/218988,"At the end of last week, the Euro traded around $1.09, its weakest level in about two months, driven by the overall strength of the US dollar amid expectations that the US Federal Reserve will cut borrowing costs at a slower pace than expected."
"14/10/2024, 08:18 GMT0",EUR/USD Forex Signal: Doji Candle Points to a Brief Rebound,https://www.dailyforex.com/forex-technical-analysis/2024/10/eurusd-forex-signal-14-october-2024/218952,The EUR/USD pair has been in a strong downward trend in the past two weeks as the US dollar index staged a strong comeback.
"13/10/2024, 11:38 GMT0","Weekly Forex Forecast - EUR/USD, NASDAQ 100 Index, AUD/USD, NZD/USD, USD/CHF, USD/CAD, WTI Crude Oil, CAD/JPY",https://www.dailyforex.com/forex-technical-analysis/2024/10/weekly-forex-forecast-14th-october-19th-october-2024/218935,"The market experienced a week of mixed performance, with some currencies showing signs of potential reversals while others faced continued volatility."
"11/10/2024, 05:45 GMT0",EUR/USD Forecast: Tests Major Support Level,https://www.dailyforex.com/forex-technical-analysis/2024/10/eurusd-forecast-11-october-2024/218907,"During my daily analysis of the EUR/USD pair, I noticed that we are at a couple of major areas that could come into the picture and offer a bit of volatility."
"10/10/2024, 13:45 GMT0",EUR/USD Analysis: Bearish Momentum Ahead of US Inflation Data,https://www.dailyforex.com/forex-technical-analysis/2024/10/eurusd-analysis-10-october-2024/218885,"Amidst a divided Federal Reserve on the size of US interest rate cuts in September, the EUR/USD exchange rate moved towards the support level of 1.0936, its lowest in seven weeks."
"10/10/2024, 10:20 GMT0",EUR/USD Forex Signal: More Downside as it Breaks Key Support,https://www.dailyforex.com/forex-technical-analysis/2024/10/eurusd-signal-10-october-2024/218860,The EUR/USD exchange rate continued its strong sell-off after the Federal Reserve published minutes of the last meeting.
"10/10/2024, 08:28 GMT0",EUR/USD Forecast: Euro Struggles as USD Strengthens,https://www.dailyforex.com/forex-technical-analysis/2024/10/eurusd-forecast-10-october-2024/218845,The euro initially tried to rally a bit during the trading session on Wednesday and as a result sellers came in and pushed this market lower.
"09/10/2024, 09:59 GMT0",EUR/USD Analysis: Nears Key Support: Is 1.0780 Next?,https://www.dailyforex.com/forex-technical-analysis/2024/10/eurusd-analysis-9-october-2024/218812,"Amidst selling pressure, the EUR/USD exchange rate is expected to witness further losses in the coming days and weeks, as some analysts see that a return to the 1.0780 support level is not impossible."
"09/10/2024, 06:46 GMT0",EUR/USD Forex Signal: Bearish Pennant Forms Ahead of FOMC Minutes,https://www.dailyforex.com/forex-technical-analysis/2024/10/eurusd-signal-9-october-2024/218790,The EUR/USD exchange rate continued falling this week ahead of the upcoming Federal Reserve minutes and US consumer and producer inflation data.
"09/10/2024, 06:36 GMT0",EUR/USD Forecast: Can Bulls Hold?,https://www.dailyforex.com/forex-technical-analysis/2024/10/eurusd-forecast-9-october-2024/218788,"The euro attempted to recover a bit during the early hours on Tuesday, as we continue to look for some type of bottom."
"08/10/2024, 10:57 GMT0",EUR/USD Analysis: New Downward Channel,https://www.dailyforex.com/forex-technical-analysis/2024/10/eurusd-analysis-8-october-2024/218757,"The EUR/USD exchange rate faces the risk of further losses in the coming days; however, the downward momentum is likely to fade."
"08/10/2024, 08:00 GMT0","EUR/USD Forecast: Tests Support, Bounce or Breakdown?",https://www.dailyforex.com/forex-technical-analysis/2024/10/eurusd-forecast-8-october-2024/218732,"The Euro has found a little bit of support near the 1.0950 level, an area that has been important multiple times in the past."
"08/10/2024, 06:33 GMT0",EUR/USD Forex Signal: Double-Top Points to More Sell-Off,https://www.dailyforex.com/forex-technical-analysis/2024/10/eurusd-signal-8-october-2024/218721,The EUR/USD currency pair continued its recent sell-off as investors embraced a risk-off sentiment in the market.
"07/10/2024, 11:45 GMT0",EUR/USD Analysis: Bearish Trend Continues,https://www.dailyforex.com/forex-technical-analysis/2024/10/eurusd-analysis-7-october-2024/218686,"At the end of last week, the US dollar strengthened against other major currencies as the likelihood of a 50-basis point interest rate cut in November diminished."
"07/10/2024, 07:16 GMT0",EUR/USD Forecast: Continued Downward Pressure,https://www.dailyforex.com/forex-technical-analysis/2024/10/eurusd-forecast-7-october-2024/218644,The Euro plunged during the trading session on Friday after the jobs number in America came out much hotter than anticipated.
"07/10/2024, 06:52 GMT0",EUR/USD Forex Signal: Looking Bearish,https://www.dailyforex.com/forex-technical-analysis/2024/10/eurusd-signal-7-october-2024/218641,A resurgent US Dollar boosted by strong US jobs and earnings data last Friday is dragging the price down. The action looks quite heavy and suggests that an attempt will be made to break below the support level at $1.0947.
"06/10/2024, 08:40 GMT0",EUR/USD Weekly Forecast: Nervous Surprises Affecting Speculative Sentiment,https://www.dailyforex.com/forex-technical-analysis/2024/10/eurusd-weekly-forecast-7th-october-12th-october-2024/218628,Nervousness is the pervading theme in the EUR/USD for the moment and the currency pair went into this weekend near the 1.09750 level.
"04/10/2024, 09:50 GMT0",EUR/USD Forecast: Euro Continues to Watch the 1.10 Level Underneath,https://www.dailyforex.com/forex-technical-analysis/2024/10/eurusd-forecast-october-4-2024/218598,"The Euro initially did drop a bit during the early hours on Thursday, but really at this point in time, the 1.10 level underneath continues to be the main area of interest."
"03/10/2024, 11:44 GMT0",EUR/USD Forecast: Euro Drops Again on Wednesday,https://www.dailyforex.com/forex-technical-analysis/2024/10/eurusd-forecast-october-3-2024/218566,The euro fell again during the trading session on Wednesday as we are testing the 50-day EMA.
"03/10/2024, 10:10 GMT0",EUR/USD Analysis: Breakdown of Uptrend,https://www.dailyforex.com/forex-technical-analysis/2024/10/eurusd-analysis-03-october-2024/218558,"The EUR/USD currency pair has been declining since the beginning of the week due to risk-off flows, weak September inflation figures in the region, and mixed"
"03/10/2024, 07:52 GMT0",EUR/USD Signal: Near Term Outlook is Bearish,https://www.dailyforex.com/forex-technical-analysis/2024/10/eurusd-signal-03-october-2024/218545,"The EUR/USD exchange rate retreated for four consecutive days, reaching its lowest point since September 12 as the US dollar comeback continued."
"02/10/2024, 10:23 GMT0",EUR/USD Analysis: Eurozone Inflation Extends Losses,https://www.dailyforex.com/forex-technical-analysis/2024/10/eur-usd-analysis-october-2-2024/218508,"The EUR/USD exchange rate is poised to decline for the third consecutive day, driven by a decline in September's Eurozone inflation figures and diverging communications between global central banks."
"02/10/2024, 07:15 GMT0",EUR/USD Forecast: Euro Plunges After CPI Surprises,https://www.dailyforex.com/forex-technical-analysis/2024/10/eurusd-forecast-02-october-2024/218464,EUR/USD: The Euro stands out as it has plunged quite drastically.
"02/10/2024, 05:54 GMT0","EUR/USD Forex Signal: Bullish Momentum Wanes, Drop to 1.100 Likely",https://www.dailyforex.com/forex-technical-analysis/2024/10/eurusd-signal-2-october-2024/218485,"The EUR/USD pair pulled back for the third consecutive day after the strong US jobs report, weak manufacturing data, and rising geopolitical risks."
"01/10/2024, 11:10 GMT0",EUR/USD Analysis: Rises Slightly Ahead of Key Data,https://www.dailyforex.com/forex-technical-analysis/2024/10/eurusd-analysis-1-october-2024/218441,"At the beginning of this important week's trading, the euro traded near 1.118 US dollars as investors prepare for a busy week of economic data from the eurozone."
"01/10/2024, 07:38 GMT0",EUR/USD Forecast: Continues to See Major Resistance,https://www.dailyforex.com/forex-technical-analysis/2024/10/eurusd-forecast-1-october-2024/218417,"The Euro initially rallied during the trading session on Monday, but it looks like it's going to continue to see a lot of issues around the 1.12 level, an area that's been important for some time."
"01/10/2024, 07:18 GMT0",EUR/USD Forex Signal: On the Cusp of a Bearish Breakout,https://www.dailyforex.com/forex-technical-analysis/2024/10/eurusd-signal-1-october-2024/218413,The EUR/USD currency pair pulled back as economic data showed that Europe’s inflation was falling faster than expected.
"01/10/2024, 05:52 GMT0",EUR/USD Monthly Forecast: October 2024,https://www.dailyforex.com/forex-technical-analysis/2024/10/eurusd-monthly-forecast-october-2024/218401,The EUR/USD is trading near the 1.11680 mark as of this writing on the last day of September. The month of October is likely to be busy for EUR/USD day traders because volatility will remain part of the landscape.
"30/09/2024, 11:29 GMT0",EUR/USD Analysis: EUR/USD Stable Ahead of US Data,https://www.dailyforex.com/forex-technical-analysis/2024/09/eurusd-analysis-30-september-2024/218371,"Around last week’s closing levels, the Euro against the US Dollar EUR/USD is stable at the beginning of trading in an important week led by the announcement of US jobs figures and statements by the US Federal Reserve Governor Jerome Powell."
"30/09/2024, 07:08 GMT0",EUR/USD Forex Signal: Double-Top Points to a Reversal,https://www.dailyforex.com/forex-technical-analysis/2024/09/eurusd-signal-30-september-2024/218323,The EUR/USD exchange rate remained in a tight range on Monday morning as traders assessed the next actions by the Federal Reserve and the European Central Bank.
"26/09/2024, 10:32 GMT0",EUR/USD Analysis: Euro Gets Boost from China Stimulus,https://www.dailyforex.com/forex-technical-analysis/2024/09/eurusd-analysis-26-september-2024/218240,"Amid a sudden upward momentum, the EUR/USD pair gained, surpassing the psychological resistance level of 1.1200 and reaching 1.1214 before facing profit-taking, which was frequently mentioned as a possibility in case the 1.1200 resistance was broken."
"26/09/2024, 07:10 GMT0",EUR/USD Forex Signal: Retreat From 1-Year High Price,https://www.dailyforex.com/forex-technical-analysis/2024/09/eurusd-signal-26-september-2024/218208,The Euro rose strongly against the Dollar yesterday to reach a new 1-year high price above $1.1200 but fell back firmly later in the day into more familiar territory. The price may make another attempt at the high later today.
"26/09/2024, 06:33 GMT0","Forex Today: S&P 500 Index, Euro, British Pound Retreat from Highs",https://www.dailyforex.com/forex-news/2024/09/forex-today-26-september-2024/218207,"S&P 500 Closes at New Record High; GBP/USD Briefly Breaks $1.3400, EUR/USD Trades at 1-Year High; Gold Remains Bullish; Markets Await SNB Policy Meeting, US Final GDP"
"25/09/2024, 10:08 GMT0",EUR/USD Analysis: Reasons for the Euro's Recent Failure,https://www.dailyforex.com/forex-technical-analysis/2024/09/eurusd-analysis-25-september-2024/218175,"Despite the weakness of the US dollar since the US interest rate cut last week, the EUR/USD failed to break the important resistance level of 1.1200 and is stable around 1.1130 at the time of writing the analysis."
"25/09/2024, 07:09 GMT0","Forex Today: Gold Reaches New Record High of $2,670",https://www.dailyforex.com/forex-news/2024/09/forex-today-25-september-2024/218153,"Gold Trades at $2,670 Record in Tokyo Session; S&P 500 Closes at New Record High; GBP/USD Powers to 2.5 Year High; Australian CPI Falls to 2.7% as Expected"
"25/09/2024, 05:57 GMT0",EUR/USD Forex Signal: Extremely Bullish Above 1.1190,https://www.dailyforex.com/forex-technical-analysis/2024/09/eurusd-signal-25-september-2024/218151,The EUR/USD pair held steady after a report by the Conference Board showed that the US consumer confidence dipped sharply in September.
"24/09/2024, 10:27 GMT0",EUR/USD Analysis: Can the Euro Target 1.12?,https://www.dailyforex.com/forex-technical-analysis/2024/09/eurusd-analysis-24-september-2024/218115,"At the start of this week, the Euro fell to $1.11, below its recent peak in July 2023 earlier this month, amid concerns that the European Central Bank may need to accelerate its easing efforts to support the struggling economy."
"24/09/2024, 06:30 GMT0",EUR/USD Forex Signal: Double-Top Chart Pattern Forms,https://www.dailyforex.com/forex-technical-analysis/2024/09/eurusd-signal-24-september-2024/218078,"The EUR/USD currency pair retreated after the weak European economic numbers, which confirmed that the bloc’s economy was softening."
"23/09/2024, 10:44 GMT0",EUR/USD Analysis: Future of the Recent Upward Trend,https://www.dailyforex.com/forex-technical-analysis/2024/09/eurusd-analysis-23-september-2024/218044,"Recent trades of the EUR/USD pair have been predominantly bullish, with bulls successfully driving the pair towards the resistance level of 1.1190, closing the previous week near these gains."
"23/09/2024, 06:32 GMT0",EUR/USD Forex Signal: Consolidation Below $1.1187,https://www.dailyforex.com/forex-technical-analysis/2024/09/eurusd-signal-23-september-2024/218006,"Last week saw the US Dollar sell off again, but markets are now consolidating on a typically quiet Monday. Price action still threatens a bullish breakout beyond the resistance level at $1.1187."
"22/09/2024, 08:43 GMT0",EUR/USD Weekly Forecast: Higher Momentum and Volatility Flourish More Coming,https://www.dailyforex.com/forex-technical-analysis/2024/09/eurusd-forecast-23rd-september-28th-september-2024/217983,The ability of the EUR/USD to sustain its higher realms late this week and not suffer any major reversals lower after Wednesday’s volatility is a solid signal.
"19/09/2024, 10:41 GMT0",EUR/USD Analysis: Short-lived Gains,https://www.dailyforex.com/forex-technical-analysis/2024/09/eurusd-analysis-19-september-2024/217926,The EUR/USD currency pair jumped to its highest level in three weeks at the resistance level of 1.1189 following a larger-than-expected US interest rate cut.
"19/09/2024, 08:04 GMT0",EUR/USD Forecast: Pulls Back Following FOMC Decision,https://www.dailyforex.com/forex-technical-analysis/2024/09/eurusd-forecast-19-september-2024/217905,"The Euro initially tried to rally a bit against the US dollar in early trading on Wednesday, but as we creep towards that FOMC interest rate decision statement and press conference, it looks like a little bit of the bullishness is starting to come out of this market."
"19/09/2024, 06:55 GMT0",EUR/USD Forex Signal: Double Top Hints to a Possible Reversal,https://www.dailyforex.com/forex-technical-analysis/2024/09/eurusd-signal-19-september-2024/217893,The EUR/USD pair popped and then erased some of the gains after the Federal Reserve slashed interest rates by 0.50%.
"18/09/2024, 10:58 GMT0",EUR/USD Analysis: Fed Decision to Determine Fate,https://www.dailyforex.com/forex-technical-analysis/2024/09/eurusd-analysis-18-september-2024/217857,"The decisions of the US Federal Reserve, the tone of its policy statement, and the comments of its chairman, Jerome Powell, will determine the fate of the current upward rebound."
"18/09/2024, 07:24 GMT0",EUR/USD Forex Signal: Double Top Forms Ahead of Fed Decision,https://www.dailyforex.com/forex-technical-analysis/2024/09/eurusd-signal-18-september-2024/217829,The EUR/USD pair pulled back slightly as the market continued to price in a 0.50% rate cut by the Federal Reserve.
"17/09/2024, 12:21 GMT0",EUR/USD Analysis: 2024 Rally Set to Resume,https://www.dailyforex.com/forex-technical-analysis/2024/09/eurusd-analysis-17-september-2024/217802,"The setup behind the EUR/USD exchange rate is constructive, and there's a good chance the 2024 rally will be tested either this week or next."
"17/09/2024, 11:01 GMT0",EUR/USD Forecast: Rallies Ahead of FOMC,https://www.dailyforex.com/forex-technical-analysis/2024/09/eurusd-forecastt-17-september-2024/217786,It was a very strong day for the euro against the US dollar on Monday as we broke back above the 1.11 level.
"17/09/2024, 06:52 GMT0",EUR/USD Forex Signal: Bulls Prevail Ahead of FOMC Decision,https://www.dailyforex.com/forex-technical-analysis/2024/09/eur-usd-forex-signal-september-17-2024/217762,The EUR/USD exchange rate continued rising after the European Central Bank (ECB) delivered its second interest rate cut and as the Federal Reserve prepared for its first cut in over four years.
"16/09/2024, 11:48 GMT0",EUR/USD Analysis: Euro Prices Stable Following ECB Rate Cut,https://www.dailyforex.com/forex-technical-analysis/2024/09/eurusd-analysis-16-september-2024/217719,"The European Central Bank cut interest rates by 25 basis points at its meeting last Thursday, as expected."
"16/09/2024, 06:58 GMT0",EUR/USD Forex Signal: More Bullish Above $1.1104,https://www.dailyforex.com/forex-technical-analysis/2024/09/eurusd-signal-16-september-2024/217693,"The US Dollar is weakening as markets increasingly expect a 50bps rate cut on Wednesday by the Fed, which is causing a weakly bullish technical picture here."
"15/09/2024, 10:52 GMT0","Weekly Forex Forecast – EUR/USD, GBP/USD, USD/CHF, USD/JPY, Gold, US 2-Year Treasury Yield",https://www.dailyforex.com/forex-technical-analysis/2024/09/weekly-forex-forecast-16th-september-21st-september-2024/217676,"Last week saw mixed sentiment and unexpectedly robust US CPI and PPI data, which cast doubt on the anticipated fast pace of approaching rate hikes by the Federal Reserve. This boosted the USD, although markets resumed moving in the direction of long-term trends by the end of the week."
"15/09/2024, 06:32 GMT0","Pairs in Focus - NZD/USD, USD/CHF, Dow Jones 30, Gold, VIX, Silver, USD/CNH, EUR/USD",https://www.dailyforex.com/forex-technical-analysis/2024/09/pairs-in-focus-this-week-16th-september-21st-september-2024/217664,"Get the weekly Forex forecast for major currency pairs for the week of September 16-21, 2024 here."
"12/09/2024, 11:30 GMT0",EUR/USD Analysis: Downward Stability Ahead of ECB Decisions,https://www.dailyforex.com/forex-technical-analysis/2024/09/eurusd-analysis-12-september-2024/217611,"During yesterday's trading session. The US dollar rose after inflation in the United States exceeded expectations in August, as the important core inflation reading of the consumer price index reached 0.3% on a monthly basis, exceeding the consensus expectations of 0.2%."
"12/09/2024, 06:44 GMT0",EUR/USD Forex Signal: Limited Volatility Expected Ahead of ECB Decision,https://www.dailyforex.com/forex-technical-analysis/2024/09/eurusd-signal-12-september-2024/217578,The EUR/USD currency pair was flat after the encouraging US consumer inflation data and ahead of the upcoming European Central Bank (ECB) interest rate decision.
"11/09/2024, 13:33 GMT0",EUR/USD Analysis: Eyes Recovery as US Inflation Data Looms,https://www.dailyforex.com/forex-technical-analysis/2024/09/eurusd-analysis-11-september-2024/217560,"Ahead of the release of US inflation data, the most important release before the announcement of the US Federal Reserve's decisions, the EUR/USD pair is trying to recover some of its recent losses."
"11/09/2024, 05:21 GMT0",EUR/USD Forex Signal: Set to Retest the 50 EMA Ahead of US Inflation Data,https://www.dailyforex.com/forex-technical-analysis/2024/09/eurusd-signal-11-september-2024/217513,The EUR/USD pair continued falling ahead of Thursday’s European Central Bank (ECB) decision.
"10/09/2024, 10:07 GMT0",EUR/USD Analysis: Faces Pressure Ahead of Key Data,https://www.dailyforex.com/forex-technical-analysis/2024/09/eurusd-analysis-10-september-2024/217480,"The euro is expected to remain under pressure against the US dollar in the near term, but we anticipate volatility around the US inflation report on Wednesday and the European Central Bank's decision on Thursday."
"10/09/2024, 06:30 GMT0",EUR/USD Forex Signal: Weak Bullish Double Bottom at $1.1028,https://www.dailyforex.com/forex-technical-analysis/2024/09/eurusd-signal-10-september-2024/217448,"A minor recovery in the US Dollar yesterday pushed the price lower, potentially knocking out many long-term trend traders on the bullish side, but the price seems to be finding support."
"10/09/2024, 06:08 GMT0","Forex Today: US Dollar, Stocks Make Small Recovery",https://www.dailyforex.com/forex-news/2024/09/forex-today-10-september-2024/217447,US Dollar and Stock Markets Gain Some Ground; Spectre of Chinese Deflation Subdues Asian Stocks; Yellen Says “No Red Light” for US Economy
"09/09/2024, 10:51 GMT0",EUR/USD Analysis: Key Events Ahead,https://www.dailyforex.com/forex-technical-analysis/2024/09/eurusd-analysis-9-september-2024/217409,"Prior to the close of last week's trading, the EUR/USD pair declined following a speech by John C. Williams, President of the Federal Reserve Bank of New York."
"09/09/2024, 07:00 GMT0",Forex Today: Markets Fear Fed Cutting Too Slowly,https://www.dailyforex.com/forex-news/2024/09/forex-today-9-september-2024/217386,"Fears Persist Fed Not Done Enough to Prevent Hard Landing; Asian Stocks Continue Decline, But US Futures, Yields Advance; Quiet Monday Likely"
"09/09/2024, 05:19 GMT0",EUR/USD Forex Signal: Waits for the US CPI Data and ECB Decision,https://www.dailyforex.com/forex-technical-analysis/2024/09/eurusd-signal-9-september-2024/217385,The EUR/USD exchange rate retreated after the US published mixed jobs numbers ahead of the upcoming European Central Bank (ECB) decision.
"08/09/2024, 11:43 GMT0","Weekly Forex Forecast – EUR/USD, USD/JPY, USD/CAD, Gold, NASDAQ 100 Index, US 2-Year Treasury Yield",https://www.dailyforex.com/forex-technical-analysis/2024/09/weekly-forex-forecast-9th-september-14th-september-2024/217374,"Last week, increasingly dovish expectations emerged in markets of the US Federal Reserve after relatively weak non-farm payroll data was released on Friday. Fears of a hard landing for the US economy built all week, generating stronger risk-off sentiment."
"08/09/2024, 09:22 GMT0",EUR/USD Weekly Forecast: Recent Volatility Likely to Create More Violence,https://www.dailyforex.com/forex-technical-analysis/2024/09/eurusd-weekly-forecast-8th-september-2024/217370,"The EUR/USD exchange rate started last week’s trading rather comfortably near the 1.10400 to 1.10500 ratios, but by Tuesday nervous conditions globally certainly started to be seen as financial institutions began to question existing outlooks."
