date,title,link,description
"24/03/2025, 12:54 GMT0",EUR/USD Analysis: Slips Toward Key 1.0800 Support,https://www.dailyforex.com/forex-technical-analysis/2025/03/eurusd-analysis-24-march-2025/226029,"EUR/USD declines for a third day, with bearish pressure mounting near 1.0800 as US tariff expectations boost the dollar and Eurozone momentum fades."
"24/03/2025, 09:41 GMT0",EUR/USD Forecast: Euro Slides Again,https://www.dailyforex.com/forex-technical-analysis/2025/03/eurusd-forecast-24-march-2025/225985,"The euro fell for the third day in a row against the US dollar as traders reacted to rising volatility, shifting rates, and geopolitical uncertainty."
"24/03/2025, 08:11 GMT0",EUR/USD Forex Signal: Double-Top Pattern Points to a Drop to 1.0695,https://www.dailyforex.com/forex-technical-analysis/2025/03/eurusd-forex-signal-24-march-2025/225974,"EUR/USD has pulled back from its recent high of 1.0950, forming a double-top pattern and testing the 61.8% Fibonacci level."
"23/03/2025, 11:54 GMT0","Weekly Forex Forecast – Gold, EUR/USD, USD/JPY, S&P 500 Index, Copper Futures",https://www.dailyforex.com/forex-technical-analysis/2025/03/weekly-forex-forecast-23th-march-29th-march-2025/225957,"Stock markets have shown some recovery over the past week, despite the ongoing US-centric trade war, while metals like Gold and Copper have continued to reach new long-term highs before turning lower at the end of the week."
"21/03/2025, 05:00 GMT0",EUR/USD Forecast: Plunges Against USD Amid Fed-Driven Uncertainty,https://www.dailyforex.com/forex-technical-analysis/2025/03/eurusd-forecast-21-march-2025/225928,"The euro weakens against the US dollar following the Fed’s policy update, with key support at 1.08 determining whether consolidation holds or a deeper reversal begins."
"20/03/2025, 12:44 GMT0",EUR/USD Analysis: Will Bulls Push Past 1.10?,https://www.dailyforex.com/forex-technical-analysis/2025/03/eurusd-analysis-20-march-2025/225917,"EUR/USD remains in an uptrend but faces resistance at 1.10 as traders assess Fed policy, inflation risks, and Eurozone stimulus impact."
"20/03/2025, 07:56 GMT0",EUR/USD Forex Signal: Rally Runs Out of Steam After FOMC,https://www.dailyforex.com/forex-technical-analysis/2025/03/eurusd-forex-signal-20-march-2025/225859,"EUR/USD pulled back after the Fed's decision signaled fewer rate cuts, with technical indicators suggesting a potential test of 1.0740 unless bullish momentum returns."
"19/03/2025, 12:31 GMT0",EUR/USD Analysis: Bullish Outlook and Caution Regarding Today's Events,https://www.dailyforex.com/forex-technical-analysis/2025/03/eurusd-analysis-19-march-2025/225855,"The EUR/USD pair remains strong near 1.0955 as traders eye Eurozone inflation data and the Fed’s policy decision, with a breakout above 1.1000 signaling further upside potential."
"19/03/2025, 10:13 GMT0",EUR/USD Forecast: Will the Rise Continue?,https://www.dailyforex.com/forex-technical-analysis/2025/03/eurusd-forecast-19-march-2025/225832,"The Euro flirts with a breakout above 1.0950, but volatility looms ahead of the FOMC meeting, with potential moves toward 1.12 or a sharp decline below 1.08."
"19/03/2025, 08:32 GMT0",EUR/USD Forex Signal: Gets Overbought Ahead of FOMC Decision,https://www.dailyforex.com/forex-technical-analysis/2025/03/eurusd-forex-signal-19-march-2025/225806,"EUR/USD extends its rally ahead of the FOMC decision, with technical indicators signaling overbought conditions as traders eye resistance at 1.1000."
"18/03/2025, 13:11 GMT0",EUR/USD Analysis: Attempts to Rebound,https://www.dailyforex.com/forex-technical-analysis/2025/03/eurusd-analysis-18-march-2025/225791,"The EUR/USD pair hovers near 1.0930, fueled by German stimulus optimism and US economic slowdown concerns, with traders awaiting the Fed’s policy announcement."
"18/03/2025, 11:53 GMT0",EUR/USD Forecast: Continues to Climb,https://www.dailyforex.com/forex-technical-analysis/2025/03/eurusd-forecast-18-march-2025/225778,"EUR/USD climbs above 1.09, supported by rising German yields, but traders await the FOMC meeting for potential market-shifting signals."
"18/03/2025, 10:25 GMT0",EUR/USD Forex Signal: Powers to New 5-Month High Price,https://www.dailyforex.com/forex-technical-analysis/2025/03/eurusd-forex-signal-18-march-2025/225761,The Euro has been the main beneficiary of the US-centered trade war in recent weeks and is rising with new strength after a period of consolidation.
"17/03/2025, 14:10 GMT0",EUR/USD Analysis: Bulls Await Further Stimulus,https://www.dailyforex.com/forex-technical-analysis/2025/03/eurusd-analysis-17-march-2025/225732,"EUR/USD continues its upward trend, supported by German stimulus and shifting market sentiment, with traders eyeing the 1.10 resistance ahead of the Fed’s decision."
"17/03/2025, 12:57 GMT0",EUR/USD Forecast: Continues to Pressure USD,https://www.dailyforex.com/forex-technical-analysis/2025/03/eurusd-forecast-17-march-2025/225722,"EUR/USD pushes against 1.09 resistance, with technical and economic factors favoring short-term gains, though long-term risks remain."
"17/03/2025, 09:08 GMT0","EUR/USD Forex Signal: Ahead of EU CPI Data, FOMC Decision",https://www.dailyforex.com/forex-technical-analysis/2025/03/eurusd-forex-signal-17-march-2025/225695,"EUR/USD remains steady ahead of EU inflation data and the Fed’s policy decision, with traders watching for signals on future rate cuts and market momentum."
"16/03/2025, 11:48 GMT0",EUR/USD Weekly Forecast: Higher Values Sustained with Range Dance Indicated,https://www.dailyforex.com/forex-technical-analysis/2025/03/eurusd-weekly-forecast-17th-march-22th-march-2025/225664,"The EUR/USD went into this weekend near the 1.08750, this after touching a high around the 1.09460 level on Tuesday, but the ability to sustain its higher price levels this week is a solid signal."
"16/03/2025, 07:57 GMT0","Pairs in Focus - Bitcoin, EUR/USD, GBP/USD, USD/CAD, NZD/USD, DAX, NASDAQ 100, USD/MXN",https://www.dailyforex.com/forex-technical-analysis/2025/03/pairs-in-focus-this-week-16th-march-22th-march-2025/225646,"This week’s market forecast covers Bitcoin, Forex, and indices. Key price levels, trends, and potential moves traders should watch. Stay informed!"
"14/03/2025, 10:59 GMT0",EUR/USD Forex Signal: Euro Dips but Finds Buyers on Thursday,https://www.dailyforex.com/forex-technical-analysis/2025/03/eurusd-signal-march-14-2025/225633,"During Thursday trading we have seen the Euro drop quite a bit against the US dollar, but quite frankly we’ve also seen a lot of buyers come in to pick up the currency."
"13/03/2025, 13:45 GMT0",EUR/USD Analysis: Euro Extends Gains,https://www.dailyforex.com/forex-technical-analysis/2025/03/eurusd-analysis-13-march-2025/225616,"The EUR/USD continues its bullish trend, supported by weak U.S. economic data and geopolitical developments, though caution is warranted near key resistance at 1.1000."
"13/03/2025, 13:11 GMT0",EUR/USD Forecast: Facing Volatility,https://www.dailyforex.com/forex-technical-analysis/2025/03/eurusd-forecast-13-march-2025/225612,"The EUR/USD pair experiences volatility as falling U.S. yields and rising German bond rates support the euro, though economic uncertainty may trigger reversals."
"13/03/2025, 08:23 GMT0",EUR/USD Forex Signal: Brief Pullback Likely as EU-US Trade War Continues,https://www.dailyforex.com/forex-technical-analysis/2025/03/eurusd-forex-signal-13-march-2025/225568,EUR/USD surged to a multi-month high but faces potential pullback as easing US inflation and escalating EU-US trade tensions shape market sentiment.
"12/03/2025, 13:26 GMT0",EUR/USD Analysis: Breaking Through Overbought Barriers,https://www.dailyforex.com/forex-technical-analysis/2025/03/eurusd-analysis-12-march-2025/225544,"The EUR/USD continues its bullish momentum, reaching 1.0947 as eurozone stimulus boosts the euro while US growth concerns weigh on the dollar, with traders eyeing the 1.1000 resistance level."
"12/03/2025, 12:12 GMT0","EUR/USD Forecast: Extends Gains, But Overbought Conditions Loom",https://www.dailyforex.com/forex-technical-analysis/2025/03/eurusd-forecast-12-march-2025/225532,"The euro maintains its upward momentum against the US dollar, driven by rising German yields, though overbought conditions signal a potential pullback toward key support at 1.08."
"12/03/2025, 09:29 GMT0",EUR/USD Forex Signal: Bullish Above $1.0882,https://www.dailyforex.com/forex-technical-analysis/2025/03/eurusd-forex-signal-12-march-2025/225502,"The US-driven trade war has hit the US Dollar hard, although it has recovered in recent hours to send the price lower."
"11/03/2025, 12:46 GMT0",EUR/USD Analysis: Is the Rally Overextended?,https://www.dailyforex.com/forex-technical-analysis/2025/03/eurusd-analysis-11-march-2025/225482,"EUR/USD remains neutral after strong gains, with overbought signals and upcoming US inflation data likely to determine its next move."
"11/03/2025, 07:28 GMT0",EUR/USD Forex Signal: Uptrend Continues as US Dollar Index Slips,https://www.dailyforex.com/forex-technical-analysis/2025/03/eurusd-forex-signal-11-march-2025/225437,"The EUR/USD pair extends its bullish momentum, reaching 1.0900 amid a weakening US dollar and recession fears, with traders eyeing US inflation data for further direction."
"10/03/2025, 13:59 GMT0",EUR/USD Analysis: Maintaining the Upward Channel,https://www.dailyforex.com/forex-technical-analysis/2025/03/eurusd-analysis-10-march-2025/225419,"The EUR/USD pair continues its bullish momentum, reaching a 4-month high amid US dollar weakness driven by Trump's tariffs and economic uncertainty."
"10/03/2025, 13:27 GMT0",EUR/USD Forecast: Climbing Higher,https://www.dailyforex.com/forex-technical-analysis/2025/03/eurusd-forecast-10-march-2025/225412,"The euro continues to gain against the US dollar, driven by rising German bond yields, though overbought conditions hint at a possible short-term pullback."
"10/03/2025, 10:04 GMT0","EUR/USD Forex Signal: Gets Overbought, Brief Pullback Likely",https://www.dailyforex.com/forex-technical-analysis/2025/03/eurusd-forex-signal-10-march-2025/225382,"The EUR/USD pair has rallied on dollar weakness and ECB rate cuts, but overbought signals suggest a short-term pullback before further gains."
"09/03/2025, 12:50 GMT0","ECB Cuts Interest Rates, Markets Eye Tariffs and German Bond Yields",https://www.dailyforex.com/forex-news/2025/03/ecb-cuts-rates-news-09032025/225344,"The European Central Bank (ECB) lowered rates by 25 basis points at last Thursday’s policy meeting, a move that was widely expected. The Euro, which has posted huge gains this week, has extended its gains following the decision."
"09/03/2025, 11:42 GMT0","Weekly Forex Forecast – EUR/USD, USD/JPY, S&P 500 Index, Natural Gas Futures",https://www.dailyforex.com/forex-technical-analysis/2025/03/weekly-forex-forecast-09th-march-15th-march-2025/225340,"The US-driven trade war is playing havoc with markets, sending stocks and commodities lower, while the greenback sinks in favor of the Euro in the Forex market."
"09/03/2025, 06:30 GMT0","Pairs in Focus - EUR/USD, GBP/JPY, USD/CAD, AUD/USD, USD/CHF, DAX, NASDAQ 100, NZD/USD",https://www.dailyforex.com/forex-technical-analysis/2025/03/pairs-in-focus-this-week-09th-march-15th-march-2025/225328,"Weekly market insights on forex, stocks, and indices. Stay ahead with key trends and analysis for informed trading decisions."
"07/03/2025, 05:21 GMT0",EUR/USD Forecast: Pulls Back After Rally,https://www.dailyforex.com/forex-technical-analysis/2025/03/eurusd-forecast-7-march-2025/225305,"The EUR/USD pulls back from overbought levels near 1.08, with traders watching key support ahead of the US non-farm payroll report and shifting rate expectations."
"06/03/2025, 14:14 GMT0",EUR/USD Analysis: Breaks 4-Month High as Dollar Weakens,https://www.dailyforex.com/forex-technical-analysis/2025/03/eurusd-analysis-6-march-2025/225297,The euro rallies to a 4-month high against the US dollar as economic optimism in Europe and declining US economic sentiment drive bullish momentum in the currency pair.
"06/03/2025, 09:43 GMT0",EUR/USD Forex Signal: Goes Parabolic as Bulls Eye 1.100 Ahead of ECB,https://www.dailyforex.com/forex-technical-analysis/2025/03/eurusd-forex-signal-6-march-2025/225266,"The EUR/USD pair has surged to a 4-month high ahead of the ECB rate decision, driven by weak US jobs data, rising German bond yields, and shifting market sentiment."
"06/03/2025, 05:10 GMT0",EUR/USD Forecast: Surges Against USD,https://www.dailyforex.com/forex-technical-analysis/2025/03/eurusd-forecast-6-march-2025/225234,"The euro rallies sharply against the U.S. dollar, breaking into an uptrend as recession fears shift sentiment, with 1.10 as the next key resistance."
"05/03/2025, 13:19 GMT0",EUR/USD Analysis: Gains Exceed 2025 Highs,https://www.dailyforex.com/forex-technical-analysis/2025/03/eurusd-analysis-5-march-2025/225229,"EUR/USD reached its highest level in 2025, driven by US tariff tensions and weak economic data, with 1.0800 in focus before the US jobs report."
"05/03/2025, 09:33 GMT0",EUR/USD Forex Signal: Powering Towards New 4-Month High,https://www.dailyforex.com/forex-technical-analysis/2025/03/eurusd-forex-signal-5-march-2025/225191,"The US-driven trade war is knocking the US Dollar hard, sending funds flowing into the Euro, putting this currency pair at the heart of the Forex market today."
"04/03/2025, 12:44 GMT0",EUR/USD Analysis: Gains May Remain Limited Until Key Events,https://www.dailyforex.com/forex-technical-analysis/2025/03/eurusd-analysis-4-march-2025/225168,"The EUR/USD pair remains under pressure, failing to surpass 1.0504 as markets brace for US tariff impacts, Friday’s non-farm payrolls, and the upcoming ECB rate decision."
"04/03/2025, 08:33 GMT0",EUR/USD Forex Signal: Ascending Triangle Points to More Upside,https://www.dailyforex.com/forex-technical-analysis/2025/03/eurusd-forex-signal-4-march-2025/225127,"EUR/USD climbed to 1.0500 following strong EU inflation and PMI data, ahead of the ECB rate decision."
"03/03/2025, 13:21 GMT0",EUR/USD Analysis: Falls as Markets Await ECB Rate Decision & US Tariffs,https://www.dailyforex.com/forex-technical-analysis/2025/03/eurusd-analysis-3-march-2025/225105,"The EUR/USD pair faces renewed selling pressure, falling to 1.0375 amid anticipation of the ECB rate cut and upcoming US tariffs."
"03/03/2025, 11:13 GMT0",EUR/USD Forecast: Holds Steady Near 1.04 Amid Trade Uncertainty,https://www.dailyforex.com/forex-technical-analysis/2025/03/eurusd-forecast-3-march-2025/225080,"The euro steadies near 1.04, staying within its established range as tariff concerns and technical resistance at 1.05 limit upside potential."
"03/03/2025, 08:51 GMT0",EUR/USD Forex Signal: Double-Top Points to Further Downside,https://www.dailyforex.com/forex-technical-analysis/2025/03/eurusd-forex-signal-3-march-2025/225052,"The EUR/USD pair continues its decline after forming a double-top at 1.0505, with traders eyeing key economic data and a potential drop toward 1.0300."
"02/03/2025, 12:28 GMT0","Weekly Forex Forecast – EUR/USD, AUD/USD, USD/CAD",https://www.dailyforex.com/forex-technical-analysis/2025/03/weekly-forex-forecast-02th-march-07th-march-2025/225029,"Markets have moved into a decisive risk-off mode, with the USD on top, as stocks, commodities, and commodity currencies look generally weak."
"02/03/2025, 11:57 GMT0",EUR/USD Weekly Forecast: Nervous Conditions Creating Volatile Speculation,https://www.dailyforex.com/forex-technical-analysis/2025/03/eurusd-weekly-forecast-02th-march-07th-march-2025/225027,"The EUR/USD snapped lower on Friday in the wake of the public argument between the U.S White House and President Zelensky of Ukraine, the currency pair ended trading near 1.03738."
"02/03/2025, 08:59 GMT0",EUR/USD Monthly Forecast: March 2025,https://www.dailyforex.com/forex-technical-analysis/2025/03/eurusd-monthly-forecast-march-2025/225017,"The EUR/USD experienced two bursts of volatility in February, one early in the first week and the second the past few days, causing speculators and financial institutions to now examine intriguing outlooks for March."
"02/03/2025, 06:32 GMT0","Pairs in Focus - USD/JPY, NASDAQ 100, EUR/USD, Gold, USD/CHF, Silver, GBP/JPY, WTI/CL",https://www.dailyforex.com/forex-technical-analysis/2025/03/pairs-in-focus-this-week-2th-march-7th-march-2025/225001,"Weekly insights on USD/JPY, NASDAQ, Gold, and more."
"28/02/2025, 05:05 GMT0",EUR/USD Forecast: Euro Plunges as USD Strengthens,https://www.dailyforex.com/forex-technical-analysis/2025/02/eurusd-forecast-28-february-2025/224975,"The Euro drops sharply below key support, targeting 1.04, as US GDP data reinforces USD strength, keeping EUR/USD within its established trading range."
"27/02/2025, 13:16 GMT0",EUR/USD Analysis: Cautious Performance Remains Stable,https://www.dailyforex.com/forex-technical-analysis/2025/02/eurusd-analysis-27-february-2025/224972,"EUR/USD remains stable near 1.0528 as market focus shifts to the ECB’s upcoming policy decision, German economic uncertainty, and US dollar resilience."
"27/02/2025, 07:19 GMT0",EUR/USD Forex Signal: On the Cusp of a Bullish Breakout,https://www.dailyforex.com/forex-technical-analysis/2025/02/eurusd-forex-signal-27-february-2025/224911,"The EUR/USD pair consolidates near resistance at 1.0506 as markets anticipate US GDP and PCE data, with a breakout to 1.0600 or a drop to 1.0400 in focus."
"26/02/2025, 10:32 GMT0",EUR/USD Analysis: Bulls Attempt to Break Key Peaks,https://www.dailyforex.com/forex-technical-analysis/2025/02/eurusd-analysis-26-february-2025/224882,"Since the start of this week's trading, the EUR/USD pair has been attempting to rebound upwards, with gains reaching the resistance level of 1.0528"
"26/02/2025, 09:01 GMT0",EUR/USD Forecast: Euro Continues to Slam into a Resistance Barrier,https://www.dailyforex.com/forex-technical-analysis/2025/02/eurusd-forecast-26-february-2025/224864,"EUR/USD struggles at 1.05-1.06 resistance. A breakout could target 1.10, while a drop may lead to 1.02."
"26/02/2025, 08:45 GMT0",EUR/USD Forex Signal: Weakly Bullish Above $1.0486,https://www.dailyforex.com/forex-technical-analysis/2025/02/eurusd-forex-signal-26-february-2025/224862,"The price is moving in choppy waves and basically ranging, although with a weak bullish bias."
"25/02/2025, 09:51 GMT0",EUR/USD Analysis: Stability Awaits New Catalysts,https://www.dailyforex.com/forex-technical-analysis/2025/02/eurusd-analysis-25-february-2025/224818,"Bulls are trying to maintain the EUR/USD exchange rate stable around and above the 1.0500 resistance, aided by hopes for a quick resolution to the German"
"25/02/2025, 08:40 GMT0",EUR/USD Forex Signal: Hits Resistance Ahead of US Consumer Confidence Data,https://www.dailyforex.com/forex-technical-analysis/2025/02/eurusd-forex-signal-25-february-2025/224797,"The EUR/USD exchange rate was unchanged after the latest European inflation data and the weekend German election. The pair was trading at 1.0480, a crucial resistance level, ahead of the upcoming US consumer confidence data. It has risen by 3% from its lowest level this year."
"24/02/2025, 13:37 GMT0",EUR/USD Analysis: Struggles Below 1.0500 as Risk Aversion Rises,https://www.dailyforex.com/forex-technical-analysis/2025/02/eurusd-analysis-24-february-2025/224778,"EUR/USD faces resistance below 1.0500 as investor risk aversion strengthens the US dollar, with traders eyeing German elections and key US data releases."
"24/02/2025, 12:34 GMT0",EUR/USD Forecast: Pulls Back from Massive Resistance,https://www.dailyforex.com/forex-technical-analysis/2025/02/eurusd-forecast-24-february-2025/224766,"EUR/USD fell from strong resistance at 1.05, with the pair remaining in consolidation as traders monitor interest rate differentials and risk sentiment."
"24/02/2025, 08:08 GMT0",EUR/USD Forex Signal: Extremely Bullish Above 1.0500,https://www.dailyforex.com/forex-technical-analysis/2025/02/eurusd-forex-signal-24-february-2025/224720,"EUR/USD remains range-bound near 1.0500, with traders awaiting inflation data and US trade policy developments to determine the next move."
"23/02/2025, 07:25 GMT0","Pairs in Focus - EUR/USD, Gold, Silver, USD/JPY, USD/CAD, USD/CHF, AUD/USD, USD/MXN",https://www.dailyforex.com/forex-technical-analysis/2025/02/pairs-in-focus-this-week-23th-february-28th-february-2025/224694,"Markets fluctuate: EUR/USD volatile, gold eyes $3000, USD/JPY falls. Full weekly analysis inside."
"21/02/2025, 05:12 GMT0","EUR/USD Forecast: Rises, Tests 1.05 Resistance",https://www.dailyforex.com/forex-technical-analysis/2025/02/eurusd-forecast-21-february-2025/224672,"EUR/USD climbed toward 1.05, testing key resistance amid shifting US interest rate expectations and hopes for a milder trade conflict."
"20/02/2025, 09:37 GMT0",EUR/USD Forex Signal: Evenly Balanced,https://www.dailyforex.com/forex-technical-analysis/2025/02/eurusd-forex-signal-20-february-2025/224630,"The Euro is one of the weaker major currencies right now, with the US Dollar gaining against it, pushing the price below lower new resistance levels."
"19/02/2025, 12:00 GMT0",EUR/USD Analysis: Bears Have the Upper Hand,https://www.dailyforex.com/forex-technical-analysis/2025/02/eurusd-analysis-19-february-2025/224590,"The EUR/USD pair struggles below 1.0515 resistance as bearish pressure builds, driven by Fed policy uncertainty and geopolitical risks, with support at 1.0370 in focus."
"19/02/2025, 09:30 GMT0",EUR/USD Forex Signal: Hits Crucial Resistance Ahead of FOMC Minutes,https://www.dailyforex.com/forex-technical-analysis/2025/02/eurusd-forex-signal-19-february-2025/224568,"EUR/USD pulls back from key resistance at 1.0510 ahead of FOMC minutes, with traders watching for a breakout above 1.0506 or a move lower toward 1.0215."
"19/02/2025, 07:55 GMT0",EUR/USD Forecast: Struggles at 1.05 Resistance,https://www.dailyforex.com/forex-technical-analysis/2025/02/eurusd-forecast-19-february-2025/224552,"EUR/USD retreats from 1.05 resistance as the US dollar strengthens, with traders watching for a potential breakdown below the 50-day EMA."
"18/02/2025, 12:19 GMT0",EUR/USD Analysis: Stability After Upward Attempts,https://www.dailyforex.com/forex-technical-analysis/2025/02/eurusd-analysis-14-february-2025/224542,"For two consecutive days, the EUR/USD currency pair has resumed trading within the broader downward trend, stabilizing around the support level of 1.0452"
"18/02/2025, 07:41 GMT0",EUR/USD Forex Signal: Double-Top Chart Pattern Forms,https://www.dailyforex.com/forex-technical-analysis/2025/02/eurusd-forex-signal-18-february-2025/224483,"The EUR/USD exchange rate held steady near its highest level since January 28 ahead of the upcoming Federal Reserve minutes. It rose to a high of 1.0515 on Tuesday, up by almost 3% from its lowest level this year."
"17/02/2025, 13:26 GMT0",EUR/USD Analysis: Caution of Renewed Selling,https://www.dailyforex.com/forex-technical-analysis/2025/02/eurusd-analysis-17-february-2025/224477,"EUR/USD tests 1.0515 resistance but remains bearish, with traders watching key levels and US-EU economic data for the next market move."
"17/02/2025, 08:10 GMT0",EUR/USD Forex Signal: Ichimoku Indicator Points to More Gains,https://www.dailyforex.com/forex-technical-analysis/2025/02/eurusd-forex-signal-17-february-2025/224431,"EUR/USD extends gains amid US dollar weakness, with technical indicators signaling further upside as traders await Fed minutes and potential Trump tariffs."
"16/02/2025, 11:54 GMT0",EUR/USD Weekly Forecast: Upwards Trajectory as Trade Sentiment Remains Mixed,https://www.dailyforex.com/forex-technical-analysis/2025/02/eurusd-weekly-forecast-16th-february-21th-february-2025/224417,"The EUR/USD went into this weekend near its highs. Having started last Monday below the 1.03000 level, and finishing this Friday within sight of the 1.05000 realm is an accomplishment regarding positive risk sentiment."
"14/02/2025, 05:18 GMT0",EUR/USD Forecast: Testing 50 Day EMA,https://www.dailyforex.com/forex-technical-analysis/2025/02/eurusd-forecast-14-february-2025/224380,"The Euro rallies toward 1.05 and tests the 50-Day EMA, but resistance near 1.06 and persistent long-term weakness suggest fading rallies remains the strategy."
"13/02/2025, 13:16 GMT0",EUR/USD Analysis: Struggles to Rebound,https://www.dailyforex.com/forex-technical-analysis/2025/02/eurusd-analysis-13-february-2025/224371,"EUR/USD upward attempts remain limited near 1.0430 as US inflation data supports dollar strength, with bearish momentum aiming for parity."
"13/02/2025, 07:34 GMT0",EUR/USD Forex Signal: Diamond Pattern Points to More Upside,https://www.dailyforex.com/forex-technical-analysis/2025/02/eurusd-forex-signal-13-february-2025/224312,"EUR/USD forms a bullish diamond pattern, signaling a potential move toward 1.0532, with inflation and Fed rate decisions influencing near-term direction"
"12/02/2025, 17:44 GMT0",US Inflation Rises Unexpectedly to 3% in January,https://www.dailyforex.com/forex-news/2025/02/us-inflation-rises-january-12-2025/224310,"US inflation for January accelerated to 3% year-on-year, above expectations, sending expectations for a May rate cut and stock markets lower, while the US Dollar gained."
"12/02/2025, 12:42 GMT0",EUR/USD Analysis: Stable Amid Tariff Tensions,https://www.dailyforex.com/forex-technical-analysis/2025/02/eurusd-analysis-12-february-2025/224301,"EUR/USD remains bearish near 1.0359, with US inflation data and EU-US trade tensions shaping the outlook; parity looms if downward momentum persists."
"12/02/2025, 11:46 GMT0",EUR/USD Forecast: Rallies Again,https://www.dailyforex.com/forex-technical-analysis/2025/02/eurusd-forecast-12-february-2025/224292,"EUR/USD rallies on Tuesday but remains bearish below key resistance levels, with 1.03 acting as support and the 1.06 level critical for any sustained upside."
