date,title,link,description
"30/12/2024, 08:30 GMT0",Forex Today: Santa Rally Falters,https://www.dailyforex.com/forex-news/2024/12/forex-today-30-december-2024/222341,"Markets Turn From Risk on Friday, Global Stock Markets Lower, Bitcoin Trading Near December Low; Quiet Markets Likely Today"
"30/12/2024, 07:44 GMT0","EUR/USD Forex Signal: Stuck in a Range, a Pullback to 1.0350 is Likely",https://www.dailyforex.com/forex-technical-analysis/2024/12/eurusd-signal-30-december-2024/222334,The EUR/USD exchange rate remained in a tight range on Monday morning ahead of a relatively muted week for the forex market.
"29/12/2024, 12:45 GMT0","Weekly Forex Forecast – EUR/USD, USD/JPY, NZD/USD, AUD/USD, NASDAQ 100 Index",https://www.dailyforex.com/forex-technical-analysis/2024/12/weekly-forex-forecast-30th-december-4th-january-2024/222325,"The holiday week sees a quiet Forex market favouring the US Dollar and punishing commodity currencies, while stock markets advance before taking a knock at the end of the week."
"29/12/2024, 09:58 GMT0","Pairs in Focus - Gold, EUR/USD, GBP/USD, BTC/USD, Silver, DAX, USD/MXN, NASDAQ 100,",https://www.dailyforex.com/forex-technical-analysis/2024/12/pairs-in-focus-this-week-30th-december-4th-january-2024/222321,"Markets show mixed activity with Gold holding an uptrend, currency pairs staying range-bound, Bitcoin faltering, and indices subdued amid holiday trading."
"27/12/2024, 05:32 GMT0",EUR/USD Forecast: Faces Resistance Near 1.06,https://www.dailyforex.com/forex-technical-analysis/2024/12/eurusd-forecast-27-december-2024/222294,"The Euro sees a modest bounce but faces strong resistance at 1.06, as political instability and economic slowdown in the EU favor continued bearish pressure."
"26/12/2024, 12:36 GMT0",EUR/USD Analysis: Stability of Bearish Trend,https://www.dailyforex.com/forex-technical-analysis/2024/12/eurusd-analysis-26-december-2024/222271,"EUR/USD continues its bearish trend, stabilizing near 1.0400 support with parity in sight, fueled by US dollar strength and Eurozone economic challenges."
"26/12/2024, 09:30 GMT0",EUR/USD Forex Signal: Double-Bottom Pattern Points to a Brief Rebound,https://www.dailyforex.com/forex-technical-analysis/2024/12/eurusd-signal-26-december-2024/222248,The EUR/USD pair was largely unmoved on Thursday as European markets remained closed for Boxing Day.
"26/12/2024, 08:42 GMT0",EUR/USD Forecast: Euro Weakens Further,https://www.dailyforex.com/forex-technical-analysis/2024/12/eurusd-forecast-26-december-2024/222238,"The euro continues to weaken, nearing 1.03 support as dollar strength dominates, driven by rising US rates and economic and political instability in Europe."
"26/12/2024, 08:29 GMT0",Forex Today: Year End Stock Market Rally Continues,https://www.dailyforex.com/forex-news/2024/12/forex-today-26-december-2024/222235,"Most Major Equity Indices Higher, Japan & China Higher by Over 1%; Bitcoin Gains on MicroStrategy Plans; Bank of Japan’s Ueda Gives No Clue on Rate Hike"
"24/12/2024, 12:19 GMT0",EUR/USD Analysis: Reasons for the Euro’s Decline Against the Dollar and Will the Performance Continue?,https://www.dailyforex.com/forex-technical-analysis/2024/12/eurusd-analysis-24-december-2024/222197,"In the shortened trading week due to Christmas holidays, the performance of the Euro is likely to remain under pressure against the US Dollar."
"24/12/2024, 10:25 GMT0",EUR/USD Forecast: Euro Drops Slightly on Monday,https://www.dailyforex.com/forex-technical-analysis/2024/12/eurusd-forecast-24-december-2024/222189,"During my daily analysis of major currency pairs, the EUR/USD pair has pulled back just a bit to show signs of hesitation."
"24/12/2024, 07:59 GMT0",EUR/USD Forex Signal: Likely to Trade Within Narrow Range,https://www.dailyforex.com/forex-technical-analysis/2024/12/eurusd-signal-24-december-2024/222158,Valid long-term bearish trend but likely to range today between $1.0377 and $1.0422.
"24/12/2024, 07:36 GMT0",Forex Today: Stock Markets Gaining Before Christmas Holiday,https://www.dailyforex.com/forex-news/2024/12/forex-today-24-december-2024/222153,Most Major Equity Indices Higher; Canadian GDP Stronger Than Expected; US 10-Year Treasury Yield Hits 6-Month High
"23/12/2024, 10:10 GMT0",EUR/USD Analysis: Bearish Dominance May Strengthen,https://www.dailyforex.com/forex-technical-analysis/2024/12/eurusd-analysis-23-december-2024/222106,"EUR/USD remains bearish near two-year lows, with economic turmoil, ECB rate cuts, and US shutdown fears signaling further downside potential."
"23/12/2024, 08:32 GMT0",EUR/USD Forex Signal: Brief Rebound Possible as Double-Bottom Forms,https://www.dailyforex.com/forex-technical-analysis/2024/12/eurusd-signal-23-december-2024/222084,The EUR/USD pair formed a double-bottom chart pattern at 1.0341 after the encouraging US consumer inflation data.
"23/12/2024, 07:39 GMT0",Forex Today: Risk Sentiment Continues Recovery,https://www.dailyforex.com/forex-news/2024/12/forex-today-23-december-2024/222078,"Friday’s Lower US PCE Data Restores Faith in Fed Rate Cuts, Stocks Higher; Canadian GDP Release Today Last Major Data Before Christmas"
"22/12/2024, 12:20 GMT0","Weekly Forex Forecast – EUR/USD, USD/JPY, NZD/USD, AUD/USD, USD/CAD, NASDAQ 100 Index, Cocoa Futures",https://www.dailyforex.com/forex-technical-analysis/2024/12/weekly-forex-forecast-23rd-december-28th-december-2024/222067,"A hawkish pivot on rate cuts by the US Federal Reserve sent stock markets tumbling, while commodity currencies were hard hit in the Forex market."
"22/12/2024, 10:08 GMT0",EUR/USD Weekly Forecast: Long-Term Lows Challenged as Fragile Sentiment Hits,https://www.dailyforex.com/forex-technical-analysis/2024/12/eurusd-weekly-forecast-23rd-december-28th-december-2024/222064,"The EUR/USD went into this weekend within sight of 1.04300, which may be considered a good achievement after having a hit a low around the 1.03400 mark on late Wednesday and once again Friday."
"22/12/2024, 09:10 GMT0","Pairs in Focus - Gold, EUR/USD, AUD/USD, NZD/USD, NASDAQ 100, WTI Crude Oil, DAX, USD/MXN",https://www.dailyforex.com/forex-technical-analysis/2024/12/pairs-in-focus-this-week-23rd-december-28th-december-2024/222061,"Comprehensive weekly insights on Gold, Forex pairs, NASDAQ, WTI Crude, and DAX, focusing on key trends, support levels, and market movements."
"20/12/2024, 06:22 GMT0",EUR/USD Forecast: Euro Drops Amid USD Strength,https://www.dailyforex.com/forex-technical-analysis/2024/12/eurusd-forecast-20-december-2024/222026,"EUR/USD gives up Thursday's gains, with structural EU issues and a strong US dollar driving the pair closer to parity while traders sell short-term rallies."
"19/12/2024, 12:09 GMT0",United States Federal Reserve Trims Rates by 0.25%,https://www.dailyforex.com/forex-news/2024/12/united-states-federal-reserve/221997,The US Federal Reserve lowers rates by 0.25% on a near-unanimous vote but signals a slower pace of cuts in 2025. The US dollar jumps while stocks slide.
"19/12/2024, 11:16 GMT0",EUR/USD Analysis: Future of Parity After Recent Losses,https://www.dailyforex.com/forex-technical-analysis/2024/12/eurusd-analysis-19-december-2024/221991,"EUR/USD hits a two-year low at 1.0343, with political instability and weak Eurozone data fueling parity concerns amid Fed-driven dollar strength."
"19/12/2024, 10:48 GMT0",EUR/USD Forecast: Weakened Before FOMC,https://www.dailyforex.com/forex-technical-analysis/2024/12/eurusd-forecast-19-december-2024/221984,"The euro hovers near 1.05, pressured by EU political instability, with traders eyeing potential shorts on rallies as the FOMC decision looms."
"19/12/2024, 07:48 GMT0",EUR/USD Forex Signal: Bearish Amid Fed and BoE Divergence,https://www.dailyforex.com/forex-technical-analysis/2024/12/eurusd-signal-19-december-2024/221955,The EUR/USD pair made a strong bearish breakout after the Federal Reserve delivered a relatively hawkish interest rate cut on Wednesday.
"19/12/2024, 07:27 GMT0",Forex Today: Fed Bursts a Bubble,https://www.dailyforex.com/forex-news/2024/12/forex-today-19-december-2024/221953,"US Federal Reserve Reduces 2025 Rate Cut Forecast, Stocks Plunge, US Dollar Soars; Bank of Japan Passes on Rate Hike; Brazilian Real Falls to New Record Low; Cocoa Futures Advance to Fresh High; Bank of England, US Final GDP In Focus"
"18/12/2024, 11:56 GMT0",EUR/USD Analysis: Bearish Outlook Ahead of US Interest Rate Cut,https://www.dailyforex.com/forex-technical-analysis/2024/12/eurusd-analysis-18-december-2024/221930,"EUR/USD stabilizes below 1.05, reflecting bearish momentum driven by Eurozone economic uncertainty and anticipation of the Fed's policy decision."
"18/12/2024, 08:21 GMT0",EUR/USD Forecast: Euro Continues to Grind Sideways Against Greenback,https://www.dailyforex.com/forex-technical-analysis/2024/12/eurusd-forecast-18-december-2024/221905,"In my daily analysis of the EUR/USD pair, I see the same thing that I have seen for several days: the EUR/USD simply grinding sideways."
"18/12/2024, 07:57 GMT0",EUR/USD Forex Signal: On the Cusp of a Breakdown,https://www.dailyforex.com/forex-technical-analysis/2024/12/eurusd--signal-18-december-2024/221900,The EUR/USD exchange rate remained in a tight range after the mixed US retail sales data and ahead of the upcoming Federal Reserve decision.
"18/12/2024, 07:53 GMT0",EUR/USD Forex Signal: Bullish Consolidation Basing Off $1.0480,https://www.dailyforex.com/forex-technical-analysis/2024/12/eurusd-signal-18-december-2024/221899,This currency pair is in a valid long-term bearish trend but is showing increasing signs of being strongly supported at $1.0480.
"18/12/2024, 07:38 GMT0",Forex Today: Markets Await Fed Data,https://www.dailyforex.com/forex-news/2024/12/forex-today-18-december-2024/221897,"US Federal Reserve Expected to Make 3rd Rate Cut of 0.25%, Lower 2025 Cuts Forecast; US Stocks Looking Bullish; Bitcoin Trades Above $108k But Reverses; Cocoa Continues to Leap Higher; Brazilian Real Plunges to Record Low"
"17/12/2024, 11:19 GMT0",EUR/USD Analysis: Stagnant Downward Trend Ahead of Key Events,https://www.dailyforex.com/forex-technical-analysis/2024/12/eurusd-analysis-17-december-2024/221871,"EUR/USD continues its downward trend below 1.05, weighed by Eurozone economic struggles and ECB policy, with support targets at 1.0420 and 1.0300."
"17/12/2024, 09:00 GMT0",EUR/USD Forecast: Euro Continues to Wait for Move,https://www.dailyforex.com/forex-technical-analysis/2024/12/eurusd-forecast-17-december-2024/221846,"The daily analysis of the Euro at this point remains negative overall, and in the EUR/USD pair, I see this market as hanging around the 1.05 level."
"17/12/2024, 07:45 GMT0",EUR/USD Forex Signal: Bearish Amid Rising Germany Woes,https://www.dailyforex.com/forex-technical-analysis/2024/12/eurusd-signal-17-december-2024/221836,"The EUR/USD exchange rate remained on edge as concerns about the German economy continued and as traders waited for the upcoming Federal Reserve decision. The pair,"
"17/12/2024, 07:27 GMT0","Forex Today: NASDAQ 100, Bitcoin, Cocoa Futures Power to New Record Highs",https://www.dailyforex.com/forex-news/2024/12/forex-today-17-december-2024/221833,"NASDAQ 100 Index Breaks 22100; Bitcoin Trades Above $107k; Cocoa Continues to Leap Higher; Markets Await Canadian CPI, US Retail Sales Data"
"16/12/2024, 12:25 GMT0",EUR/USD Analysis: Will the Euro Rise in the Coming Days?,https://www.dailyforex.com/forex-technical-analysis/2024/12/eurusd-analysis-16-december-2024/221802,"The EUR/USD pair stays bearish below 1.05, with further losses likely as Eurozone economic pressures mount and US dollar strength dominates."
"16/12/2024, 10:00 GMT0",EUR/USD Forex Signal: On the Verge of a Bearish Breakdown,https://www.dailyforex.com/forex-technical-analysis/2024/12/eurusd-signal-16-december-2024/221779,The EUR/USD pair has remained under pressure in the past few months as concerns about the European economy continued.
"16/12/2024, 07:15 GMT0","Forex Today: Bitcoin Breaks $105,000 For First Time",https://www.dailyforex.com/forex-news/2024/12/forex-today-16-december-2024/221755,Bitcoin Makes New Record High During Asian Session; NASDAQ 100 Index Looking Bullishly Divergent; Cocoa in a Strong Bull Run
"15/12/2024, 12:22 GMT0","Weekly Forex Forecast – Bitcoin, EUR/USD, NZD/USD, USD/CAD, NASDAQ 100 Index, Cocoa Futures",https://www.dailyforex.com/forex-technical-analysis/2024/12/weekly-forex-forecast-16th-december-21th-december-2024/221741,"Markets were dominated by bullishness in US tech stocks last week, and renewed strength in the US Dollar, while commodity currencies weakened."
"15/12/2024, 09:35 GMT0","Pairs in Focus - Silver, Gold, GBP/USD, EUR/USD, NASDAQ 100, USD/CHF, WTI Crude Oil, USD/JPY,",https://www.dailyforex.com/forex-technical-analysis/2024/12/pairs-in-focus-this-week-16nd-december-21th-december-2024/221734,"A weekly analysis of silver, gold, forex pairs, and commodities highlights USD dominance, ECB rate cuts, and key levels for WTI crude and NASDAQ."
"15/12/2024, 09:25 GMT0",EUR/USD Weekly Forecast: Bearish Flag Forms Ahead of Fed Decision,https://www.dailyforex.com/forex-technical-analysis/2024/12/eurusd-forecast-15-december-2024/221732,The EUR/USD notched a second weekly decline in a row after the European Central Bank (ECB) slashed interest rates and the US published the November inflation data on Wednesday.
"13/12/2024, 06:35 GMT0",EUR/USD Forecast: Slides After Dovish ECB Rate Cut,https://www.dailyforex.com/forex-technical-analysis/2024/12/eurusd-forecast-13-december-2024/221706,"The euro weakens following a dovish ECB rate cut, with consolidation near 1.05 and risks of a drop to parity if 1.03 support fails."
"12/12/2024, 19:52 GMT0",EUR/USD Analysis: Strong Selling Pressure Ahead of ECB Announcement,https://www.dailyforex.com/forex-technical-analysis/2024/12/eurusd-analysis-12-december-2024/221695,EUR/USD drops to 1.0480 under selling pressure as markets anticipate an ECB rate cut and monitor US PPI and jobless claims data.
"12/12/2024, 08:45 GMT0",EUR/USD Forex Signal: Drops Before ECB Decision,https://www.dailyforex.com/forex-technical-analysis/2024/12/eurusd-forex-signal-12-december-2024/221652,"EUR/USD dips to 1.0495 as markets await the ECB’s 0.25% rate cut, with bearish sentiment targeting 1.0400 support."
"12/12/2024, 06:33 GMT0",EUR/USD Forecast: Declines as CPI Meets Expectations,https://www.dailyforex.com/forex-technical-analysis/2024/12/eurusd-forecast-12-december-2024/221686,"The EUR/USD trades near 1.05 after US CPI data, with traders awaiting ECB and PPI announcements while favoring downside momentum overall."
"11/12/2024, 17:29 GMT0","US Inflation Rises to 2.7% in November, as Expected",https://www.dailyforex.com/forex-news/2024/12/us-inflation-rises-11122024/221631,"US inflation for November accelerated to 2.7% year-on-year, in line with expectations, and market expectations for a December rate cut jumped close to 100%."
"11/12/2024, 11:40 GMT0",EUR/USD Analysis: Awaits US Inflation,https://www.dailyforex.com/forex-technical-analysis/2024/12/eurusd-analysis-11-december-2024/221627,EUR/USD trades near 1.0500 under bearish pressure as US inflation data and the ECB announcement shape market expectations.
"11/12/2024, 07:35 GMT0",EUR/USD Forex Signal: Bears Testing $1.0500 Again,https://www.dailyforex.com/forex-technical-analysis/2024/12/eurusd-signal-11-december-2024/221589,"The big round number is a major pivotal point, strong US CPI data today might cause a bearish breakdown below this level in line with the long-term trend."
"11/12/2024, 06:50 GMT0",Forex Today: Uptick in US Inflation Expected Today,https://www.dailyforex.com/forex-news/2024/12/forex-today-11-december-2024/221583,US CPI Seen Rising From 2.6% to 2.7%; Bank of Canada Expected to Cut Rates by 0.50%; AUD/USD Reaches 4-Month Low; Cocoa Futures Hit 7-Month High Following Strong Gains
"10/12/2024, 12:05 GMT0",EUR/USD Analysis: Facing the 1.05 Support Again,https://www.dailyforex.com/forex-technical-analysis/2024/12/eurusd-analysis-10-december-2024/221564,"EUR/USD approaches 1.0500 support as risk aversion grows, with ECB decisions and US inflation data shaping near-term moves."
"10/12/2024, 07:57 GMT0",EUR/USD Forex Signal: Inverse Head and Shoulders Pattern Forms,https://www.dailyforex.com/forex-technical-analysis/2024/12/eurusd-signal-10-december-2024/221521,The EUR/USD exchange rate remained in a tight range ahead of the upcoming European Central Bank (ECB) decision and US consumer inflation data.
"10/12/2024, 07:35 GMT0",Forex Today: RBA Takes a Dovish Tilt on 2025 Rate Cuts,https://www.dailyforex.com/forex-news/2024/12/forex-today-10-december-2024/221517,"Reserve Bank of Australia Leaves Rates Unchanged, Hints at 2025 Cuts; Trump Crypto Rally Falters, Bitcoin Trades Below $95,000; NASDAQ 100, S&P 500, DAX Indices Fall; Cocoa Futures Hit 7-Month High"
"09/12/2024, 12:28 GMT0",EUR/USD Analysis: Price Awaits ECB Decisions Under Selling Pressure,https://www.dailyforex.com/forex-technical-analysis/2024/12/eurusd-analysis-9-december-2024/221495,EUR/USD holds near 1.0566 under bearish pressure as traders await ECB rate decision and US inflation data for direction.
"09/12/2024, 10:02 GMT0",EUR/USD Forecast: Euro Struggles Below 1.06,https://www.dailyforex.com/forex-technical-analysis/2024/12/eurusd-forecast-9-december-2024/221477,"The euro retreats below 1.06, pressured by US economic outperformance and Eurozone weakness, with 1.05 support and limited upside near 1.0750."
"08/12/2024, 13:36 GMT0","Pairs in Focus - Nikkei 225, S&P 500, GBP/USD, EUR/USD, Gold, USD/JPY, NZD/USD, AUD/USD",https://www.dailyforex.com/forex-technical-analysis/2024/12/pairs-in-focus-this-week-9nd-december-14th-december-2024/221446,"Weekly forecast highlights Nikkei 225's breakout potential, S&P 500 resilience, GBP/USD targeting 1.30, Gold's recovery, and bearish outlooks for AUD/USD and NZD/USD."
"08/12/2024, 11:29 GMT0","Weekly Forex Forecast – Bitcoin, AUD/USD, EUR/USD, NASDAQ 100 Index, S&P 500 Index, DAX",https://www.dailyforex.com/forex-technical-analysis/2024/12/weekly-forex-forecast-9th-october-14th-november-2024/221440,"Markets were dominated by bullishness in US stocks last week, and Bitcoin’s breakout above the key psychological level at $100,000."
"06/12/2024, 05:15 GMT0",EUR/USD Forecast: Tests 1.05 Resistance,https://www.dailyforex.com/forex-technical-analysis/2024/12/eurusd-forecast-6-december-2024/221404,"The euro steadies near 1.05 against the dollar, with traders eyeing NFP data for a potential breakout to 1.06 or a pullback to 1.04 support."
"05/12/2024, 09:32 GMT0",EUR/USD Analysis: Upward Rebound Gains May Remain Weak,https://www.dailyforex.com/forex-technical-analysis/2024/12/eurusd-analysis-5-december-2024/221372,"As we predicted earlier, the Euro will remain weak as long as economic and political tensions in the largest economies of the Eurozone persist and increase."
"05/12/2024, 08:50 GMT0",EUR/USD Forecast: Euro Continues to Grind Back and Forth,https://www.dailyforex.com/forex-technical-analysis/2024/12/eurusd-forecast-5-december-2024/221365,"The euro has been all over the place during the trading session on Wednesday, as we continue to see a lot of noisy behavior in general."
"05/12/2024, 07:40 GMT0","Forex Today: Bitcoin Breaks $100,000",https://www.dailyforex.com/forex-news/2024/12/forex-today-5-december-2024/221351,"Bitcoin Trading at Record High Above $100,000; NASDAQ 100, S&P 500, DAX indices Continue to New Record High Prices; Powell “Cautious” on Rate Cuts; French Government Falls"
"04/12/2024, 12:10 GMT0",EUR/USD Analysis: Holds Near 1.05,https://www.dailyforex.com/forex-technical-analysis/2024/12/eurusd-analysis-4-december-2024/221332,"EUR/USD remains stable near 1.05 with a bearish outlook, as investors eye Powell's comments and US jobs data, targeting support at 1.0440 and resistance at 1.0670."
"04/12/2024, 08:47 GMT0","EUR/USD Forex Signal: Remains on Edge, With a Bearish Breakdown Likely",https://www.dailyforex.com/forex-technical-analysis/2024/12/eurusd-signal-4-december-2024/221306,The EUR/USD pair held steady in the overnight session as focus remained on the US labor market and next week’s European Central Bank (ECB) decision.
"04/12/2024, 06:31 GMT0",EUR/USD Forecast: Euro Continues to Struggle Against Greenback,https://www.dailyforex.com/forex-technical-analysis/2024/12/eurusd-forecast-4-december-2024/221294,"In my daily analysis of the EUR/USD pair, the first thing I see is that the euro is struggling against the US dollar yet again."
"03/12/2024, 12:25 GMT0",EUR/USD Analysis: Continues Its Bearish Trajectory,https://www.dailyforex.com/forex-technical-analysis/2024/12/eurusd-analysis-3-december-2024/221277,"EUR/USD declines below 1.0500 under pressure from US dollar strength, driven by trade policy fears and eurozone political instability."
"03/12/2024, 07:39 GMT0","Forex Today: USA, Germany, Australia See Stock Markets Hit Record Highs",https://www.dailyforex.com/forex-news/2024/12/forex-today-03-december-2024/221239,"S&P 500, DAX, ASX 200 All Trade at All-Time High Prices; Commodity Currencies Battered by Trump BRICS Tariff Threat; Bank of Japan Considering a Triple Rate Hike; Fed’s Waller Leaning Towards December Rate Cut"
"03/12/2024, 07:11 GMT0",EUR/USD Forex Signal: Slammed Amid Germany and France Woes,https://www.dailyforex.com/forex-technical-analysis/2024/12/eurusd-signal-3-december-2024/221235,"The EUR/USD exchange rate retreated sharply as concerns about the French government rose. The pair slipped from 1.0600 to 1.0450, its biggest daily decline in over a week."
"02/12/2024, 12:33 GMT0",EUR/USD Analysis: Faces Downward Pressure,https://www.dailyforex.com/forex-technical-analysis/2024/12/eurusd-analysis-2-december-2024/221202,"The EUR/USD remains bearish around 1.0515 as dollar strength persists, with focus on US jobs data and critical support at 1.0455 for potential further declines."
"02/12/2024, 08:07 GMT0",EUR/USD Forecast: Euro Gives Up Early Gains on Friday,https://www.dailyforex.com/forex-technical-analysis/2024/12/eurusd-forecast-2-december-2024/221160,"During my daily analysis of the EUR/USD pair, the first thing that comes to the forefront is the fact that we try to break above the crucial 1.06 level."
"02/12/2024, 07:53 GMT0",Forex Today: Trump Threatens BRICS Against De-Dollarisation,https://www.dailyforex.com/forex-news/2024/12/forex-today-02-december-2024/221157,Trump Warns BRICS Against Pursuing Dollar Alternative in Social Media Post; Japanese Yen Loses Value During Tokyo Session; French Budget Deadlock Sends Euro Lower; Chinese Yuan Reaches 4-Month Low Price
"02/12/2024, 07:48 GMT0",EUR/USD Forex Signal: Break and Retest Points to a Retreat,https://www.dailyforex.com/forex-technical-analysis/2024/12/eurusd-signal-2-december-2024/221156,The EUR/USD exchange rate continued rebounding after the relatively strong flash European inflation numbers.
"01/12/2024, 10:54 GMT0","Weekly Forex Forecast – Bitcoin, EUR/USD, USD/JPY, USD/CHF, S&P 500 Index, USD/BRL, USD/INR",https://www.dailyforex.com/forex-technical-analysis/2024/12/weekly-forex-forecast-2nd-december-7th-december-2024/221134,"Markets were dominated by renewed bullishness in US stocks last week, as Bitcoin failed to break $100,000 and the US Dollar made a strong bearish retracement."
"01/12/2024, 10:41 GMT0",EUR/USD Weekly Forecast: Slight Climb Higher as Stable Sentiment Solidifies,https://www.dailyforex.com/forex-technical-analysis/2024/12/eurusd-weekly-forecast-2nd-december-7th-december-2024/221132,"The EUR/USD climbed from its lows on the 22nd of November which were testing long-term low water from late November 2022, the recent upwards shifts shows behavioral sentiment appears to have solidified but it will be tested quickly."
"01/12/2024, 07:46 GMT0",EUR/USD Monthly Forecast: December 2024,https://www.dailyforex.com/forex-technical-analysis/2024/12/eurusd-forecast-december-2024/221120,The EUR/USD was hit by a massive wave of selling in the wake of the U.S election results and the currency pair is testing lows it has not traded since October of 2023.
"01/12/2024, 07:41 GMT0","Pairs in Focus - BTC/USD, Silver, Gold, USD/MXN, ETH/USD, AUD/USD, EUR/USD, WTI Crude Oil",https://www.dailyforex.com/forex-technical-analysis/2024/12/pairs-in-focus-this-week-2nd-december-7th-december-2024/221119,"BTC eyes $100K, metals hold support, ETH targets $4K, while currencies and WTI stay range-bound."
"29/11/2024, 05:00 GMT0",EUR/USD Forecast: Looking for a Breakout,https://www.dailyforex.com/forex-technical-analysis/2024/11/eurusd-forecast-29-november-2024/221075,The euro initially fell a bit against the US dollar during the trading session on Thursday as Thanksgiving would have caused a little bit of liquidity problems in the market.
"28/11/2024, 13:29 GMT0",EUR/USD Analysis: Reasons Behind Weak Rebound,https://www.dailyforex.com/forex-technical-analysis/2024/11/eurusd-analysis-28-november-2024/221061,"EUR/USD rebounds weakly, stabilizing near 1.0546 as ECB commentary offers support, but bearish pressure remains amid global uncertainties and low liquidity."
"28/11/2024, 11:03 GMT0",EUR/USD Forecast: Euro Gains Amid Dollar Weakness,https://www.dailyforex.com/forex-technical-analysis/2024/11/eurusd-forecast-28-november-2024/221043,The Euro has rallied a bit during the early hours on Wednesday as we have seen the United States dollar give back some of its gains.
"28/11/2024, 08:15 GMT0",EUR/USD Forex Signal: Extremely Bullish Above 1.0600,https://www.dailyforex.com/forex-technical-analysis/2024/11/eurusd-forex-signal-28-november-2024/221019,"EUR/USD rebounds to 1.0575 on mixed US data and Fed caution. Key levels: bullish above 1.0600 targeting 1.0740, bearish below 1.0400 with support at 1.0337."
