date,title,link,description
"27/11/2024, 14:32 GMT0",EUR/USD Analysis: Post-Fed Minutes,https://www.dailyforex.com/forex-technical-analysis/2024/11/eurusd-analysis-27-november-2024/220992,A surge in sentiment following Trump's absence of threats to impose tariffs on the Eurozone helped the EUR/USD currency pair rebound to a high of 1.0544.
"27/11/2024, 08:36 GMT0",EUR/USD Forex Signal: Reluctant to Fall After Filling Weekend Gap,https://www.dailyforex.com/forex-technical-analysis/2024/11/eurusd-forex-signal-27-november-2024/220954,The US Dollar again seems to be running out of strength after getting a boost from Trump’s tariff announcement. Direction here looks difficult to predict.
"27/11/2024, 07:03 GMT0",EUR/USD Forex Signal: Forecast Ahead of Key US Economic Data,https://www.dailyforex.com/forex-technical-analysis/2024/11/eurusd-signal-27-november-2024/220947,The EUR/USD exchange rate remained under pressure as traders reflected on the ongoing risks of a trade war between the US and other partners.
"26/11/2024, 12:23 GMT0",EUR/USD Analysis: Recovery Remains Weak,https://www.dailyforex.com/forex-technical-analysis/2024/11/eurusd-analysis-26-november-2024/220922,The EUR/USD currency pair's attempt to recover at the end of last week with gains to the 1.0530 level quickly evaporated and returned downward this week.
"26/11/2024, 08:04 GMT0",EUR/USD Forecast: Euro Treads Water on Monday,https://www.dailyforex.com/forex-technical-analysis/2024/11/eurusd-forecast-26-november-2024/220884,"In my daily analysis of the EUR/USD pair, it looks like the euro is simply treading water, just below the crucial 1.05 level."
"26/11/2024, 07:31 GMT0",EUR/USD Forex Signal: Reluctant to Fall After Filling Weekend Gap,https://www.dailyforex.com/forex-technical-analysis/2024/11/eurusd-signal-26-november-2024/220879,The US Dollar again seems to be running out of strength after getting a boost from Trump’s tariff announcement. Direction here looks difficult to predict.
"26/11/2024, 07:20 GMT0",Forex Today: Bitcoin Makes Biggest Drop Since Trump Win,https://www.dailyforex.com/forex-news/2024/11/forex-today-26-november-2024/220878,"Bitcoin Falls to $94,000; President-Elect Trump Announces Tariffs on Mexico, Canada, and China; Fed’s Kashkari Sees December Rate Cut as “Reasonable”"
"25/11/2024, 11:47 GMT0",EUR/USD Analysis: Limited Movement Amidst US Holiday,https://www.dailyforex.com/forex-technical-analysis/2024/11/eurusd-analysis-25-november-2024/220844,"At the beginning of this week's trading, the EUR/USD currency pair is expected to stabilize around its recent losses, which extended to the support level of 1.0332 last week."
"25/11/2024, 09:26 GMT0",EUR/USD Forex Signal: Euro Collapses During the Friday Session,https://www.dailyforex.com/forex-technical-analysis/2024/11/eurusd--signal-25-november-2024/220823,"In my daily analysis of the EUR/USD pair, the first thing that I notice is that the euro has completely collapsed."
"25/11/2024, 08:46 GMT0",EUR/USD Forex Signal: Euro Pressured by European Economic Woes,https://www.dailyforex.com/forex-technical-analysis/2024/11/eurusd-signal-25-november-2024/220814,The EUR/USD exchange rate continued falling after a series of weak economic numbers from Europe.
"25/11/2024, 07:46 GMT0","Forex Today: Bitcoin Heading to $100,000",https://www.dailyforex.com/forex-news/2024/11/forex-today-25-november-2024/220808,"Bitcoin Makes New Record High Above $99,000; Stocks Higher on Trump Treasury Secretary Pick; US Dollar Declines"
"24/11/2024, 12:27 GMT0","Weekly Forex Forecast – Bitcoin, EUR/USD, USD/JPY, USD/CHF, NASDAQ 100 Index, S&P 500 Index",https://www.dailyforex.com/forex-technical-analysis/2024/11/weekly-forex-forecast-25th-november-30th-november-2024/220794,"Forex markets are seeing a strong US Dollar, which has climbed to a near 2-year high, weakening European currencies such as the British Pound and the Euro, while Bitcoin has climbed to new record highs just below $100,000."
"24/11/2024, 07:29 GMT0","Pairs in Focus - EUR/USD, AUD/USD, USD/CAD, USD/MXN, USD/CHN, CAD/JPY, Gold, NASDAQ 100",https://www.dailyforex.com/forex-technical-analysis/2024/11/pairs-in-focus-this-week-25th-november-30th-november-2024/220784,"EUR/USD breaks below 1.05 as USD strength dominates, AUD/USD and USD/CAD show short-term pullbacks, while gold and NASDAQ 100 continue their bullish momentum."
"22/11/2024, 05:00 GMT0",EUR/USD Forex Signal: Breaks Below Major Support Level,https://www.dailyforex.com/forex-technical-analysis/2024/11/eurusd-forex-signal-22-november-2024/220746,"During my daily analysis of the EUR/USD pair, we have broken below the 1.05 level, and this has made me stand up and pay attention."
"21/11/2024, 13:32 GMT0",EUR/USD Analysis: Consolidation Hints at Potential Strong Move,https://www.dailyforex.com/forex-technical-analysis/2024/11/eurusd-analysis-21-november-2024/220739,"Since the beginning of this week, the EUR/USD currency pair has been attempting to recover from its year-low, but rebound gains have not exceeded the 1.0609 level, and it is currently stabilizing around 1.0548 at the time of writing this analysis."
"21/11/2024, 08:05 GMT0",EUR/USD Forex Signal: Euro Falls as Geopolitical Risks Rise,https://www.dailyforex.com/forex-technical-analysis/2024/11/eurusd-signal-21-november-2024/220693,The EUR/USD exchange rate resumed its downtrend after the European Central Bank (ECB) warned about a potential debt crisis and slow growth in the region.
"21/11/2024, 07:54 GMT0","Forex Today: Bitcoin Just Shy of $100,000",https://www.dailyforex.com/forex-news/2024/11/forex-today-21-november-2024/220692,"Bitcoin Makes New Record High Above $98,000; US Dollar Bounces Back; UK Inflation Ticks Higher; Gold Gaining Firmly After Bounce"
"20/11/2024, 13:21 GMT0",EUR/USD Analysis: Rebounds but Remains Weak,https://www.dailyforex.com/forex-technical-analysis/2024/11/eurusd-analysis-20-november-2024/220674,"For four consecutive trading sessions, the EUR/USD currency pair has been attempting to rebound and recover from its lowest levels in a year, which reached the support level of 1.0496 at the end of last week."
"20/11/2024, 07:05 GMT0",EUR/USD Forex Signal: Early Signs of Bullish Double Bottom at $1.0500 Area,https://www.dailyforex.com/forex-technical-analysis/2024/11/eurusd-signal-20-november-2024/220643,"The post-US election rally in the US seems to have run out of steam, as many assets including the Euro start to form a potential bullish double bottom against the greenback."
"19/11/2024, 11:57 GMT0",EUR/USD Analysis: Recovers from Selling Pressure,https://www.dailyforex.com/forex-technical-analysis/2024/11/eurusd-analysis-19-november-2024/220617,"As this week's trading began, the turmoil caused by Trump's trade policies has somewhat subsided, allowing the EUR/USD currency pair to rebound, reaching 1.0607 at the time of writing this analysis."
"19/11/2024, 08:52 GMT0","EUR/USD Forex Signal: Crawls Back, But Downtrend is Still Intact",https://www.dailyforex.com/forex-technical-analysis/2024/11/eurusd-signal-19-november-2024/220587,"The EUR/USD exchange rate bounced back as the recent plunge eased. After falling to a multi-month low of 1.0497 last week, the pair rebounded to a high of 1.0590 ahead of European inflation data."
"18/11/2024, 12:45 GMT0",EUR/USD Analysis: Headed for Parity,https://www.dailyforex.com/forex-technical-analysis/2024/11/eurusd-analysis-18-november-2024/220548,"The US Federal Reserve's affirmation of not rushing to cut interest rates, coupled with Trump's election victory, has extended the US dollar's gains."
"18/11/2024, 07:49 GMT0",EUR/USD Forex Signal: Euro Sell-Off Nears a Key Support Level,https://www.dailyforex.com/forex-technical-analysis/2024/11/eurusd-signal-18-november-2024/220504,"The EUR/USD exchange rate tumbled to a low of 1.0495, its lowest level since October 6, 2023, as the risk-off sentiment continued following Donald Trump’s victory. It traded at 1.0540 on Monday morning, ahead of key economic data."
"17/11/2024, 13:22 GMT0",EUR/USD Weekly Forecast: Hard Fall and Long-Term Technical Support in Sight,https://www.dailyforex.com/forex-technical-analysis/2024/11/eurusd-weekly-forecast-18th-november-23th-november-2024/220499,The EUR/USD like many major currencies has found its value getting hammered lower as USD centric strength has galvanized global Forex amidst risk adverse trading and shifting behavioral sentiment.
"17/11/2024, 11:45 GMT0","Weekly Forex Forecast – EUR/USD, GBP/USD, USD/JPY, USD/CAD, Bitcoin, NASDAQ 100 Index",https://www.dailyforex.com/forex-technical-analysis/2024/11/weekly-forex-forecast-18th-november-23th-november-2024/220487,"Forex markets are seeing a strong US Dollar, which has climbed to a fresh yearly high, weakening European currencies such as the British Pound and the Euro, while Bitcoin climbs and stocks tumble."
"15/11/2024, 07:15 GMT0",EUR/USD Forecast: Euro Bounces from Crucial Support Level,https://www.dailyforex.com/forex-technical-analysis/2024/11/eurusd-forecast-15-november-2024/220444,"During my daily analysis of the EUR/USD pair, the first thing that I notice is the fact that we have bounce from a crucial large."
"14/11/2024, 13:11 GMT0",EUR/USD Analysis: Breaking a Crucial Support Level,https://www.dailyforex.com/forex-technical-analysis/2024/11/eurusd-analysis-14-november-2024/220428,Alongside the anticipated Trump policies - a stronger US dollar - US inflation figures came in stronger than expected.
"14/11/2024, 08:07 GMT0",EUR/USD Forex Signal: Path of the Least Resistance is Downward,https://www.dailyforex.com/forex-technical-analysis/2024/11/eurusd-signal-14-november-2024/220388,"The EUR/USD pair continued its strong bearish trend, falling to its lowest level since November 2023 after the US published the October inflation data."
"14/11/2024, 07:27 GMT0",Forex Today: Bitcoin Within Sight of $100k,https://www.dailyforex.com/forex-news/2024/11/forex-today-14-november-2024/220385,"Bitcoin Reaches $93k; US Annualized Inflation Rises to 2.6% as Expected, Fed Members Worry Over Cuts; US Dollar Index Rises to 2-Month High, With EUR/USD and USD/CAD Showing Year+ Highs; Non-US Stocks Weak on Trump Fears"
"13/11/2024, 12:49 GMT0",EUR/USD Analysis: Euro Heading Towards Its Lowest Levels of 2024,https://www.dailyforex.com/forex-technical-analysis/2024/11/eurusd-analysis-13-november-2024/220364,"The stronger US dollar policy is bringing more losses to the EUR/USD currency pair, which has reached the support level of 1.0595, the lowest for the currency pair in the forex market during 2024."
"13/11/2024, 08:20 GMT0",EUR/USD Forex Signal: Death Cross Points to Sustained Sell-Off,https://www.dailyforex.com/forex-technical-analysis/2024/11/eurusd-signal-13-november-2024/220328,The EUR/USD exchange rate continued its strong sell-off as the US dollar index surge gained momentum.
"13/11/2024, 08:00 GMT0",Forex Today: Trump Trade Cools as Markets Await US Inflation Data,https://www.dailyforex.com/forex-news/2024/11/forex-today-13-november-2024/220326,"US CPI Expected to Rise to 2.6%; Bitcoin Finally Hits $90,000 Before Retracing; All Major US Stock Market Indices Decline; US Dollar Index Rises to 2-Month High, With EUR/USD and USD/CAD Showing Year+ Highs ; Non-US Stocks at 3-Month Low on Trump Fears"
"12/11/2024, 12:30 GMT0",EUR/USD Analysis: Euro at 6-Month Lows,https://www.dailyforex.com/forex-technical-analysis/2024/11/eurusd-analysis-12-november-2024/220304,Trump's trade policies continue to support further gains for the US dollar against other major currencies.
"12/11/2024, 08:16 GMT0",EUR/USD Signal: Death Cross Pattern Points to More Downside,https://www.dailyforex.com/forex-technical-analysis/2024/11/eurusd-signal-12-november-2024/220264,"The EUR/USD exchange rate crashed to its lowest level since April and formed a death cross, pointing to more downside in the coming weeks."
"12/11/2024, 07:49 GMT0","Forex Today: Bitcoin Explodes to Almost $90,000",https://www.dailyforex.com/forex-news/2024/11/forex-today-12-november-2024/220260,"Bitcoin Trades Near $90,000; All Major US Stock Market Indices Again Trade at Record Highs; US Dollar Gains, ‘Trump Trade’ Seen Driving Markets"
"11/11/2024, 11:12 GMT0",EUR/USD Analysis: US Holiday May Weaken Liquidity,https://www.dailyforex.com/forex-technical-analysis/2024/11/eurusd-analysis-11-november-2024/220216,"At the end of last week, the Euro attempted to recover from its strong losses against the US Dollar amid the strength of the latter following Trump's re-election as US President."
"11/11/2024, 09:53 GMT0",EUR/USD Forecast: Holds Support Amid Market Fluctuations,https://www.dailyforex.com/forex-technical-analysis/2024/11/eurusd-forecast-11-november-2024/220211,"The Euro initially pulled back just a bit during the trading session on Friday. As we continue to see plenty of support underneath at the 1.07 level, I think we see so much in the way of support that it is going to be difficult to break down below here."
"11/11/2024, 08:40 GMT0",EUR/USD Forex Signal: Early Signs of Bullish Double Bottom at $1.0686,https://www.dailyforex.com/forex-technical-analysis/2024/11/eurusd-signal-11-november-2024/220193,"The Republican clean sweep of the US Presidency and Senate boosts the US Dollar strongly, sending this currency pair plummeting to a new multi-month low, although the price may be finding a bottom near $1.0700."
"10/11/2024, 11:26 GMT0","Weekly Forex Forecast – EUR/USD, USD/JPY, Bitcoin, NASDAQ 100 Index, S&P 500 Index",https://www.dailyforex.com/forex-technical-analysis/2024/11/weekly-forex-forecast-11th-november-16th-november-2024/220170,US Stock and cryptocurrency markets are enjoying powerful rallies following the Republican victories in the US general election last week. Several major US equity indices and Bitcoin are powering to new record highs.
"08/11/2024, 05:00 GMT0",EUR/USD Forecast: Acknowledging the Range,https://www.dailyforex.com/forex-technical-analysis/2024/11/eurusd-forecast-8-november-2024/220129,"As you can see, the Euro has rallied a bit during the trading session with the 1.07 level offering a significant amount of support."
"07/11/2024, 12:00 GMT0",EUR/USD Analysis: Euro Falls Most Since 2020,https://www.dailyforex.com/forex-technical-analysis/2024/11/eurusd-analysis-7-november-2024/220104,The EUR/USD exchange rate remained in focus following reports that former US President Donald Trump is set to return to the White House.
"07/11/2024, 07:46 GMT0",EUR/USD Forex Signal: US Dollar Surge Has Room to Run,https://www.dailyforex.com/forex-technical-analysis/2024/11/eurusd-signal-7-november-2024/220068,The EUR/USD exchange rate suffered a steep reversal as American stocks and Treasury yields surged.
"06/11/2024, 13:36 GMT0",EUR/USD Analysis: Rallies Amid Election Volatility,https://www.dailyforex.com/forex-technical-analysis/2024/11/eurusd-analysis-6-november-2024/220053,"With Trump securing the U.S. presidential win and Pennsylvania confirming his victory, forex market volatility remains heightened."
"06/11/2024, 08:09 GMT0",EUR/USD Forex Signal: Trump Victory Sends Dollar Soaring,https://www.dailyforex.com/forex-technical-analysis/2024/11/eurusd-signal-6-november-2024/220011,"The Republican clean sweep of the US Presidency and Senate boosts the US Dollar strongly, sending this currency pair plummeting to a new multi-month low, although the price may be finding a bottom near $1.0700."
"06/11/2024, 07:18 GMT0",Forex Today: Trump Wins Presidential Election,https://www.dailyforex.com/forex-news/2024/11/forex-today-6-november-2024/220007,"Trump Projected to Win Popular Vote and All Swing States, Republicans to Win Senate; US Stock Markets, US Dollar Gain on Trump Win; Bitcoin Hits Record High"
"05/11/2024, 11:11 GMT0",EUR/USD Analysis: Expectations of Significant Losses if Trump Wins,https://www.dailyforex.com/forex-technical-analysis/2024/11/eurusd-analysis-5-november-2024/219968,"The EUR/USD exchange rate has settled just below 1.09 ahead of the all-important US presidential vote, but a Donald Trump victory would spark major selling pressure on the currency pair once again."
"05/11/2024, 10:16 GMT0",EUR/USD Forex Signal: More Volatility Ahead of US Election and Fed,https://www.dailyforex.com/forex-technical-analysis/2024/11/eurusd-signal-5-november-2024/219959,The EUR/USD tilted upwards ahead of the upcoming US election and the Federal Reserve interest rate decision.
"04/11/2024, 13:57 GMT0",EUR/USD Analysis: Critical Trading Week,https://www.dailyforex.com/forex-technical-analysis/2024/11/eurusd-analysis-4-november-2024/219907,The Euro to the US Dollar (EUR/USD) exchange rate recorded its first weekly gain in five weeks after disappointing US jobs figures reinforced bets on a rate cut by the Federal Reserve.
"04/11/2024, 08:58 GMT0",EUR/USD Forex Signal: Bearish Engulfing Points to More Downside,https://www.dailyforex.com/forex-technical-analysis/2024/11/eurusd-signal-4-november-2024/219870,The EUR/USD pair pulled back as the US dollar index bounced back ahead of the upcoming US general election and the Federal Reserve meeting.
"03/11/2024, 11:49 GMT0","Pairs in Focus: USD/CHF, AUD/USD, EUR/USD, USD/CAD, USD/JPY, Gold, USD/MXN, Silver",https://www.dailyforex.com/forex-technical-analysis/2024/11/weekly-pairs-in-focus-4th-november-9th-november-2024/219847,"Forex weekly analysis highlights key trends and support/resistance for USD/CHF, EUR/USD, AUD/USD, and Gold amid US election volatility."
"03/11/2024, 11:12 GMT0","Weekly Forex Forecast – EUR/USD, AUD/JPY, Gold, S&P 500 Index",https://www.dailyforex.com/forex-technical-analysis/2024/11/weekly-forex-forecast-4th-november-9th-november-2024/219846,"Last week saw markets turn their attention to the US elections, which are too close to call, and the Federal Reserve’s policy meeting, which is almost unanimously expected to bring a rate cut of 0.25%."
"03/11/2024, 10:50 GMT0",EUR/USD Weekly Forecast: U.S Election and Federal Reserve Forex Show Coming,https://www.dailyforex.com/forex-technical-analysis/2024/11/eurusd-weekly-forecast-4th-november-9th-november-2024/219844,"The EUR/USD finished the week near the 1.08316 ratio, essentially returning to value the currency pair traversed on Wednesday, this as nervous financial institutions wait for the risk events that are coming."
"31/10/2024, 11:58 GMT0",EUR/USD Monthly Forecast: November 2024,https://www.dailyforex.com/forex-technical-analysis/2024/10/eurusd-monthly-forecast-november-2024/219773,"During the month of October, we have seen the euro fall hard against the US dollar."
"31/10/2024, 10:23 GMT0",EUR/USD Analysis: Recovery Attempts Before Key Events,https://www.dailyforex.com/forex-technical-analysis/2024/10/eurusd-analysis-31-october-2024/219755,"Oct 31, 2024, Analysis of euro price against the dollar EUR/USD"
"31/10/2024, 08:49 GMT0",EUR/USD Forex Signal: Euro Rallies Significantly on Wednesday,https://www.dailyforex.com/forex-technical-analysis/2024/10/eurusd--signal-31-october-2024/219736,"while I’m not necessarily too excited about the idea of owning the euro, the reality is that you have to trade the market that you have got."
"31/10/2024, 08:18 GMT0",EUR/USD Forex Signal: Stabilizes Ahead of US PCE and NFP Data,https://www.dailyforex.com/forex-technical-analysis/2024/10/eurusd-signal-31-october-2024/219730,"The EUR/USD pair bounced back after the European Union published a strong GDP report, and after the head of Bundesbank cautioned on rate cuts."
"30/10/2024, 11:54 GMT0",EUR/USD Analysis: Neutral Performance with a Bearish Bias,https://www.dailyforex.com/forex-technical-analysis/2024/10/eurusd-analysis-30-october-2024/219701,"Since the start of this week, the EUR/USD exchange rate has been trading in a neutral range with a slight bearish tendency, stabilizing around and below the support level at 1.0800."
"30/10/2024, 08:44 GMT0",EUR/USD Forecast: Euro Continues to Find Support Against Greenback,https://www.dailyforex.com/forex-technical-analysis/2024/10/eurusd-forecast-30-october-2024/219667,"During my daily analysis of the EUR/USD pair, I can see that the 1.08 level continues to be important."
"30/10/2024, 07:49 GMT0","EUR/USD Forex Signal: Sits at a Key Support, Bearish Breakout Likely",https://www.dailyforex.com/forex-technical-analysis/2024/10/eurusd-signal-30-october-2024/219662,The EUR/USD exchange rate’s sell-off stalled after the US published mixed consumer confidence and JOLTS job vacancy numbers.
"29/10/2024, 10:52 GMT0",EUR/USD Analysis: Downward Bias,https://www.dailyforex.com/forex-technical-analysis/2024/10/eurusd-analysis-29-october-2024/219626,"The previous weekend saw some recovery in the euro, suggesting that the dollar's appreciation trend may be nearing exhaustion."
"29/10/2024, 08:30 GMT0",EUR/USD Forecast: Euro Continues to Bounce at the Same Level,https://www.dailyforex.com/forex-technical-analysis/2024/10/eurusd-forecast-29-october-2024/219609,"During my daily analysis of the EUR/USD pair, the first thing I see is that we are hanging around the 1.08 level, an area that of course has been important multiple times."
"29/10/2024, 07:54 GMT0",EUR/USD Forex Signal: Signs of Bottoming Out After Month of Decline,https://www.dailyforex.com/forex-technical-analysis/2024/10/eurusd-signal-29-october-2024/219603,"After trading lower over the month of October, there are initial signs that the price is finding a floor ahead of the US Presidential Election next week."
"28/10/2024, 12:11 GMT0",EUR/USD Analysis: Bears Wait for Important Week,https://www.dailyforex.com/forex-technical-analysis/2024/10/eurusd-analysis-28-october-2024/219564,"A week before Fed officials meet to consider the appropriate pace of US interest rate cuts, three major reports are set to show underlying resilience in the US economy and a temporary slowdown in job growth."
"28/10/2024, 08:42 GMT0",EUR/USD Forex Signal: Euro Continues to See Questions Asked of It,https://www.dailyforex.com/forex-technical-analysis/2024/10/eurusd-signal-28-october-2024/219533,"In my daily analysis of the EUR/USD pair, the first thing I noticed was that we did try to rally a bit but gave back the gains in order to show signs of weakness."
"28/10/2024, 08:24 GMT0",EUR/USD Forex Signal: Bearish View Ahead of Key Economic Data,https://www.dailyforex.com/forex-technical-analysis/2024/10/eurusd-signal-28-october-2024/219531,The EUR/USD pair has been in a strong downtrend as the US dollar index and bond yields jumped to the highest level since July.
"27/10/2024, 07:29 GMT0","Pairs in Focus - EUR/USD, NASDAQ 100 Index, Gold, USD/CHF, NZD/USD, USD/MXN, USD/JPY, WTI Crude Oil",https://www.dailyforex.com/forex-technical-analysis/2024/10/weekly-pairs-in-focus-28th-october-2th-november-2024/219508,"The 27/10 forecast shows EUR/USD finding support, USD/CHF and NZD/USD facing resistance, while Gold and NASDAQ 100 remain bullish."
"25/10/2024, 05:29 GMT0",EUR/USD Forecast: Strong Support Near 1.08,https://www.dailyforex.com/forex-technical-analysis/2024/10/eurusd-forecast-25-october-2024/219474,"My daily analysis of the EUR/USD pair, the market is likely to continue to see a lot of volatility in this area as the 1.08 level is an area that is a large, round, psychologically significant figure, and an area that we have seen a lot of noise previously."
"24/10/2024, 10:43 GMT0",EUR/USD Signal: Euro Meltdown Continues,https://www.dailyforex.com/forex-technical-analysis/2024/10/eur-usd-signal-24-october-2024/219446,"Get the EUR/USD pair recommendation and buy and sell levels for today, October 24, 2024 here."
"24/10/2024, 08:43 GMT0",EUR/USD Analysis: Strong oversold levels,https://www.dailyforex.com/forex-technical-analysis/2024/10/eur-usd-analysis-24-october-2024/219432,"The downward trajectory of the euro against the US dollar currency pair EUR/USD is stronger, pushing the most popular currency pair in the forex market towards"
"24/10/2024, 07:25 GMT0",EUR/USD Forecast: Euro Continues to Struggle Against the US Dollar,https://www.dailyforex.com/forex-technical-analysis/2024/10/eurusd-forecast-24-october-2024/219413,The Euro was fairly noisy during the early hours on Wednesday as we continue to dance around just below the 1.08 level.
"23/10/2024, 09:43 GMT0",EUR/USD Analysis: Downward Trend Gains Strength,https://www.dailyforex.com/forex-technical-analysis/2024/10/eurusd-analysis-october-23-2024/219384,"Reducing expectations for further US rate cuts continues to drag on EUR/USD, with losses extending below the psychological support level of 1.0800 to the support level of 1.0792."
"23/10/2024, 08:04 GMT0",EUR/USD Forex Signal: Brief Rebound to Happen as it Hits Key Support,https://www.dailyforex.com/forex-technical-analysis/2024/10/eurusd-signal-23-october-2024/219375,The EUR/USD sell-off continued as US bond yields soared to the highest point in months as doubts about the next actions by the Federal Reserve rose.
"23/10/2024, 07:05 GMT0",EUR/USD Forecast: Euro Continues to Focus on a Major Level,https://www.dailyforex.com/forex-technical-analysis/2024/10/eurusd-forecast-23-october-2024/219363,"As I look at the Euro, the first thing I see is that we tried to rally a bit during the early hours on Tuesday, only to give up those gains and show signs of hesitation."
"22/10/2024, 09:08 GMT0",EUR/USD Analysis: Downward Forecast Remains Strongest,https://www.dailyforex.com/forex-technical-analysis/2024/10/eurusd-analysis-22-october-2024/219322,The Dollar and is Euro is trending downward against the US likely to incur further losses over the next five days.
"22/10/2024, 07:48 GMT0",EUR/USD Forex Signal: Bearish Trend to Continue for a While,https://www.dailyforex.com/forex-technical-analysis/2024/10/eurusd-signal-22-october-2024/219308,The EUR/USD exchange rate’s sell-off accelerated on Tuesday morning as the US dollar index continued its strong rally.
