date,country,event,impact,actual,forecast,previous
2024/08/23 00:00:00,JPY,BOJ Gov Ueda Speaks,Low Volatility Expected,,,
2024/08/23 01:00:00,SGD,Core CPI (YoY) (Jul),Moderate Volatility Expected,2.50%,2.90%,2.90%
2024/08/23 01:00:00,SGD,CPI (MoM) (Jul),Low Volatility Expected,-0.30%,,-0.20%
2024/08/23 01:00:00,SGD,CPI (YoY) (Jul),Moderate Volatility Expected,2.4%,2.5%,2.4%
2024/08/23 02:45:00,EUR,French Business Survey (Aug),Low Volatility Expected,99,96,95
2024/08/23 07:30:00,USD,Building Permits (Jul),Moderate Volatility Expected,1.406M,1.396M,1.454M
2024/08/23 07:30:00,USD,Building Permits (MoM) (Jul),Low Volatility Expected,-3.3%,,3.9%
2024/08/23 07:30:00,INR,Bank Loan Growth,Low Volatility Expected,13.6%,,13.7%
2024/08/23 07:30:00,INR,Deposit Growth,Low Volatility Expected,10.9%,,10.6%
2024/08/23 07:30:00,INR,"FX Reserves, USD",Low Volatility Expected,674.66B,,670.12B
2024/08/23 08:00:00,USD,FOMC Member Bostic Speaks,Moderate Volatility Expected,,,
2024/08/23 08:00:00,USD,Jackson Hole Symposium,Moderate Volatility Expected,,,
2024/08/23 08:30:00,CAD,Core Retail Sales (MoM) (Jun),Moderate Volatility Expected,0.3%,-0.2%,-1.2%
2024/08/23 08:30:00,CAD,Corporate Profits (QoQ),Low Volatility Expected,1.5%,,1.0%
2024/08/23 08:30:00,CAD,Manufacturing Sales (MoM) (Jul),Low Volatility Expected,1.1%,,-2.1%
2024/08/23 08:30:00,CAD,Retail Sales (MoM) (Jun),Moderate Volatility Expected,-0.3%,-0.3%,-0.8%
2024/08/23 10:00:00,USD,Fed Chair Powell Speaks,High Volatility Expected,,,
2024/08/23 10:00:00,USD,New Home Sales (Jul),High Volatility Expected,739K,624K,668K
2024/08/23 10:00:00,USD,New Home Sales (MoM) (Jul),Moderate Volatility Expected,10.6%,1.0%,0.3%
2024/08/23 11:00:00,GBP,BoE Gov Bailey Speaks,Moderate Volatility Expected,,,
2024/08/23 12:30:00,USD,Fed Goolsbee Speaks,Low Volatility Expected,,,
2024/08/23 13:00:00,USD,U.S. Baker Hughes Oil Rig Count,Moderate Volatility Expected,483,,483
2024/08/23 13:00:00,USD,U.S. Baker Hughes Total Rig Count,Moderate Volatility Expected,585,,586
2024/08/23 13:45:00,USD,Fed Goolsbee Speaks,Low Volatility Expected,,,
2024/08/23 14:15:00,USD,Fed Goolsbee Speaks,Low Volatility Expected,,,
2024/08/23 15:00:00,GBP,BoE Gov Bailey Speaks,Moderate Volatility Expected,,,
2024/08/23 15:30:00,GBP,CFTC GBP speculative net positions,Moderate Volatility Expected,67.5K,,47.8K
2024/08/23 15:30:00,USD,CFTC Aluminium speculative net positions,Low Volatility Expected,2.3K,,2.2K
2024/08/23 15:30:00,USD,CFTC Copper speculative net positions,Low Volatility Expected,20.3K,,15.8K
2024/08/23 15:30:00,USD,CFTC Corn speculative net positions,Low Volatility Expected,-165.3K,,-154.0K
2024/08/23 15:30:00,USD,CFTC Crude Oil speculative net positions,Moderate Volatility Expected,222.3K,,231.5K
2024/08/23 15:30:00,USD,CFTC Gold speculative net positions,Moderate Volatility Expected,291.3K,,267.3K
2024/08/23 15:30:00,USD,CFTC Nasdaq 100 speculative net positions,Moderate Volatility Expected,11.4K,,8.5K
2024/08/23 15:30:00,USD,CFTC Natural Gas speculative net positions,Low Volatility Expected,-81.3K,,-80.8K
2024/08/23 15:30:00,USD,CFTC S&P 500 speculative net positions,Moderate Volatility Expected,-84.8K,,-23.5K
2024/08/23 15:30:00,USD,CFTC Silver speculative net positions,Low Volatility Expected,49.3K,,45.3K
2024/08/23 15:30:00,USD,CFTC Soybeans speculative net positions,Low Volatility Expected,-178.9K,,-165.7K
2024/08/23 15:30:00,USD,CFTC Wheat speculative net positions,Low Volatility Expected,-25.7K,,-38.9K
2024/08/23 15:30:00,CAD,CFTC CAD speculative net positions,Low Volatility Expected,-164.4K,,-179.6K
2024/08/23 15:30:00,CHF,CFTC CHF speculative net positions,Low Volatility Expected,-25.7K,,-21.7K
2024/08/23 15:30:00,AUD,CFTC AUD speculative net positions,Moderate Volatility Expected,-38.9K,,-42.6K
2024/08/23 15:30:00,BRL,CFTC BRL speculative net positions,Moderate Volatility Expected,-51.0K,,-53.8K
2024/08/23 15:30:00,JPY,CFTC JPY speculative net positions,Moderate Volatility Expected,23.6K,,23.1K
2024/08/23 15:30:00,NZD,CFTC NZD speculative net positions,Low Volatility Expected,-13.8K,,-15.6K
2024/08/23 15:30:00,EUR,CFTC EUR speculative net positions,Moderate Volatility Expected,56.0K,,27.0K
2024/08/23 16:30:00,RUB,CFTC RUB speculative positions,Moderate Volatility Expected,,,-21.3K
2024/08/24 08:00:00,USD,Jackson Hole Symposium,Moderate Volatility Expected,,,
2024/08/24 12:25:00,EUR,ECB's Lane Speaks,Moderate Volatility Expected,,,
2024/08/26 01:00:00,SGD,Industrial Production (YoY) (Jul),Low Volatility Expected,1.8%,-1.1%,-4.3%
2024/08/26 01:00:00,SGD,Industrial Production (MoM) (Jul),Low Volatility Expected,10.1%,5.3%,-4.3%
2024/08/26 02:30:00,CHF,Employment Level (Q2),Moderate Volatility Expected,5.499M,,5.481M
2024/08/26 03:00:00,EUR,Spanish PPI (YoY) (Jul),Low Volatility Expected,-1.4%,,-3.2%
2024/08/26 04:00:00,EUR,German Business Expectations (Aug),Moderate Volatility Expected,86.8,86.5,87.0
2024/08/26 04:00:00,EUR,German Current Assessment (Aug),Moderate Volatility Expected,86.5,86.5,87.1
2024/08/26 04:00:00,EUR,German Ifo Business Climate Index (Aug),Moderate Volatility Expected,86.6,86.0,87.0
2024/08/26 07:00:00,BRL,FGV Consumer confidence (Aug),Low Volatility Expected,93.2,,92.9
2024/08/26 07:25:00,BRL,BCB Focus Market Readout,Low Volatility Expected,,,
2024/08/26 07:30:00,BRL,Current Account (USD) (Jul),Low Volatility Expected,-5.20B,-4.00B,-4.40B
2024/08/26 07:30:00,BRL,Foreign direct investment (USD) (Jul),Low Volatility Expected,7.30B,6.00B,6.30B
2024/08/26 08:30:00,USD,Core Durable Goods Orders (MoM) (Jul),Moderate Volatility Expected,-0.2%,0.0%,0.1%
2024/08/26 08:30:00,USD,Durable Goods Orders (MoM) (Jul),High Volatility Expected,9.9%,4.0%,-6.9%
2024/08/26 08:30:00,USD,Durables Excluding Defense (MoM) (Jul),Low Volatility Expected,10.4%,,-7.5%
2024/08/26 08:30:00,USD,Goods Orders Non Defense Ex Air (MoM) (Jul),Low Volatility Expected,-0.1%,0.0%,0.5%
2024/08/26 09:00:00,EUR,French 12-Month BTF Auction,Low Volatility Expected,2.999%,,3.029%
2024/08/26 09:00:00,EUR,French 3-Month BTF Auction,Low Volatility Expected,3.372%,,3.502%
2024/08/26 09:00:00,EUR,French 6-Month BTF Auction,Low Volatility Expected,3.285%,,3.358%
2024/08/26 10:30:00,USD,Atlanta Fed GDPNow (Q3),Moderate Volatility Expected,2.0%,2.0%,2.0%
2024/08/26 10:30:00,USD,Dallas Fed Mfg Business Index (Aug),Low Volatility Expected,-9.7,,-17.5
2024/08/26 11:30:00,USD,3-Month Bill Auction,Low Volatility Expected,4.980%,,5.055%
2024/08/26 11:30:00,USD,6-Month Bill Auction,Low Volatility Expected,4.685%,,4.770%
2024/08/26 19:01:00,GBP,BRC Shop Price Index (YoY),Low Volatility Expected,-0.3%,,0.2%
2024/08/26 19:50:00,JPY,Corporate Services Price Index (CSPI) (YoY),Low Volatility Expected,2.8%,2.9%,3.1%
2024/08/26 21:30:00,CNY,Chinese Industrial profit YTD (Jul),Low Volatility Expected,3.6%,,3.5%
2024/08/27 01:00:00,JPY,BoJ Core CPI (YoY),Moderate Volatility Expected,1.8%,2.1%,2.1%
2024/08/27 02:00:00,EUR,German GDP (YoY) (Q2),Moderate Volatility Expected,0.0%,-0.1%,-0.2%
2024/08/27 02:00:00,EUR,German GDP (QoQ) (Q2),High Volatility Expected,-0.1%,-0.1%,0.2%
2024/08/27 02:00:00,EUR,GfK German Consumer Climate (Sep),Moderate Volatility Expected,-22.0,-18.3,-18.6
2024/08/27 04:30:00,HKD,Exports (MoM) (Jul),Low Volatility Expected,13.1%,,10.7%
2024/08/27 04:30:00,HKD,Imports (MoM) (Jul),Low Volatility Expected,9.9%,,9.0%
2024/08/27 04:30:00,HKD,Trade Balance (Jul),Low Volatility Expected,-21.8B,,-55.7B
2024/08/27 05:40:00,EUR,Italian 2-Year CTZ Auction,Low Volatility Expected,2.890%,,3.100%
2024/08/27 05:40:00,EUR,German 5-Year Bobl Auction,Low Volatility Expected,2.170%,,2.090%
2024/08/27 06:00:00,GBP,CBI Distributive Trades Survey (Aug),Low Volatility Expected,-27,-11,-43
2024/08/27 07:00:00,BRL,Mid-Month CPI (MoM) (Aug),Low Volatility Expected,0.19%,0.20%,0.30%
2024/08/27 07:00:00,BRL,Mid-Month CPI (YoY) (Aug),Low Volatility Expected,4.35%,4.38%,4.45%
2024/08/27 08:30:00,CAD,Wholesale Sales (MoM) (Jul),Moderate Volatility Expected,-1.1%,,-0.6%
2024/08/27 08:55:00,USD,Redbook (YoY),Low Volatility Expected,5.0%,,4.9%
2024/08/27 09:00:00,USD,House Price Index (YoY) (Jun),Low Volatility Expected,5.1%,,5.9%
2024/08/27 09:00:00,USD,House Price Index (MoM) (Jun),Low Volatility Expected,-0.1%,0.1%,0.0%
2024/08/27 09:00:00,USD,House Price Index (Jun),Low Volatility Expected,424.5,,424.8
2024/08/27 09:00:00,USD,S&P/CS HPI Composite - 20 s.a. (MoM) (Jun),Low Volatility Expected,0.4%,0.3%,0.4%
2024/08/27 09:00:00,USD,S&P/CS HPI Composite - 20 n.s.a. (MoM) (Jun),Moderate Volatility Expected,0.6%,,1.0%
2024/08/27 09:00:00,USD,S&P/CS HPI Composite - 20 n.s.a. (YoY) (Jun),Moderate Volatility Expected,6.5%,6.2%,6.9%
2024/08/27 10:00:00,USD,CB Consumer Confidence (Aug),High Volatility Expected,103.3,100.9,101.9
2024/08/27 10:00:00,USD,Richmond Manufacturing Index (Aug),Low Volatility Expected,-19,-14,-17
2024/08/27 10:00:00,USD,Richmond Manufacturing Shipments (Aug),Low Volatility Expected,-15,,-21
2024/08/27 10:00:00,USD,Richmond Services Index (Aug),Low Volatility Expected,-11,,5
2024/08/27 10:00:00,EUR,German Buba President Nagel Speaks,Moderate Volatility Expected,,,
2024/08/27 10:30:00,USD,Dallas Fed Services Revenues (Aug),Low Volatility Expected,8.7,,7.7
2024/08/27 10:30:00,USD,Texas Services Sector Outlook (Aug),Low Volatility Expected,-7.7,,-0.1
2024/08/27 13:00:00,USD,2-Year Note Auction,Moderate Volatility Expected,3.874%,,4.434%
2024/08/27 13:00:00,USD,M2 Money Supply (MoM) (Jul),Low Volatility Expected,21.05T,,21.03T
2024/08/27 16:30:00,USD,API Weekly Crude Oil Stock,Moderate Volatility Expected,-3.400M,-3.000M,0.347M
2024/08/27 21:30:00,AUD,Construction Work Done (QoQ) (Q2),Moderate Volatility Expected,0.1%,0.8%,-2.0%
2024/08/27 21:30:00,AUD,Monthly CPI Indicator (YoY) (Jul),Low Volatility Expected,3.50%,3.40%,3.80%
2024/08/28 01:00:00,JPY,Coincident Indicator (MoM) (Jun),Low Volatility Expected,-3.9%,-3.4%,1.9%
2024/08/28 01:00:00,JPY,Leading Index (Jun),Low Volatility Expected,109.0,108.6,111.2
2024/08/28 01:00:00,JPY,Leading Index (MoM) (Jun),Low Volatility Expected,-2.1%,-2.6%,0.3%
2024/08/28 01:15:00,USD,Fed Waller Speaks,Moderate Volatility Expected,,,
2024/08/28 02:45:00,EUR,French Consumer Confidence (Aug),Low Volatility Expected,92,92,91
2024/08/28 04:00:00,EUR,Italian Industrial Sales (MoM) (Jun),Low Volatility Expected,0.10%,,-1.00%
2024/08/28 04:00:00,EUR,Italian Industrial Sales (YoY) (Jun),Low Volatility Expected,-3.70%,,-4.80%
2024/08/28 04:00:00,CHF,ZEW Expectations (Aug),Low Volatility Expected,-3.4,,9.4
2024/08/28 04:00:00,EUR,M3 Money Supply (YoY) (Jul),Low Volatility Expected,2.3%,2.7%,2.2%
2024/08/28 04:00:00,EUR,M3 Money Supply (Jul),Low Volatility Expected,"16,340.1B",,"16,376.6B"
2024/08/28 04:00:00,EUR,Loans to Non Financial Corporations (Jul),Low Volatility Expected,0.6%,,0.7%
2024/08/28 04:00:00,EUR,Private Sector Loans (YoY),Low Volatility Expected,0.5%,0.5%,0.3%
2024/08/28 06:00:00,EUR,Italian 6-Month BOT Auction,Low Volatility Expected,3.247%,,3.518%
2024/08/28 06:00:00,EUR,France Jobseekers Total (Jul),Moderate Volatility Expected,"2,808.4K",,"2,834.5K"
2024/08/28 06:00:00,EUR,Eurogroup Meetings,Moderate Volatility Expected,,,
2024/08/28 07:00:00,USD,MBA 30-Year Mortgage Rate,Low Volatility Expected,6.44%,,6.50%
2024/08/28 07:00:00,USD,MBA Mortgage Applications (WoW),Low Volatility Expected,0.5%,,-10.1%
2024/08/28 07:00:00,USD,MBA Purchase Index,Low Volatility Expected,131.8,,130.6
2024/08/28 07:00:00,USD,Mortgage Market Index,Low Volatility Expected,226.9,,225.8
2024/08/28 07:00:00,USD,Mortgage Refinance Index,Low Volatility Expected,753.8,,754.4
2024/08/28 08:15:00,GBP,BoE MPC Member Mann Speaks,Moderate Volatility Expected,,,
2024/08/28 10:30:00,USD,Crude Oil Inventories,High Volatility Expected,-0.846M,-2.700M,-4.649M
2024/08/28 10:30:00,USD,EIA Refinery Crude Runs (WoW),Low Volatility Expected,0.175M,,0.222M
2024/08/28 10:30:00,USD,Crude Oil Imports,Low Volatility Expected,0.282M,,0.078M
2024/08/28 10:30:00,USD,Cushing Crude Oil Inventories,Moderate Volatility Expected,-0.668M,,-0.560M
2024/08/28 10:30:00,USD,Distillate Fuel Production,Low Volatility Expected,0.110M,,0.123M
2024/08/28 10:30:00,USD,EIA Weekly Distillates Stocks,Low Volatility Expected,0.275M,-0.550M,-3.312M
2024/08/28 10:30:00,USD,Gasoline Production,Low Volatility Expected,-0.156M,,0.046M
2024/08/28 10:30:00,USD,Heating Oil Stockpiles,Low Volatility Expected,-1.189M,,0.265M
2024/08/28 10:30:00,USD,EIA Weekly Refinery Utilization Rates (WoW),Low Volatility Expected,1.0%,,0.8%
2024/08/28 10:30:00,USD,Gasoline Inventories,Low Volatility Expected,-2.203M,-1.500M,-1.606M
2024/08/28 12:00:00,RUB,Business Confidence (Aug),Low Volatility Expected,7.1,,7.0
2024/08/28 12:00:00,RUB,Industrial Production (YoY) (Jul),Low Volatility Expected,3.3%,2.2%,2.7%
2024/08/28 12:00:00,RUB,GDP Monthly (YoY) (Jul),Moderate Volatility Expected,3.4%,,3.0%
2024/08/28 12:00:00,RUB,Russian Real Wage Growth (YoY) (Jun),Low Volatility Expected,6.2%,8.3%,8.8%
2024/08/28 12:00:00,RUB,Retail Sales (YoY) (Jul),Moderate Volatility Expected,6.1%,5.4%,6.3%
2024/08/28 12:00:00,RUB,Unemployment Rate (Jul),Moderate Volatility Expected,2.4%,2.4%,2.4%
2024/08/28 13:00:00,USD,5-Year Note Auction,Moderate Volatility Expected,3.645%,,4.121%
2024/08/28 13:30:00,BRL,CAGED Net Payroll Jobs (Jul),Low Volatility Expected,188.02K,190.00K,201.71K
2024/08/28 13:30:00,BRL,Foreign Exchange Flows,Low Volatility Expected,-2.660B,,-0.573B
2024/08/28 18:00:00,USD,FOMC Member Bostic Speaks,Moderate Volatility Expected,,,
2024/08/28 19:50:00,JPY,Foreign Bonds Buying,Low Volatility Expected,"1,542.9B",,"1,850.9B"
2024/08/28 19:50:00,JPY,Foreign Investments in Japanese Stocks,Low Volatility Expected,-438.3B,,-47.5B
2024/08/28 21:00:00,NZD,ANZ Business Confidence (Aug),Low Volatility Expected,50.6,,27.1
2024/08/28 21:00:00,NZD,NBNZ Own Activity (Aug),Low Volatility Expected,37.1%,,16.3%
2024/08/28 21:30:00,AUD,Building Capital Expenditure (MoM) (Q2),Low Volatility Expected,-3.8%,,-0.9%
2024/08/28 21:30:00,AUD,Plant/Machinery Capital Expenditure (QoQ) (Q2),Low Volatility Expected,-0.5%,,3.7%
2024/08/28 21:30:00,AUD,Private New Capital Expenditure (QoQ) (Q2),Moderate Volatility Expected,-2.2%,0.9%,1.9%
2024/08/28 23:35:00,JPY,2-Year JGB Auction,Low Volatility Expected,0.385%,,0.057%
2024/08/29 01:00:00,JPY,Household Confidence (Aug),Low Volatility Expected,36.7,36.9,36.7
2024/08/29 02:00:00,GBP,Car Registration (MoM) (Jul),Low Volatility Expected,-17.7%,,21.4%
2024/08/29 02:00:00,GBP,Car Registration (YoY) (Jul),Low Volatility Expected,2.5%,,1.1%
2024/08/29 02:00:00,EUR,Italian Car Registration (YoY) (Jul),Low Volatility Expected,4.7%,,15.1%
2024/08/29 02:00:00,EUR,Italian Car Registration (MoM) (Jul),Low Volatility Expected,-21.9%,,14.7%
2024/08/29 02:00:00,EUR,German Car Registration (YoY) (Jul),Low Volatility Expected,-2.1%,,6.1%
2024/08/29 02:00:00,EUR,German Car Registration (MoM) (Jul),Low Volatility Expected,-19.9%,,25.8%
2024/08/29 02:00:00,EUR,French Car Registration (YoY) (Jul),Low Volatility Expected,-2.3%,,-4.8%
2024/08/29 02:00:00,EUR,French Car Registration (MoM) (Jul),Low Volatility Expected,-30.6%,,28.6%
2024/08/29 03:00:00,EUR,Core CPI (YoY) (Aug),Low Volatility Expected,2.7%,,2.8%
2024/08/29 03:00:00,EUR,Spanish CPI (MoM) (Aug),Low Volatility Expected,0.0%,0.1%,-0.5%
2024/08/29 03:00:00,EUR,Spanish CPI (YoY) (Aug),Moderate Volatility Expected,2.2%,2.4%,2.8%
2024/08/29 03:00:00,EUR,Spanish HICP (MoM) (Aug),Low Volatility Expected,0.0%,0.2%,-0.7%
2024/08/29 03:00:00,EUR,Spanish HICP (YoY) (Aug),Moderate Volatility Expected,2.4%,2.5%,2.9%
2024/08/29 03:15:00,EUR,ECB's Schnabel Speaks,Moderate Volatility Expected,,,
2024/08/29 04:00:00,EUR,Baden Wuerttemberg CPI (YoY) (Aug),Low Volatility Expected,1.5%,,2.1%
2024/08/29 04:00:00,EUR,Baden Wuerttemberg CPI (MoM) (Aug),Low Volatility Expected,-0.3%,,0.3%
2024/08/29 04:00:00,EUR,Bavaria CPI (MoM) (Aug),Low Volatility Expected,-0.1%,,0.3%
2024/08/29 04:00:00,EUR,Bavaria CPI (YoY) (Aug),Low Volatility Expected,2.1%,,2.5%
2024/08/29 04:00:00,EUR,Brandenburg CPI (YoY) (Aug),Low Volatility Expected,1.7%,,2.6%
2024/08/29 04:00:00,EUR,Brandenburg CPI (MoM) (Aug),Low Volatility Expected,-0.2%,,0.3%
2024/08/29 04:00:00,EUR,Hesse CPI (YoY) (Aug),Low Volatility Expected,1.5%,,1.8%
2024/08/29 04:00:00,EUR,Hesse CPI (MoM) (Aug),Low Volatility Expected,-0.1%,,0.3%
2024/08/29 04:00:00,EUR,North Rhine Westphalia CPI (MoM) (Aug),Low Volatility Expected,-0.3%,,0.3%
2024/08/29 04:00:00,EUR,North Rhine Westphalia CPI (YoY) (Aug),Low Volatility Expected,1.7%,,2.3%
2024/08/29 04:00:00,EUR,Saxony CPI (YoY) (Aug),Low Volatility Expected,2.6%,,3.1%
2024/08/29 04:00:00,EUR,Saxony CPI (MoM) (Aug),Low Volatility Expected,-0.2%,,0.6%
2024/08/29 05:00:00,EUR,Business and Consumer Survey (Aug),Low Volatility Expected,96.6,95.8,96.0
2024/08/29 05:00:00,EUR,Business Climate (Aug),Low Volatility Expected,-0.62,,-0.61
2024/08/29 05:00:00,EUR,Consumer Confidence (Aug),Low Volatility Expected,-13.5,-13.4,-13.0
2024/08/29 05:00:00,EUR,Consumer Inflation Expectation (Aug),Low Volatility Expected,11.3,,11.3
2024/08/29 05:00:00,EUR,Selling Price Expectations (Aug),Low Volatility Expected,6.1,,6.7
2024/08/29 05:00:00,EUR,Services Sentiment (Aug),Low Volatility Expected,6.3,5.2,5.0
2024/08/29 05:00:00,EUR,Industrial Sentiment (Aug),Low Volatility Expected,-9.7,-10.6,-10.4
2024/08/29 05:15:00,EUR,ECB's Lane Speaks,Moderate Volatility Expected,,,
2024/08/29 05:30:00,EUR,Italian 10-Year BTP Auction,Moderate Volatility Expected,3.68%,,3.76%
2024/08/29 05:30:00,EUR,Italian 5-Year BTP Auction,Low Volatility Expected,3.08%,,3.14%
2024/08/29 05:30:00,ZAR,PPI (YoY) (Jul),Low Volatility Expected,4.2%,,4.6%
2024/08/29 05:30:00,ZAR,PPI (MoM) (Jul),Low Volatility Expected,-0.2%,,-0.3%
2024/08/29 06:00:00,EUR,Eurogroup Meetings,Moderate Volatility Expected,,,
2024/08/29 07:00:00,EUR,Spanish Business Confidence (Jul),Low Volatility Expected,-3.6,,-4.2
2024/08/29 07:00:00,BRL,IGP-M Inflation Index (MoM) (Aug),Low Volatility Expected,0.29%,0.46%,0.61%
2024/08/29 07:30:00,BRL,Bank lending (MoM) (Jul),Low Volatility Expected,0.2%,,1.4%
2024/08/29 08:00:00,EUR,German CPI (MoM) (Aug),High Volatility Expected,-0.1%,0.0%,0.3%
2024/08/29 08:00:00,EUR,German CPI (YoY) (Aug),Moderate Volatility Expected,1.9%,2.1%,2.3%
2024/08/29 08:00:00,EUR,German HICP (MoM) (Aug),Low Volatility Expected,-0.2%,0.0%,0.5%
2024/08/29 08:00:00,EUR,German HICP (YoY) (Aug),Low Volatility Expected,2.0%,2.3%,2.6%
2024/08/29 08:00:00,BRL,Brazilian PPI (MoM) (Jul),Low Volatility Expected,1.58%,,1.26%
2024/08/29 08:30:00,USD,Continuing Jobless Claims,Moderate Volatility Expected,"1,868K","1,870K","1,855K"
2024/08/29 08:30:00,USD,Core PCE Prices (Q2),Moderate Volatility Expected,2.80%,2.90%,3.70%
2024/08/29 08:30:00,USD,Corporate Profits (QoQ) (Q2),Low Volatility Expected,1.7%,,-2.7%
2024/08/29 08:30:00,USD,GDP (QoQ) (Q2),High Volatility Expected,3.0%,2.8%,1.4%
2024/08/29 08:30:00,USD,GDP Price Index (QoQ) (Q2),Moderate Volatility Expected,2.5%,2.3%,3.1%
2024/08/29 08:30:00,USD,GDP Sales (Q2),Low Volatility Expected,2.2%,2.0%,1.8%
2024/08/29 08:30:00,USD,Goods Trade Balance (Jul),Moderate Volatility Expected,-102.66B,-97.70B,-96.56B
2024/08/29 08:30:00,USD,Initial Jobless Claims,High Volatility Expected,231K,232K,233K
2024/08/29 08:30:00,USD,Jobless Claims 4-Week Avg.,Low Volatility Expected,231.50K,,236.25K
2024/08/29 08:30:00,USD,PCE Prices (Q2),Low Volatility Expected,2.5%,2.6%,3.4%
2024/08/29 08:30:00,USD,Real Consumer Spending (Q2),Low Volatility Expected,2.9%,2.3%,1.5%
2024/08/29 08:30:00,USD,Retail Inventories Ex Auto (Jul),Moderate Volatility Expected,0.5%,,0.3%
2024/08/29 08:30:00,USD,Wholesale Inventories (MoM),Low Volatility Expected,0.3%,0.3%,0.1%
2024/08/29 08:30:00,CAD,Average Weekly Earnings (YoY) (Jun),Low Volatility Expected,3.99%,,4.11%
2024/08/29 08:30:00,CAD,Current Account (Q2),Moderate Volatility Expected,-8.5B,-6.0B,-5.4B
2024/08/29 09:00:00,RUB,Central Bank reserves (USD),Low Volatility Expected,614.5B,,609.9B
2024/08/29 10:00:00,USD,Pending Home Sales (MoM) (Jul),Moderate Volatility Expected,-5.5%,0.2%,4.8%
2024/08/29 10:00:00,USD,Pending Home Sales Index (Jul),Low Volatility Expected,70.2,,74.3
2024/08/29 10:30:00,USD,Natural Gas Storage,Low Volatility Expected,35B,33B,35B
2024/08/29 11:30:00,USD,4-Week Bill Auction,Low Volatility Expected,5.170%,,5.240%
2024/08/29 11:30:00,USD,8-Week Bill Auction,Low Volatility Expected,5.100%,,5.125%
2024/08/29 12:00:00,CHF,SNB Chairman Thomas Jordan speaks,Moderate Volatility Expected,,,
2024/08/29 13:00:00,USD,7-Year Note Auction,Moderate Volatility Expected,3.770%,,4.162%
2024/08/29 13:00:00,EUR,German Buba President Nagel Speaks,Moderate Volatility Expected,,,
2024/08/29 15:30:00,USD,FOMC Member Bostic Speaks,Moderate Volatility Expected,,,
2024/08/29 16:30:00,USD,Fed's Balance Sheet,Moderate Volatility Expected,"7,123B",,"7,194B"
2024/08/29 16:30:00,USD,Reserve Balances with Federal Reserve Banks,Low Volatility Expected,3.245T,,3.359T
2024/08/29 18:45:00,NZD,Building Consents (MoM) (Jul),Low Volatility Expected,26.2%,,-17.0%
2024/08/29 19:00:00,KRW,Industrial Production (MoM) (Jul),Low Volatility Expected,-3.6%,-0.4%,0.7%
2024/08/29 19:00:00,KRW,Industrial Production (YoY) (Jul),Low Volatility Expected,5.5%,7.0%,3.8%
2024/08/29 19:00:00,KRW,Retail Sales (MoM) (Jul),Low Volatility Expected,-1.9%,,1.0%
2024/08/29 19:00:00,KRW,Service Sector Output (MoM) (Jul),Low Volatility Expected,0.7%,,0.3%
2024/08/29 19:30:00,JPY,CPI Tokyo Ex Food & Energy (YoY) (Aug),Low Volatility Expected,1.6%,,1.1%
2024/08/29 19:30:00,JPY,Jobs/applications ratio (Jul),Low Volatility Expected,1.24,1.23,1.23
2024/08/29 19:30:00,JPY,Tokyo Core CPI (YoY) (Aug),Moderate Volatility Expected,2.4%,2.2%,2.2%
2024/08/29 19:30:00,JPY,Tokyo CPI (YoY) (Aug),Low Volatility Expected,2.6%,,2.2%
2024/08/29 19:30:00,JPY,CPI Tokyo Ex Food and Energy (MoM) (Aug),Low Volatility Expected,0.5%,,0.2%
2024/08/29 19:30:00,JPY,Unemployment Rate (Jul),Low Volatility Expected,2.7%,2.5%,2.5%
2024/08/29 19:50:00,JPY,Industrial Production (MoM) (Jul),Moderate Volatility Expected,2.8%,3.6%,-4.2%
2024/08/29 19:50:00,JPY,Industrial Production forecast 1m ahead (MoM) (Aug),Low Volatility Expected,2.2%,,6.5%
2024/08/29 19:50:00,JPY,Industrial Production forecast 2m ahead (MoM) (Sep),Low Volatility Expected,-3.3%,,0.7%
2024/08/29 19:50:00,JPY,Large Retailers' Sales (MoM) (Jul),Low Volatility Expected,0.2%,,0.6%
2024/08/29 19:50:00,JPY,Large Scale Retail Sales YoY (YoY) (Jul),Low Volatility Expected,1.0%,,7.0%
2024/08/29 19:50:00,JPY,Retail Sales (YoY) (Jul),Low Volatility Expected,2.6%,2.8%,3.8%
2024/08/29 21:30:00,AUD,Housing Credit (Jul),Low Volatility Expected,0.5%,,0.4%
2024/08/29 21:30:00,AUD,Private Sector Credit (MoM) (Jul),Low Volatility Expected,0.5%,0.5%,0.6%
2024/08/29 21:30:00,AUD,Retail Sales (MoM) (Jul),Moderate Volatility Expected,0.0%,0.3%,0.5%
2024/08/29 22:00:00,SGD,Bank Lending (Jul),Low Volatility Expected,801.2B,,803.6B
2024/08/29 23:00:00,NZD,M3 Money Supply (Jul),Low Volatility Expected,416.1B,,412.9B
2024/08/30 01:00:00,JPY,Construction Orders (YoY) (Jul),Low Volatility Expected,62.8%,,-19.7%
2024/08/30 01:00:00,JPY,Housing Starts (YoY) (Jul),Low Volatility Expected,-0.2%,-1.1%,-6.7%
2024/08/30 01:30:00,EUR,French Non-Farm Payrolls (QoQ) (Q2),Low Volatility Expected,0.0%,0.0%,0.0%
2024/08/30 02:00:00,GBP,Nationwide HPI (YoY) (Aug),Moderate Volatility Expected,2.4%,2.9%,2.1%
2024/08/30 02:00:00,GBP,Nationwide HPI (MoM) (Aug),Moderate Volatility Expected,-0.2%,0.2%,0.3%
2024/08/30 02:00:00,EUR,German Import Price Index (MoM) (Jul),Low Volatility Expected,-0.4%,0.1%,0.4%
2024/08/30 02:00:00,EUR,German Import Price Index (YoY) (Jul),Low Volatility Expected,0.9%,1.5%,0.7%
2024/08/30 02:00:00,ZAR,M3 Money Supply (YoY) (Jul),Low Volatility Expected,5.88%,,4.19%
2024/08/30 02:00:00,ZAR,Private Sector Credit (Jul),Low Volatility Expected,3.50%,,4.27%
2024/08/30 02:45:00,EUR,French Consumer Spending (MoM) (Jul),Moderate Volatility Expected,0.3%,0.4%,-0.6%
2024/08/30 02:45:00,EUR,French CPI (YoY) (Aug),Low Volatility Expected,1.9%,1.8%,2.3%
2024/08/30 02:45:00,EUR,French CPI (MoM) (Aug),Moderate Volatility Expected,0.6%,0.5%,0.2%
2024/08/30 02:45:00,EUR,French GDP (YoY) (Q2),Moderate Volatility Expected,1.0%,1.1%,1.1%
2024/08/30 02:45:00,EUR,French GDP (QoQ) (Q2),Moderate Volatility Expected,0.2%,0.3%,0.2%
2024/08/30 02:45:00,EUR,French HICP (YoY) (Aug),Low Volatility Expected,2.2%,2.1%,2.7%
2024/08/30 02:45:00,EUR,French HICP (MoM) (Aug),Moderate Volatility Expected,0.6%,0.5%,0.2%
2024/08/30 02:45:00,EUR,French PPI (MoM) (Jul),Low Volatility Expected,0.2%,,-0.2%
2024/08/30 02:45:00,EUR,PPI (YoY) (Jul),Low Volatility Expected,-5.40%,,-5.90%
2024/08/30 03:00:00,CHF,KOF Leading Indicators (Aug),Moderate Volatility Expected,101.6,100.6,100.6
2024/08/30 03:00:00,CHF,Official Reserves Assets (Jul),Low Volatility Expected,787.6B,,794.3B
2024/08/30 03:00:00,EUR,Spanish Retail Sales (YoY) (Jul),Low Volatility Expected,1.0%,0.3%,0.4%
2024/08/30 03:05:00,EUR,ECB's Schnabel Speaks,Moderate Volatility Expected,,,
2024/08/30 03:35:00,EUR,ECB's Schnabel Speaks,Moderate Volatility Expected,,,
2024/08/30 03:55:00,EUR,German Unemployment Change (Aug),Moderate Volatility Expected,2K,17K,17K
2024/08/30 03:55:00,EUR,German Unemployment Rate (Aug),Moderate Volatility Expected,6.0%,6.0%,6.0%
2024/08/30 03:55:00,EUR,German Unemployment (Aug),Low Volatility Expected,2.801M,,2.802M
2024/08/30 03:55:00,EUR,German Unemployment n.s.a. (Aug),Low Volatility Expected,2.872M,,2.809M
2024/08/30 04:00:00,EUR,Italian Monthly Unemployment Rate (Jul),Low Volatility Expected,6.5%,7.0%,6.9%
2024/08/30 04:00:00,EUR,Spanish Current account (Jun),Low Volatility Expected,5.02B,,5.56B
2024/08/30 04:30:00,GBP,BoE Consumer Credit (Jul),Low Volatility Expected,1.215B,1.300B,0.869B
2024/08/30 04:30:00,GBP,M3 Money Supply (Jul),Low Volatility Expected,"3,067.2B",,"3,057.1B"
