date,country,event,impact,actual,forecast,previous
2024/12/12 06:30:00,INR,Manufacturing Output (MoM) (Oct),Low Volatility Expected,4.1%,,3.9%
2024/12/12 06:40:00,EUR,Italian 15-Year BTP Auction,Low Volatility Expected,3.19%,,3.93%
2024/12/12 06:40:00,EUR,Italian 3-Year BTP Auction,Low Volatility Expected,2.35%,,2.73%
2024/12/12 06:40:00,EUR,Italian 30-Year BTP Auction,Low Volatility Expected,3.940%,,4.040%
2024/12/12 06:40:00,EUR,Italian 7-Year BTP Auction,Low Volatility Expected,2.92%,,3.23%
2024/12/12 07:00:00,GBP,Thomson Reuters IPSOS PCSI (Dec),Low Volatility Expected,47.1,,49.9
2024/12/12 07:00:00,EUR,Italy Thomson Reuters IPSOS PCSI (Dec),Low Volatility Expected,44.97,,43.91
2024/12/12 07:00:00,EUR,Germany Thomson Reuters IPSOS PCSI (Dec),Low Volatility Expected,42.48,,46.43
2024/12/12 07:00:00,EUR,France Thomson Reuters IPSOS PCSI (Dec),Low Volatility Expected,38.51,,42.17
2024/12/12 07:00:00,EUR,Thomson Reuters IPSOS PCSI (MoM) (Dec),Low Volatility Expected,49.46,,48.44
2024/12/12 07:00:00,ZAR,Thomson Reuters IPSOS PCSI (MoM) (Dec),Low Volatility Expected,49.29,,49.37
2024/12/12 08:00:00,BRL,Retail Sales (YoY) (Oct),Moderate Volatility Expected,6.5%,4.8%,2.3%
2024/12/12 08:00:00,BRL,Retail Sales (MoM) (Oct),Moderate Volatility Expected,0.4%,-0.2%,0.6%
2024/12/12 09:00:00,RUB,Central Bank reserves (USD),Low Volatility Expected,614.4B,,614.1B
2024/12/12 09:00:00,RUB,Trade Balance (Oct),Low Volatility Expected,9.10B,,12.38B
2024/12/12 09:15:00,EUR,Deposit Facility Rate (Dec),High Volatility Expected,3.00%,3.00%,3.25%
2024/12/12 09:15:00,EUR,ECB Marginal Lending Facility,Moderate Volatility Expected,3.40%,,3.65%
2024/12/12 09:15:00,EUR,ECB Monetary Policy Statement,Moderate Volatility Expected,,,
2024/12/12 09:15:00,EUR,ECB Interest Rate Decision (Dec),High Volatility Expected,3.15%,3.15%,3.40%
2024/12/12 09:30:00,USD,Continuing Jobless Claims,Moderate Volatility Expected,"1,886K","1,880K","1,871K"
2024/12/12 09:30:00,USD,Core PPI (MoM) (Nov),Moderate Volatility Expected,0.2%,0.2%,0.3%
2024/12/12 09:30:00,USD,Core PPI (YoY) (Nov),Low Volatility Expected,3.4%,3.2%,3.4%
2024/12/12 09:30:00,USD,Initial Jobless Claims,High Volatility Expected,242K,221K,225K
2024/12/12 09:30:00,USD,Jobless Claims 4-Week Avg.,Low Volatility Expected,224.25K,,218.50K
2024/12/12 09:30:00,USD,PPI (YoY) (Nov),Low Volatility Expected,3.0%,2.6%,2.6%
2024/12/12 09:30:00,USD,PPI (MoM) (Nov),High Volatility Expected,0.4%,0.2%,0.3%
2024/12/12 09:30:00,USD,PPI ex. Food/Energy/Transport (YoY) (Nov),Low Volatility Expected,3.5%,,3.5%
2024/12/12 09:30:00,USD,PPI ex. Food/Energy/Transport (MoM) (Nov),Low Volatility Expected,0.1%,0.2%,0.3%
2024/12/12 09:30:00,CAD,Building Permits (MoM) (Oct),Moderate Volatility Expected,-3.1%,-4.8%,11.5%
2024/12/12 09:45:00,EUR,ECB Press Conference,High Volatility Expected,,,
2024/12/12 11:15:00,EUR,ECB President Lagarde Speaks,Moderate Volatility Expected,,,
2024/12/12 11:30:00,USD,Natural Gas Storage,Low Volatility Expected,-190B,-175B,-30B
2024/12/12 12:30:00,USD,4-Week Bill Auction,Low Volatility Expected,4.240%,,4.400%
2024/12/12 12:30:00,USD,8-Week Bill Auction,Low Volatility Expected,4.260%,,4.350%
2024/12/12 14:00:00,USD,30-Year Bond Auction,High Volatility Expected,4.535%,,4.608%
2024/12/12 17:00:00,KRW,Export Price Index (YoY) (Nov),Low Volatility Expected,7.0%,,2.0%
2024/12/12 17:00:00,KRW,Import Price Index (YoY) (Nov),Low Volatility Expected,3.0%,,-2.5%
2024/12/12 17:30:00,USD,Fed's Balance Sheet,Moderate Volatility Expected,"6,897B",,"6,896B"
2024/12/12 17:30:00,USD,Reserve Balances with Federal Reserve Banks,Low Volatility Expected,3.274T,,3.216T
2024/12/12 17:30:00,NZD,Business NZ PMI (Nov),Moderate Volatility Expected,45.5,,45.8
2024/12/12 17:45:00,NZD,External Migration & Visitors (Oct),Low Volatility Expected,6.30%,,0.90%
2024/12/12 17:45:00,NZD,Permanent/Long-Term Migration (Oct),Low Volatility Expected,"2,790",,"2,190"
2024/12/12 17:45:00,NZD,Visitor Arrivals (MoM) (Oct),Low Volatility Expected,0.6%,,1.3%
2024/12/12 19:50:00,JPY,Tankan All Big Industry CAPEX (Q4),Moderate Volatility Expected,11.3%,9.6%,10.6%
2024/12/12 19:50:00,JPY,Tankan All Small Industry CAPEX (Q4),Low Volatility Expected,4.0%,,2.6%
2024/12/12 19:50:00,JPY,Tankan Big Manufacturing Outlook Index (Q4),Moderate Volatility Expected,13,,14
2024/12/12 19:50:00,JPY,Tankan Large Manufacturers Index (Q4),Moderate Volatility Expected,14,13,13
2024/12/12 19:50:00,JPY,Tankan Large Non-Manufacturers Diffusion Index (Q4),Low Volatility Expected,28,28,28
2024/12/12 19:50:00,JPY,Tankan Large Non-Manufacturers Index (Q4),Moderate Volatility Expected,33,33,34
2024/12/12 19:50:00,JPY,Tankan Small Manufacturers Diffusion Index (Q4),Low Volatility Expected,0,-2,0
2024/12/12 19:50:00,JPY,Tankan Small Manufacturing Index (Q4),Low Volatility Expected,1,-2,0
2024/12/12 19:50:00,JPY,Tankan Small Non-Manufacturers Diffusion Index (Q4),Low Volatility Expected,8,,11
2024/12/12 19:50:00,JPY,Tankan Small Non-Manufacturing Index (Q4),Low Volatility Expected,16,11,14
2024/12/12 20:01:00,GBP,GfK Consumer Confidence (Dec),Low Volatility Expected,-17,-18,-18
2024/12/12 22:00:00,KRW,Thomson Reuters IPSOS PCSI (MoM) (Dec),Low Volatility Expected,37.97,,40.12
2024/12/12 22:00:00,INR,Thomson Reuters IPSOS PCSI (MoM) (Dec),Low Volatility Expected,60.29,,61.00
2024/12/12 22:00:00,AUD,Thomson Reuters IPSOS PCSI (MoM) (Dec),Low Volatility Expected,49.24,,48.95
2024/12/12 22:00:00,JPY,Thomson Reuters IPSOS PCSI (Dec),Low Volatility Expected,38.49,,37.76
2024/12/12 22:00:00,CNY,China Thomson Reuters IPSOS PCSI (Dec),Low Volatility Expected,69.54,,73.03
2024/12/13 00:30:00,JPY,Capacity Utilization (MoM) (Oct),Low Volatility Expected,2.6%,,4.4%
2024/12/13 00:30:00,JPY,Industrial Production (MoM) (Oct),Moderate Volatility Expected,2.8%,3.0%,1.6%
2024/12/13 03:00:00,GBP,Construction Output (MoM) (Oct),Low Volatility Expected,-0.4%,0.2%,0.1%
2024/12/13 03:00:00,GBP,U.K. Construction Output (YoY) (Oct),Low Volatility Expected,-0.7%,0.0%,-0.4%
2024/12/13 03:00:00,GBP,GDP (MoM) (Oct),High Volatility Expected,-0.1%,0.1%,-0.1%
2024/12/13 03:00:00,GBP,GDP (YoY) (Oct),Low Volatility Expected,1.3%,1.6%,1.0%
2024/12/13 03:00:00,GBP,Industrial Production (MoM) (Oct),Moderate Volatility Expected,-0.6%,0.3%,-0.5%
2024/12/13 03:00:00,GBP,Industrial Production (YoY) (Oct),Low Volatility Expected,-0.7%,0.2%,-1.8%
2024/12/13 03:00:00,GBP,Manufacturing Production (YoY) (Oct),Low Volatility Expected,0.0%,0.9%,-0.7%
2024/12/13 03:00:00,GBP,Manufacturing Production (MoM) (Oct),Moderate Volatility Expected,-0.6%,0.2%,-1.0%
2024/12/13 03:00:00,GBP,Monthly GDP 3M/3M Change (Oct),Moderate Volatility Expected,0.1%,0.2%,0.1%
2024/12/13 03:00:00,GBP,Trade Balance (Oct),Moderate Volatility Expected,-18.97B,-16.10B,-16.32B
2024/12/13 03:00:00,GBP,Trade Balance Non-EU (Oct),Moderate Volatility Expected,-7.28B,,-5.31B
2024/12/13 03:00:00,EUR,German Exports (MoM) (Oct),Low Volatility Expected,-2.8%,-2.0%,-1.7%
2024/12/13 03:00:00,EUR,German Imports (MoM) (Oct),Low Volatility Expected,-0.1%,-0.6%,2.1%
2024/12/13 03:00:00,EUR,German Trade Balance (Oct),Moderate Volatility Expected,13.4B,15.7B,17.0B
2024/12/13 03:00:00,EUR,German WPI (MoM) (Nov),Low Volatility Expected,0.0%,0.2%,0.4%
2024/12/13 03:00:00,EUR,German WPI (YoY) (Nov),Low Volatility Expected,-0.6%,,-0.8%
2024/12/13 03:45:00,EUR,French CPI NSA (YoY) (Nov),Low Volatility Expected,1.30%,,1.20%
2024/12/13 03:45:00,EUR,French CPI NSA (MoM) (Nov),Low Volatility Expected,-0.10%,,0.20%
2024/12/13 03:45:00,EUR,French CPI (MoM) (Nov),Moderate Volatility Expected,-0.1%,0.1%,0.3%
2024/12/13 03:45:00,EUR,French CPI (YoY) (Nov),Low Volatility Expected,1.3%,1.3%,1.2%
2024/12/13 03:45:00,EUR,French HICP (YoY) (Nov),Low Volatility Expected,1.7%,1.7%,1.6%
2024/12/13 03:45:00,EUR,French HICP (MoM) (Nov),Moderate Volatility Expected,-0.1%,-0.1%,0.3%
2024/12/13 03:45:00,EUR,France Inflation Ex-Tobacco (YoY) (Nov),Low Volatility Expected,1.10%,,1.10%
2024/12/13 04:00:00,EUR,Core CPI (YoY) (Nov),Low Volatility Expected,2.4%,2.4%,2.5%
2024/12/13 04:00:00,EUR,Spanish CPI (MoM) (Nov),Low Volatility Expected,0.2%,0.2%,0.6%
2024/12/13 04:00:00,EUR,Spanish CPI (YoY) (Nov),Moderate Volatility Expected,2.4%,2.4%,1.8%
2024/12/13 04:00:00,EUR,Spanish HICP (MoM) (Nov),Low Volatility Expected,0.0%,0.0%,0.4%
2024/12/13 04:00:00,EUR,Spanish HICP (YoY) (Nov),Moderate Volatility Expected,2.4%,2.4%,1.8%
2024/12/13 04:00:00,ZAR,SARB Quarterly Bulletin,Low Volatility Expected,,,
2024/12/13 05:30:00,GBP,Inflation Expectations,Low Volatility Expected,3.0%,,2.7%
2024/12/13 06:00:00,EUR,Industrial Production (YoY) (Oct),Low Volatility Expected,-1.2%,-1.9%,-2.2%
2024/12/13 06:00:00,EUR,Industrial Production (MoM) (Oct),Moderate Volatility Expected,0.0%,0.0%,-1.5%
2024/12/13 07:00:00,BRL,IGP-10 Inflation Index (MoM) (Dec),Low Volatility Expected,1.1%,,1.5%
2024/12/13 07:00:00,CNY,M2 Money Stock (YoY) (Nov),Low Volatility Expected,7.1%,7.6%,7.5%
2024/12/13 07:00:00,CNY,New Loans (Nov),Moderate Volatility Expected,580.0B,950.0B,500.0B
2024/12/13 07:00:00,CNY,Outstanding Loan Growth (YoY) (Nov),Low Volatility Expected,7.7%,7.9%,8.0%
2024/12/13 07:00:00,CNY,Chinese Total Social Financing (Nov),Low Volatility Expected,"2,340.0B","2,800.0B","1,400.0B"
2024/12/13 07:30:00,INR,Bank Loan Growth,Low Volatility Expected,10.6%,,11.1%
2024/12/13 07:30:00,INR,Deposit Growth,Low Volatility Expected,10.7%,,11.2%
2024/12/13 07:30:00,INR,"FX Reserves, USD",Low Volatility Expected,654.86B,,658.09B
2024/12/13 08:00:00,BRL,IBC-Br Economic Activity (Oct),Low Volatility Expected,0.10%,-0.20%,0.90%
2024/12/13 08:30:00,GBP,NIESR GDP Estimate,Moderate Volatility Expected,0.0%,,0.1%
2024/12/13 09:00:00,GBP,NIESR Monthly GDP Tracker (Nov),Moderate Volatility Expected,0.0%,,0.1%
2024/12/13 09:30:00,USD,Export Price Index (YoY) (Nov),Low Volatility Expected,0.8%,,-0.1%
2024/12/13 09:30:00,USD,Export Price Index (MoM) (Nov),Moderate Volatility Expected,0.0%,-0.2%,1.0%
2024/12/13 09:30:00,USD,Import Price Index (MoM) (Nov),Moderate Volatility Expected,0.1%,-0.2%,0.1%
2024/12/13 09:30:00,USD,Import Price Index (YoY) (Nov),Low Volatility Expected,1.3%,,0.6%
2024/12/13 09:30:00,CAD,Capacity Utilization Rate (Q3),Low Volatility Expected,79.3%,78.9%,79.1%
2024/12/13 09:30:00,CAD,Manufacturing Sales (MoM) (Oct),Low Volatility Expected,2.1%,1.3%,-0.6%
2024/12/13 09:30:00,CAD,New Motor Vehicle Sales (MoM) (Oct),Low Volatility Expected,163.6K,,166.6K
2024/12/13 09:30:00,CAD,Wholesale Sales (MoM) (Oct),Moderate Volatility Expected,1.0%,0.5%,1.3%
2024/12/13 12:00:00,RUB,GDP Quarterly (YoY) (Q3),Moderate Volatility Expected,3.1%,3.1%,4.1%
2024/12/13 14:00:00,USD,U.S. Baker Hughes Oil Rig Count,Moderate Volatility Expected,482,,482
2024/12/13 14:00:00,USD,U.S. Baker Hughes Total Rig Count,Moderate Volatility Expected,589,,589
2024/12/13 16:30:00,GBP,CFTC GBP speculative net positions,Moderate Volatility Expected,27.1K,,19.3K
2024/12/13 16:30:00,USD,CFTC Aluminium speculative net positions,Low Volatility Expected,2.7K,,2.9K
2024/12/13 16:30:00,USD,CFTC Copper speculative net positions,Low Volatility Expected,11.0K,,10.5K
2024/12/13 16:30:00,USD,CFTC Corn speculative net positions,Low Volatility Expected,224.4K,,137.2K
2024/12/13 16:30:00,USD,CFTC Crude Oil speculative net positions,Moderate Volatility Expected,190.1K,,201.5K
2024/12/13 16:30:00,USD,CFTC Gold speculative net positions,Moderate Volatility Expected,275.6K,,259.7K
2024/12/13 16:30:00,USD,CFTC Nasdaq 100 speculative net positions,Moderate Volatility Expected,35.6K,,29.7K
2024/12/13 16:30:00,USD,CFTC Natural Gas speculative net positions,Low Volatility Expected,-140.6K,,-151.6K
2024/12/13 16:30:00,USD,CFTC S&P 500 speculative net positions,Moderate Volatility Expected,-83.3K,,-108.6K
2024/12/13 16:30:00,USD,CFTC Silver speculative net positions,Low Volatility Expected,41.2K,,43.3K
2024/12/13 16:30:00,USD,CFTC Soybeans speculative net positions,Low Volatility Expected,-86.2K,,-98.5K
2024/12/13 16:30:00,USD,CFTC Wheat speculative net positions,Low Volatility Expected,-59.3K,,-61.5K
2024/12/13 16:30:00,CAD,CFTC CAD speculative net positions,Low Volatility Expected,-181.6K,,-159.3K
2024/12/13 16:30:00,CHF,CFTC CHF speculative net positions,Low Volatility Expected,-35.0K,,-41.1K
2024/12/13 16:30:00,AUD,CFTC AUD speculative net positions,Moderate Volatility Expected,8.5K,,21.4K
2024/12/13 16:30:00,BRL,CFTC BRL speculative net positions,Moderate Volatility Expected,-16.4K,,-17.4K
2024/12/13 16:30:00,JPY,CFTC JPY speculative net positions,Moderate Volatility Expected,25.8K,,2.3K
2024/12/13 16:30:00,NZD,CFTC NZD speculative net positions,Low Volatility Expected,-28.2K,,-23.3K
2024/12/13 16:30:00,RUB,CFTC RUB speculative positions,Moderate Volatility Expected,,,-32.8K
2024/12/13 16:30:00,EUR,CFTC EUR speculative net positions,Moderate Volatility Expected,-75.6K,,-57.5K
2024/12/14 00:00:00,CNY,FDI (Nov),Low Volatility Expected,-27.90%,,-29.80%
2024/12/15 17:30:00,NZD,Performance of Services Index,Low Volatility Expected,49.5,,46.2
2024/12/15 17:45:00,NZD,FPI (MoM) (Nov),Low Volatility Expected,-0.1%,,-0.9%
2024/12/15 19:50:00,JPY,Core Machinery Orders (MoM) (Oct),Low Volatility Expected,2.1%,1.2%,-0.7%
2024/12/15 19:50:00,JPY,Core Machinery Orders (YoY) (Oct),Low Volatility Expected,5.6%,0.7%,-4.8%
2024/12/15 19:55:00,KRW,Exports (YoY) (Nov),Low Volatility Expected,1.4%,,1.4%
2024/12/15 19:55:00,KRW,Imports (YoY) (Nov),Low Volatility Expected,-2.4%,,-2.4%
2024/12/15 19:55:00,KRW,Trade Balance (Nov),Low Volatility Expected,5.59B,,5.61B
2024/12/15 20:01:00,GBP,Rightmove House Price Index (MoM),Low Volatility Expected,-1.7%,,-1.4%
2024/12/15 21:30:00,CNY,House Prices (YoY) (Nov),Low Volatility Expected,-5.7%,,-5.9%
2024/12/15 22:00:00,CNY,Fixed Asset Investment (YoY) (Nov),Moderate Volatility Expected,3.3%,3.5%,3.4%
2024/12/15 22:00:00,CNY,Industrial Production (YoY) (Nov),Moderate Volatility Expected,5.4%,5.4%,5.3%
2024/12/15 22:00:00,CNY,Chinese Industrial Production YTD (YoY) (Nov),Moderate Volatility Expected,5.8%,,5.8%
2024/12/15 22:00:00,CNY,Retail Sales (YoY) (Nov),Low Volatility Expected,3.0%,4.6%,4.8%
2024/12/15 22:00:00,CNY,Chinese Retail Sales YTD (YoY) (Nov),Low Volatility Expected,3.45%,,3.51%
2024/12/15 22:00:00,CNY,Chinese Unemployment Rate (Nov),Moderate Volatility Expected,5.0%,5.0%,5.0%
2024/12/15 22:00:00,CNY,NBS Press Conference,Moderate Volatility Expected,,,
2024/12/15 23:00:00,KRW,M3 Money Supply (Oct),Low Volatility Expected,"5,584.9B",,"5,557.5B"
2024/12/15 23:00:00,KRW,M2 Money supply (Oct),Low Volatility Expected,6.10%,,5.60%
2024/12/16 00:30:00,JPY,Tertiary Industry Activity Index (Oct),Low Volatility Expected,0.30,-0.10,2.00
2024/12/16 02:30:00,INR,WPI Food (YoY) (Nov),Low Volatility Expected,8.63%,,13.54%
2024/12/16 02:30:00,INR,WPI Fuel (YoY) (Nov),Low Volatility Expected,-5.83%,,-5.79%
2024/12/16 02:30:00,INR,WPI Inflation (YoY) (Nov),Moderate Volatility Expected,1.89%,2.20%,2.36%
2024/12/16 02:30:00,INR,WPI Manufacturing Inflation (YoY) (Nov),Low Volatility Expected,2.00%,,1.50%
2024/12/16 03:30:00,CHF,PPI (MoM) (Nov),Moderate Volatility Expected,-0.6%,0.2%,-0.3%
2024/12/16 03:30:00,CHF,PPI (YoY) (Nov),Low Volatility Expected,-1.5%,,-1.8%
2024/12/16 04:15:00,EUR,ECB President Lagarde Speaks,Moderate Volatility Expected,,,
2024/12/16 04:35:00,EUR,ECB President Lagarde Speaks,Moderate Volatility Expected,,,
2024/12/16 04:45:00,EUR,ECB's De Guindos Speaks,Moderate Volatility Expected,,,
2024/12/16 05:50:00,INR,Exports (USD) (Nov),Low Volatility Expected,32.11B,,39.20B
2024/12/16 05:50:00,INR,Imports (USD) (Nov),Low Volatility Expected,69.95B,,66.34B
2024/12/16 05:50:00,INR,Trade Balance (Nov),Low Volatility Expected,-37.84B,,-27.14B
2024/12/16 05:59:37,GBP,Rightmove House Price Index (YoY) (Dec),Low Volatility Expected,1.4%,,1.2%
2024/12/16 06:00:00,EUR,Italian CPI (YoY) (Nov),Low Volatility Expected,1.3%,1.4%,0.9%
2024/12/16 06:00:00,EUR,Italian CPI (MoM) (Nov),Low Volatility Expected,-0.1%,0.0%,0.3%
2024/12/16 06:00:00,EUR,Italian CPI Ex Tobacco (YoY) (Nov),Low Volatility Expected,1.2%,,0.8%
2024/12/16 06:00:00,EUR,Italian HICP (YoY) (Nov),Low Volatility Expected,1.5%,1.6%,1.0%
2024/12/16 06:00:00,EUR,Italian HICP (MoM) (Nov),Low Volatility Expected,-0.1%,0.0%,0.0%
2024/12/16 06:00:00,EUR,Wages in euro zone (YoY) (Q3),Moderate Volatility Expected,4.40%,,4.90%
2024/12/16 06:00:00,EUR,Labor Cost Index (YoY) (Q3),Low Volatility Expected,4.60%,4.60%,5.20%
2024/12/16 07:00:00,EUR,German Buba Monthly Report,Low Volatility Expected,,,
2024/12/16 07:00:00,EUR,Reserve Assets Total (Nov),Low Volatility Expected,"1,391.73B",,"1,386.88B"
2024/12/16 07:25:00,BRL,BCB Focus Market Readout,Low Volatility Expected,,,
2024/12/16 09:15:00,CAD,Housing Starts (Nov),Moderate Volatility Expected,262.4K,246.0K,242.2K
2024/12/16 09:30:00,USD,NY Empire State Manufacturing Index (Dec),Moderate Volatility Expected,0.20,6.40,31.20
2024/12/16 10:00:00,EUR,French 12-Month BTF Auction,Low Volatility Expected,2.372%,,2.641%
2024/12/16 10:00:00,EUR,French 3-Month BTF Auction,Low Volatility Expected,2.770%,,2.817%
2024/12/16 10:00:00,EUR,French 6-Month BTF Auction,Low Volatility Expected,2.575%,,2.641%
2024/12/16 12:30:00,USD,3-Month Bill Auction,Low Volatility Expected,4.250%,,4.300%
2024/12/16 12:30:00,USD,6-Month Bill Auction,Low Volatility Expected,4.160%,,4.200%
2024/12/16 12:30:00,EUR,ECB's Schnabel Speaks,Moderate Volatility Expected,,,
2024/12/16 16:45:00,CAD,BoC Gov Macklem Speaks,Moderate Volatility Expected,,,
2024/12/16 19:30:00,AUD,Westpac Consumer Sentiment (Dec),Low Volatility Expected,-2.0%,,5.3%
2024/12/16 20:00:00,NZD,Budget Balance (Jul),Low Volatility Expected,-16.610B,,-25.600B
2024/12/16 20:00:00,NZD,Net Debt Forecast (Jul),Low Volatility Expected,45.10%,,43.10%
2024/12/16 20:00:00,NZD,Economic Forecast (Jul),Low Volatility Expected,-17.320B,,-11.074B
2024/12/16 20:30:00,SGD,Non-Oil Exports (MoM) (Nov),Low Volatility Expected,14.70%,,-7.50%
2024/12/16 20:30:00,SGD,Non-Oil Exports (YoY) (Nov),Low Volatility Expected,3.40%,-1.70%,-4.70%
2024/12/16 21:30:00,SGD,Trade Balance (Nov),Low Volatility Expected,6.520B,,4.290B
2024/12/16 22:00:00,NZD,RBNZ Offshore Holdings (Nov),Low Volatility Expected,58.60%,,59.20%
2024/12/17 03:00:00,GBP,Average Earnings ex Bonus (Oct),Low Volatility Expected,5.2%,5.0%,4.9%
2024/12/17 03:00:00,GBP,Average Earnings Index +Bonus (Oct),Moderate Volatility Expected,5.2%,4.6%,4.4%
2024/12/17 03:00:00,GBP,Claimant Count Change (Nov),Moderate Volatility Expected,0.3K,28.2K,-10.9K
2024/12/17 03:00:00,GBP,Employment Change 3M/3M (MoM) (Oct),Moderate Volatility Expected,173K,-12K,253K
2024/12/17 03:00:00,GBP,Unemployment Rate (Oct),Moderate Volatility Expected,4.3%,4.3%,4.3%
2024/12/17 03:00:00,ZAR,Leading Indicators (Oct),Low Volatility Expected,114.00%,,113.90%
2024/12/17 04:00:00,CHF,SECO Economic Forecasts,Low Volatility Expected,,,
2024/12/17 04:30:00,HKD,Unemployment Rate (Nov),Low Volatility Expected,3.1%,,3.1%
2024/12/17 05:00:00,EUR,Italian Trade Balance (Oct),Low Volatility Expected,5.153B,3.220B,2.583B
2024/12/17 05:00:00,EUR,Italian Trade Balance EU (Oct),Low Volatility Expected,-0.66B,,-1.17B
2024/12/17 05:00:00,EUR,German Business Expectations (Dec),Moderate Volatility Expected,84.4,87.5,87.0
2024/12/17 05:00:00,EUR,German Current Assessment (Dec),Moderate Volatility Expected,85.1,84.0,84.3
2024/12/17 05:00:00,EUR,German Ifo Business Climate Index (Dec),Moderate Volatility Expected,84.7,85.5,85.6
2024/12/17 06:00:00,EUR,German Buba Vice President Buch Speaks,Moderate Volatility Expected,,,
2024/12/17 06:00:00,EUR,German ZEW Current Conditions (Dec),Moderate Volatility Expected,-93.1,-92.6,-91.4
2024/12/17 06:00:00,EUR,German ZEW Economic Sentiment (Dec),Moderate Volatility Expected,15.7,6.8,7.4
2024/12/17 06:00:00,EUR,ECB's Elderson Speaks,Moderate Volatility Expected,,,
2024/12/17 06:00:00,EUR,Trade Balance (Oct),Moderate Volatility Expected,6.8B,11.7B,11.6B
2024/12/17 06:00:00,EUR,ZEW Economic Sentiment (Dec),Moderate Volatility Expected,17.0,12.2,12.5
2024/12/17 06:20:00,GBP,5-Year Treasury Gilt Auction,Low Volatility Expected,4.348%,,4.148%
2024/12/17 07:00:00,BRL,BCB Copom Meeting Minutes,Low Volatility Expected,,,
2024/12/17 09:30:00,USD,Core Retail Sales (MoM) (Nov),High Volatility Expected,0.2%,0.4%,0.2%
2024/12/17 09:30:00,USD,Retail Control (MoM) (Nov),Moderate Volatility Expected,0.4%,0.4%,-0.1%
2024/12/17 09:30:00,USD,Retail Sales (YoY) (Nov),Low Volatility Expected,3.80%,,2.90%
2024/12/17 09:30:00,USD,Retail Sales (MoM) (Nov),High Volatility Expected,0.7%,0.6%,0.5%
2024/12/17 09:30:00,USD,Retail Sales Ex Gas/Autos (MoM) (Nov),Low Volatility Expected,0.2%,0.4%,0.2%
2024/12/17 09:30:00,CAD,Common CPI (YoY) (Nov),Low Volatility Expected,2.0%,2.1%,2.2%
2024/12/17 09:30:00,CAD,Core CPI (MoM) (Nov),Moderate Volatility Expected,-0.1%,,0.4%
2024/12/17 09:30:00,CAD,Core CPI (YoY) (Nov),Moderate Volatility Expected,1.6%,,1.7%
2024/12/17 09:30:00,CAD,CPI (YoY) (Nov),Low Volatility Expected,1.9%,2.0%,2.0%
2024/12/17 09:30:00,CAD,CPI (MoM) (Nov),Moderate Volatility Expected,0.0%,0.1%,0.4%
2024/12/17 09:30:00,CAD,Foreign Securities Purchases (Oct),Moderate Volatility Expected,21.55B,24.50B,29.65B
2024/12/17 09:30:00,CAD,Foreign Securities Purchases by Canadians (Oct),Low Volatility Expected,-2.650B,,4.140B
2024/12/17 09:30:00,CAD,Median CPI (YoY) (Nov),Low Volatility Expected,2.6%,2.4%,2.6%
2024/12/17 09:30:00,CAD,New Housing Price Index (MoM) (Nov),Moderate Volatility Expected,0.1%,0.1%,-0.4%
2024/12/17 09:30:00,CAD,Trimmed CPI (YoY) (Nov),Low Volatility Expected,2.7%,2.6%,2.7%
2024/12/17 09:55:00,USD,Redbook (YoY),Low Volatility Expected,4.8%,,4.2%
2024/12/17 10:15:00,USD,Capacity Utilization Rate (Nov),Low Volatility Expected,76.8%,77.3%,77.0%
2024/12/17 10:15:00,USD,Industrial Production (YoY) (Nov),Moderate Volatility Expected,-0.90%,0.10%,-0.45%
2024/12/17 10:15:00,USD,Industrial Production (MoM) (Nov),Moderate Volatility Expected,-0.1%,0.3%,-0.4%
2024/12/17 10:15:00,USD,Manufacturing Production (MoM) (Nov),Low Volatility Expected,0.2%,0.5%,-0.7%
2024/12/17 10:45:00,NZD,GlobalDairyTrade Price Index,Low Volatility Expected,-2.8%,,1.2%
2024/12/17 10:45:00,USD,Milk Auctions,Low Volatility Expected,"4,148.0",,"4,193.0"
2024/12/17 11:00:00,USD,Business Inventories (MoM) (Oct),Moderate Volatility Expected,0.1%,0.2%,0.0%
2024/12/17 11:00:00,USD,NAHB Housing Market Index (Dec),Low Volatility Expected,46,47,46
2024/12/17 11:00:00,USD,Retail Inventories Ex Auto (Oct),Moderate Volatility Expected,0.1%,0.1%,0.1%
2024/12/17 13:30:00,USD,Atlanta Fed GDPNow (Q4),Moderate Volatility Expected,3.1%,3.3%,3.3%
2024/12/17 14:00:00,USD,20-Year Bond Auction,Moderate Volatility Expected,4.686%,,4.680%
2024/12/17 17:30:00,USD,API Weekly Crude Oil Stock,Moderate Volatility Expected,-4.700M,-1.850M,0.499M
2024/12/17 17:45:00,NZD,Current Account (YoY) (Q3),Moderate Volatility Expected,-26.99B,,-27.76B
2024/12/17 17:45:00,NZD,Current Account (QoQ) (Q3),Moderate Volatility Expected,-10.58B,-10.45B,-4.83B
2024/12/17 17:45:00,NZD,Current Account % of GDP (Q3),Low Volatility Expected,-6.40%,,-6.70%
2024/12/17 18:00:00,NZD,Westpac Consumer Sentiment (Q4),Moderate Volatility Expected,97.5,,90.8
2024/12/17 19:50:00,JPY,Adjusted Trade Balance,Moderate Volatility Expected,-0.38T,-0.45T,-0.23T
2024/12/17 19:50:00,JPY,Exports (YoY) (Nov),Moderate Volatility Expected,3.8%,2.8%,3.1%
2024/12/17 19:50:00,JPY,Imports (YoY) (Nov),Low Volatility Expected,-3.8%,1.0%,0.4%
2024/12/17 19:50:00,JPY,Trade Balance (Nov),Moderate Volatility Expected,-117.6B,-688.9B,-462.1B
2024/12/17 20:00:00,AUD,MI Leading Index (MoM) (Nov),Low Volatility Expected,0.1%,,0.2%
2024/12/18 03:00:00,GBP,Core CPI (MoM) (Nov),Low Volatility Expected,0.0%,,0.4%
2024/12/18 03:00:00,GBP,Core CPI (YoY) (Nov),Low Volatility Expected,3.5%,3.6%,3.3%
2024/12/18 03:00:00,GBP,Core PPI Output (YoY) (Nov),Low Volatility Expected,1.6%,,1.6%
2024/12/18 03:00:00,GBP,Core PPI Output (MoM) (Nov),Low Volatility Expected,0.0%,,0.2%
2024/12/18 03:00:00,GBP,Core RPI (MoM) (Nov),Low Volatility Expected,0.0%,,0.5%
2024/12/18 03:00:00,GBP,Core RPI (YoY) (Nov),Low Volatility Expected,3.0%,,2.8%
2024/12/18 03:00:00,GBP,CPI (MoM) (Nov),Moderate Volatility Expected,0.1%,0.1%,0.6%
2024/12/18 03:00:00,GBP,CPI (YoY) (Nov),High Volatility Expected,2.6%,2.6%,2.3%
2024/12/18 03:00:00,GBP,"CPI, n.s.a (Nov)",Low Volatility Expected,135.10,,135.00
2024/12/18 03:00:00,GBP,CPIH (YoY),Moderate Volatility Expected,3.5%,,3.2%
2024/12/18 03:00:00,GBP,PPI Input (MoM) (Nov),Moderate Volatility Expected,0.0%,0.2%,0.1%
2024/12/18 03:00:00,GBP,PPI Input (YoY) (Nov),Low Volatility Expected,-1.9%,,-2.4%
2024/12/18 03:00:00,GBP,PPI Output (YoY) (Nov),Low Volatility Expected,-0.6%,,-0.9%
2024/12/18 03:00:00,GBP,PPI Output (MoM) (Nov),Low Volatility Expected,0.3%,0.2%,-0.1%
2024/12/18 03:00:00,GBP,RPI (YoY) (Nov),Low Volatility Expected,3.6%,3.7%,3.4%
2024/12/18 03:00:00,GBP,RPI (MoM) (Nov),Low Volatility Expected,0.1%,,0.5%
2024/12/18 05:00:00,EUR,ECB's Lane Speaks,Moderate Volatility Expected,,,
2024/12/18 05:30:00,GBP,House Price Index (YoY),Low Volatility Expected,3.4%,3.1%,2.9%
2024/12/18 05:30:00,EUR,German Buba President Nagel Speaks,Moderate Volatility Expected,,,
2024/12/18 06:00:00,EUR,Construction Output (MoM) (Oct),Low Volatility Expected,0.97%,,-0.29%
2024/12/18 06:00:00,EUR,Core CPI (YoY) (Nov),Moderate Volatility Expected,2.7%,2.7%,2.7%
2024/12/18 06:00:00,EUR,Core CPI (MoM) (Nov),Low Volatility Expected,-0.6%,-0.6%,0.2%
2024/12/18 06:00:00,EUR,CPI (YoY) (Nov),High Volatility Expected,2.2%,2.3%,2.0%
2024/12/18 06:00:00,EUR,CPI (MoM) (Nov),Moderate Volatility Expected,-0.3%,-0.3%,0.3%
2024/12/18 06:00:00,EUR,CPI ex Tobacco (MoM) (Nov),Low Volatility Expected,-0.3%,,0.3%
2024/12/18 06:00:00,EUR,CPI ex Tobacco (YoY) (Nov),Low Volatility Expected,2.1%,,1.9%
2024/12/18 06:00:00,EUR,"CPI, n.s.a (Nov)",Low Volatility Expected,126.62,126.67,127.03
