date,country,event,impact,actual,forecast,previous
2024/10/31 06:00:00,EUR,CPI (YoY) (Oct),High Volatility Expected,2.0%,1.9%,1.7%
2024/10/31 06:00:00,EUR,"CPI, n.s.a (Oct)",Low Volatility Expected,127.03,,126.60
2024/10/31 06:00:00,EUR,HICP ex Energy & Food (YoY) (Oct),Low Volatility Expected,2.7%,,2.7%
2024/10/31 06:00:00,EUR,HICP ex Energy and Food (MoM) (Oct),Low Volatility Expected,0.2%,,0.0%
2024/10/31 06:00:00,EUR,Unemployment Rate (Sep),Moderate Volatility Expected,6.3%,6.4%,6.3%
2024/10/31 07:00:00,EUR,Italian Industrial Sales (MoM) (Aug),Low Volatility Expected,-0.10%,,-0.50%
2024/10/31 07:00:00,EUR,Italian Industrial Sales (YoY) (Aug),Low Volatility Expected,-4.60%,,-4.70%
2024/10/31 07:30:00,USD,Challenger Job Cuts (YoY),Low Volatility Expected,50.9%,,53.4%
2024/10/31 07:30:00,USD,Challenger Job Cuts (Oct),Low Volatility Expected,55.597K,,72.821K
2024/10/31 07:30:00,INR,RBI Monetary and Credit Information Review,Low Volatility Expected,,,
2024/10/31 08:00:00,BRL,BCB National Monetary Council Meeting,Low Volatility Expected,,,
2024/10/31 08:00:00,BRL,Unemployment Rate (Sep),Moderate Volatility Expected,6.4%,6.5%,6.6%
2024/10/31 08:00:00,ZAR,Trade Balance (Sep),Low Volatility Expected,12.84B,,5.11B
2024/10/31 08:30:00,USD,Continuing Jobless Claims,Moderate Volatility Expected,"1,862K","1,890K","1,888K"
2024/10/31 08:30:00,USD,Core PCE Price Index (MoM) (Sep),High Volatility Expected,0.3%,0.3%,0.2%
2024/10/31 08:30:00,USD,Core PCE Price Index (YoY) (Sep),High Volatility Expected,2.7%,2.6%,2.7%
2024/10/31 08:30:00,USD,Employment Benefits (QoQ) (Q3),Low Volatility Expected,0.80%,,1.00%
2024/10/31 08:30:00,USD,Employment Cost Index (QoQ) (Q3),Moderate Volatility Expected,0.8%,0.9%,0.9%
2024/10/31 08:30:00,USD,Employment Wages (QoQ) (Q3),Low Volatility Expected,0.80%,,0.90%
2024/10/31 08:30:00,USD,Initial Jobless Claims,High Volatility Expected,216K,229K,228K
2024/10/31 08:30:00,USD,Jobless Claims 4-Week Avg.,Low Volatility Expected,236.50K,,238.75K
2024/10/31 08:30:00,USD,PCE Price index (YoY) (Sep),Moderate Volatility Expected,2.1%,2.1%,2.3%
2024/10/31 08:30:00,USD,PCE price index (MoM) (Sep),Moderate Volatility Expected,0.2%,0.2%,0.1%
2024/10/31 08:30:00,USD,Personal Income (MoM) (Sep),Low Volatility Expected,0.3%,0.3%,0.2%
2024/10/31 08:30:00,USD,Personal Spending (MoM) (Sep),Moderate Volatility Expected,0.5%,0.4%,0.3%
2024/10/31 08:30:00,USD,Real Personal Consumption (MoM) (Sep),Low Volatility Expected,0.4%,,0.2%
2024/10/31 08:30:00,CAD,Average Weekly Earnings (YoY) (Aug),Low Volatility Expected,4.62%,,4.32%
2024/10/31 08:30:00,CAD,GDP (MoM) (Aug),Moderate Volatility Expected,0.0%,0.0%,0.1%
2024/10/31 08:31:00,CAD,GDP (MoM) (Sep),Moderate Volatility Expected,0.3%,,0.0%
2024/10/31 09:00:00,RUB,Central Bank reserves (USD),Low Volatility Expected,628.5B,,624.9B
2024/10/31 09:45:00,USD,Chicago PMI (Oct),High Volatility Expected,41.6,46.9,46.6
2024/10/31 10:30:00,USD,Natural Gas Storage,Low Volatility Expected,78B,79B,80B
2024/10/31 11:30:00,USD,4-Week Bill Auction,Low Volatility Expected,4.580%,,4.650%
2024/10/31 11:30:00,USD,8-Week Bill Auction,Low Volatility Expected,4.555%,,4.590%
2024/10/31 11:30:00,USD,Atlanta Fed GDPNow (Q4),Moderate Volatility Expected,2.7%,,
2024/10/31 12:00:04,USD,OPEC Crude Oil Production Algeria (Barrel),Low Volatility Expected,0.90M,,0.90M
2024/10/31 12:00:04,USD,OPEC Crude Oil Production Congo (Barrel),Low Volatility Expected,0.26M,,0.26M
2024/10/31 12:00:04,USD,OPEC Crude Oil Production Gabon (Barrel),Low Volatility Expected,0.22M,,0.22M
2024/10/31 12:00:04,USD,OPEC Crude Oil Production Guinea (Barrel),Low Volatility Expected,0.06M,,0.06M
2024/10/31 12:00:04,USD,OPEC Crude oil Production Iran (Barrel),Low Volatility Expected,3.20M,,3.30M
2024/10/31 12:00:04,USD,OPEC Crude oil Production Iraq (Barrel),Low Volatility Expected,3.98M,,4.10M
2024/10/31 12:00:04,USD,OPEC Crude Oil Production Kuwait (Barrel),Low Volatility Expected,2.40M,,2.41M
2024/10/31 12:00:04,USD,OPEC Crude Oil Production Libya (Barrel),Low Volatility Expected,1.05M,,0.65M
2024/10/31 12:00:04,USD,OPEC Crude Oil Production Nigeria (Barrel),Low Volatility Expected,1.48M,,1.50M
2024/10/31 12:00:04,USD,OPEC Crude oil Production Saudi Arabia (Barrel),Low Volatility Expected,9.00M,,8.98M
2024/10/31 12:00:04,USD,OPEC Crude oil Production UAE (Barrel),Low Volatility Expected,2.92M,,2.93M
2024/10/31 12:00:04,USD,OPEC Crude oil Production Venezuela (Barrel),Low Volatility Expected,0.86M,,0.82M
2024/10/31 16:30:00,USD,Fed's Balance Sheet,Moderate Volatility Expected,"7,013B",,"7,029B"
2024/10/31 16:30:00,USD,Reserve Balances with Federal Reserve Banks,Low Volatility Expected,3.216T,,3.228T
2024/10/31 17:45:00,NZD,Building Consents (MoM) (Sep),Low Volatility Expected,2.6%,,-5.2%
2024/10/31 20:00:00,KRW,Exports (YoY) (Oct),Low Volatility Expected,4.6%,6.9%,7.5%
2024/10/31 20:00:00,KRW,Imports (YoY) (Oct),Low Volatility Expected,1.7%,2.0%,2.2%
2024/10/31 20:00:00,KRW,Trade Balance (Oct),Low Volatility Expected,3.17B,4.23B,6.66B
2024/10/31 20:30:00,KRW,S&P Global South Korea Manufacturing PMI (Oct),Low Volatility Expected,48.3,,48.3
2024/10/31 20:30:00,AUD,Home Loans (MoM) (Sep),Moderate Volatility Expected,0.1%,,2.4%
2024/10/31 20:30:00,AUD,Invest Housing Finance (MoM),Low Volatility Expected,-1.0%,,1.8%
2024/10/31 20:30:00,AUD,PPI (YoY) (Q3),Moderate Volatility Expected,3.9%,,4.8%
2024/10/31 20:30:00,AUD,PPI (QoQ) (Q3),Moderate Volatility Expected,0.9%,0.7%,1.0%
2024/11/01 01:30:00,AUD,Commodity Prices (YoY) (Oct),Low Volatility Expected,-7.8%,,-10.8%
2024/11/01 03:00:00,GBP,Nationwide HPI (MoM) (Oct),Moderate Volatility Expected,0.1%,0.3%,0.6%
2024/11/01 03:00:00,GBP,Nationwide HPI (YoY) (Oct),Moderate Volatility Expected,2.4%,2.8%,3.2%
2024/11/01 03:30:00,CHF,Retail Sales (YoY) (Sep),Low Volatility Expected,2.2%,2.5%,2.7%
2024/11/01 03:30:00,CHF,CPI (MoM) (Oct),Moderate Volatility Expected,-0.1%,0.0%,-0.3%
2024/11/01 03:30:00,CHF,CPI (YoY) (Oct),Low Volatility Expected,0.6%,0.8%,0.8%
2024/11/01 04:30:00,CHF,procure.ch Manufacturing PMI (Oct),Moderate Volatility Expected,49.9,49.5,49.9
2024/11/01 04:30:00,HKD,Retail Sales (YoY) (Sep),Low Volatility Expected,-6.9%,,-10.1%
2024/11/01 05:00:00,EUR,Brandenburg CPI (MoM) (Oct),Low Volatility Expected,0.3%,,-0.2%
2024/11/01 05:00:00,EUR,Brandenburg CPI (YoY) (Oct),Low Volatility Expected,1.8%,,1.7%
2024/11/01 05:00:00,ZAR,Manufacturing PMI (Oct),Low Volatility Expected,52.6,,53.3
2024/11/01 07:30:00,INR,Bank Loan Growth,Low Volatility Expected,11.5%,,12.8%
2024/11/01 07:30:00,INR,Deposit Growth,Low Volatility Expected,11.7%,,11.8%
2024/11/01 07:30:00,INR,"FX Reserves, USD",Low Volatility Expected,684.81B,,688.27B
2024/11/01 08:00:00,BRL,Industrial Production (MoM) (Sep),Low Volatility Expected,1.1%,0.9%,0.2%
2024/11/01 08:00:00,BRL,Industrial Production (YoY) (Sep),Moderate Volatility Expected,3.4%,2.8%,2.3%
2024/11/01 08:00:00,ZAR,Total Vehicle Sales (Oct),Low Volatility Expected,47.92K,,44.00K
2024/11/01 08:00:00,ZAR,Total Vehicle Sales (YoY) (Oct),Low Volatility Expected,5.50%,,-4.10%
2024/11/01 08:30:00,USD,Average Hourly Earnings (YoY) (YoY) (Oct),Moderate Volatility Expected,4.0%,4.0%,3.9%
2024/11/01 08:30:00,USD,Average Hourly Earnings (MoM) (Oct),High Volatility Expected,0.4%,0.3%,0.3%
2024/11/01 08:30:00,USD,Average Weekly Hours (Oct),Low Volatility Expected,34.3,34.2,34.3
2024/11/01 08:30:00,USD,Government Payrolls (Oct),Low Volatility Expected,40.0K,,31.0K
2024/11/01 08:30:00,USD,Manufacturing Payrolls (Oct),Low Volatility Expected,-46K,-28K,-6K
2024/11/01 08:30:00,USD,Nonfarm Payrolls (Oct),High Volatility Expected,12K,106K,223K
2024/11/01 08:30:00,USD,Participation Rate (Oct),Moderate Volatility Expected,62.6%,62.7%,62.7%
2024/11/01 08:30:00,USD,Private Nonfarm Payrolls (Oct),Moderate Volatility Expected,-28K,90K,192K
2024/11/01 08:30:00,USD,U6 Unemployment Rate (Oct),Moderate Volatility Expected,7.7%,,7.7%
2024/11/01 08:30:00,USD,Unemployment Rate (Oct),High Volatility Expected,4.1%,4.1%,4.1%
2024/11/01 10:00:00,USD,Construction Spending (MoM) (Sep),Moderate Volatility Expected,0.1%,0.0%,0.1%
2024/11/01 10:00:00,USD,ISM Manufacturing Employment (Oct),Moderate Volatility Expected,44.4,45.0,43.9
2024/11/01 10:00:00,USD,ISM Manufacturing New Orders Index (Oct),Low Volatility Expected,47.1,47.0,46.1
2024/11/01 10:00:00,USD,ISM Manufacturing PMI (Oct),High Volatility Expected,46.5,47.6,47.2
2024/11/01 10:00:00,USD,ISM Manufacturing Prices (Oct),High Volatility Expected,54.8,49.9,48.3
2024/11/01 13:00:00,USD,Atlanta Fed GDPNow (Q4),Moderate Volatility Expected,2.3%,2.7%,2.7%
2024/11/01 13:00:00,USD,U.S. Baker Hughes Oil Rig Count,Moderate Volatility Expected,479,479,480
2024/11/01 13:00:00,USD,U.S. Baker Hughes Total Rig Count,Moderate Volatility Expected,585,,585
2024/11/01 15:30:00,GBP,CFTC GBP speculative net positions,Moderate Volatility Expected,66.4K,,74.6K
2024/11/01 15:30:00,USD,CFTC Aluminium speculative net positions,Low Volatility Expected,3.2K,,2.6K
2024/11/01 15:30:00,USD,CFTC Copper speculative net positions,Low Volatility Expected,23.7K,,32.5K
2024/11/01 15:30:00,USD,CFTC Corn speculative net positions,Low Volatility Expected,83.3K,,17.8K
2024/11/01 15:30:00,USD,CFTC Crude Oil speculative net positions,Moderate Volatility Expected,151.9K,,173.7K
2024/11/01 15:30:00,USD,CFTC Gold speculative net positions,Moderate Volatility Expected,278.7K,,296.2K
2024/11/01 15:30:00,USD,CFTC Nasdaq 100 speculative net positions,Moderate Volatility Expected,5.1K,,2.7K
2024/11/01 15:30:00,USD,CFTC Natural Gas speculative net positions,Low Volatility Expected,-166.2K,,-166.2K
2024/11/01 15:30:00,USD,CFTC S&P 500 speculative net positions,Moderate Volatility Expected,62.7K,,23.0K
2024/11/01 15:30:00,USD,CFTC Silver speculative net positions,Low Volatility Expected,60.4K,,66.4K
2024/11/01 15:30:00,USD,CFTC Soybeans speculative net positions,Low Volatility Expected,-92.1K,,-78.3K
2024/11/01 15:30:00,USD,CFTC Wheat speculative net positions,Low Volatility Expected,-22.9K,,-17.1K
2024/11/01 15:30:00,CAD,CFTC CAD speculative net positions,Low Volatility Expected,-167.5K,,-140.6K
2024/11/01 15:30:00,CHF,CFTC CHF speculative net positions,Low Volatility Expected,-34.0K,,-32.7K
2024/11/01 15:30:00,AUD,CFTC AUD speculative net positions,Moderate Volatility Expected,27.5K,,27.7K
2024/11/01 15:30:00,BRL,CFTC BRL speculative net positions,Moderate Volatility Expected,-4.3K,,-2.8K
2024/11/01 15:30:00,JPY,CFTC JPY speculative net positions,Moderate Volatility Expected,-24.8K,,12.8K
2024/11/01 15:30:00,NZD,CFTC NZD speculative net positions,Low Volatility Expected,-2.2K,,-0.3K
2024/11/01 15:30:00,EUR,CFTC EUR speculative net positions,Moderate Volatility Expected,-50.3K,,-28.5K
2024/11/01 16:30:00,RUB,CFTC RUB speculative positions,Moderate Volatility Expected,,,-37.1K
2024/11/02 06:30:00,RUB,CBR Monetary Policy Meeting Minutes,Moderate Volatility Expected,,,
2024/11/02 09:00:00,SGD,S&P Global Manufacturing PMI (Oct),Low Volatility Expected,50.8,,51.0
2024/11/03 20:00:00,AUD,MI Inflation Gauge (MoM),Low Volatility Expected,0.3%,,0.1%
2024/11/03 20:30:00,AUD,ANZ Job Advertisements (MoM) (Oct),Low Volatility Expected,0.3%,,2.3%
2024/11/04 04:00:00,BRL,IPC-Fipe Inflation Index (MoM) (Oct),Moderate Volatility Expected,0.80%,,0.18%
2024/11/04 05:30:00,EUR,Sentix Investor Confidence (Nov),Low Volatility Expected,-12.8,-12.7,-13.8
2024/11/04 06:00:00,EUR,German Buba President Nagel Speaks,Moderate Volatility Expected,,,
2024/11/04 06:00:00,EUR,Eurogroup Meetings,Moderate Volatility Expected,,,
2024/11/04 07:00:00,EUR,Car Registration (YoY) (Oct),Low Volatility Expected,7.20%,,6.30%
2024/11/04 07:00:00,EUR,Car Registration (MoM) (Oct),Low Volatility Expected,14.10%,,39.80%
2024/11/04 07:25:00,BRL,BCB Focus Market Readout,Low Volatility Expected,,,
2024/11/04 09:30:00,EUR,ECB's Elderson Speaks,Moderate Volatility Expected,,,
2024/11/04 10:00:00,USD,All Car Sales (Oct),Low Volatility Expected,3.05M,,2.98M
2024/11/04 10:00:00,USD,All Truck Sales (Oct),Low Volatility Expected,12.99M,,12.78M
2024/11/04 10:00:00,EUR,French 12-Month BTF Auction,Low Volatility Expected,2.647%,,2.531%
2024/11/04 10:00:00,EUR,French 3-Month BTF Auction,Low Volatility Expected,3.085%,,3.055%
2024/11/04 10:00:00,EUR,French 6-Month BTF Auction,Low Volatility Expected,2.892%,,2.778%
2024/11/04 11:00:00,USD,CB Employment Trends Index (Oct),Low Volatility Expected,107.66,,107.58
2024/11/04 11:00:00,USD,Durables Excluding Defense (MoM) (Sep),Low Volatility Expected,-1.1%,-1.1%,-1.1%
2024/11/04 11:00:00,USD,Durables Excluding Transport (MoM) (Sep),Low Volatility Expected,0.5%,,0.4%
2024/11/04 11:00:00,USD,Factory Orders (MoM) (Sep),Moderate Volatility Expected,-0.5%,-0.4%,-0.8%
2024/11/04 11:00:00,USD,Factory orders ex transportation (MoM) (Sep),Low Volatility Expected,0.1%,,-0.2%
2024/11/04 11:15:00,EUR,ECB McCaul Speaks,Moderate Volatility Expected,,,
2024/11/04 12:00:00,EUR,French Car Registration (YoY) (Oct),Low Volatility Expected,-11.1%,,-11.1%
2024/11/04 12:30:00,USD,3-Month Bill Auction,Low Volatility Expected,4.440%,,4.490%
2024/11/04 12:30:00,USD,6-Month Bill Auction,Low Volatility Expected,4.260%,,4.325%
2024/11/04 12:45:00,EUR,German Buba Balz Speaks,Moderate Volatility Expected,,,
2024/11/04 14:00:00,USD,3-Year Note Auction,Moderate Volatility Expected,4.152%,,3.878%
2024/11/04 16:00:00,NZD,RBNZ Financial Stability Report,Moderate Volatility Expected,,,
2024/11/04 17:00:00,KRW,FX Reserves - USD (Oct),Low Volatility Expected,415.70B,,419.97B
2024/11/04 18:00:00,NZD,RBNZ Gov Orr Speaks,Moderate Volatility Expected,,,
2024/11/04 19:00:00,KRW,CPI (MoM) (Oct),Low Volatility Expected,0.0%,0.2%,0.1%
2024/11/04 19:00:00,KRW,CPI (YoY) (Oct),Low Volatility Expected,1.3%,1.4%,1.6%
2024/11/04 19:50:00,JPY,Monetary Base (YoY) (Oct),Low Volatility Expected,-0.0%,0.3%,0.1%
2024/11/04 20:00:00,NZD,ANZ Commodity Price Index (MoM),Low Volatility Expected,1.4%,,1.8%
2024/11/04 20:01:00,GBP,BRC Retail Sales Monitor (YoY) (Oct),Moderate Volatility Expected,0.3%,1.4%,1.7%
2024/11/04 23:30:00,AUD,RBA Interest Rate Decision (Nov),High Volatility Expected,4.35%,4.35%,4.35%
2024/11/04 23:30:00,AUD,RBA Monetary Policy Statement,Moderate Volatility Expected,,,
2024/11/04 23:30:00,AUD,RBA Rate Statement,Moderate Volatility Expected,,,
2024/11/05 01:00:00,SGD,Retail Sales (YoY) (Sep),Low Volatility Expected,2.0%,,0.7%
2024/11/05 01:00:00,SGD,Retail Sales (MoM) (Sep),Low Volatility Expected,0.4%,,0.8%
2024/11/05 02:45:00,CHF,Unemployment Rate n.s.a. (Oct),Low Volatility Expected,2.5%,,2.5%
2024/11/05 02:45:00,CHF,Unemployment Rate s.a. (Oct),Low Volatility Expected,2.6%,2.6%,2.6%
2024/11/05 03:45:00,EUR,French Government Budget Balance (Sep),Low Volatility Expected,-173.8B,,-171.9B
2024/11/05 03:45:00,EUR,French Industrial Production (MoM) (Sep),Low Volatility Expected,-0.9%,-0.5%,1.1%
2024/11/05 04:00:00,EUR,Spanish Unemployment Change (Oct),Moderate Volatility Expected,26.8K,26.5K,3.2K
2024/11/05 05:00:00,GBP,Car Registration (YoY) (Oct),Low Volatility Expected,-6.0%,,1.0%
2024/11/05 05:00:00,RUB,Russian Forex Intervention (Nov),Low Volatility Expected,87.5B,,71.8B
2024/11/05 05:50:00,EUR,Spanish 12-Month Letras Auction,Low Volatility Expected,2.610%,,2.579%
2024/11/05 05:50:00,EUR,Spanish 6-Month Letras Auction,Low Volatility Expected,2.840%,,2.869%
2024/11/05 06:00:00,GBP,10-Year Treasury Gilt Auction,Low Volatility Expected,4.475%,,4.170%
2024/11/05 06:00:00,USD,U.S. Presidential Election,High Volatility Expected,,,
2024/11/05 06:00:00,EUR,ECOFIN Meetings,Low Volatility Expected,,,
2024/11/05 06:00:00,EUR,Eurogroup Meetings,Moderate Volatility Expected,,,
2024/11/05 09:15:00,CAD,Reserve Assets Total (Oct),Low Volatility Expected,123.1B,,128.1B
2024/11/05 09:15:00,EUR,Spanish Consumer Confidence (Sep),Low Volatility Expected,84.8,,89.4
2024/11/05 09:30:00,USD,Exports (Sep),Moderate Volatility Expected,267.90B,,271.80B
2024/11/05 09:30:00,USD,Imports (Sep),Moderate Volatility Expected,352.30B,,342.20B
2024/11/05 09:30:00,USD,Trade Balance (Sep),Moderate Volatility Expected,-84.40B,-83.80B,-70.80B
2024/11/05 09:30:00,CAD,Exports (Sep),Low Volatility Expected,63.88B,,63.96B
2024/11/05 09:30:00,CAD,Imports (Sep),Low Volatility Expected,65.15B,,65.43B
2024/11/05 09:30:00,CAD,Trade Balance (Sep),Moderate Volatility Expected,-1.26B,-0.90B,-1.47B
2024/11/05 09:55:00,USD,Redbook (YoY),Low Volatility Expected,6.0%,,5.6%
2024/11/05 10:30:00,EUR,ECB President Lagarde Speaks,Moderate Volatility Expected,,,
2024/11/05 11:00:00,USD,ISM Non-Manufacturing Business Activity (Oct),Low Volatility Expected,57.2,,59.9
2024/11/05 11:00:00,USD,ISM Non-Manufacturing Employment (Oct),Moderate Volatility Expected,53.0,48.0,48.1
2024/11/05 11:00:00,USD,ISM Non-Manufacturing New Orders (Oct),Low Volatility Expected,57.4,58.0,59.4
2024/11/05 11:00:00,USD,ISM Non-Manufacturing PMI (Oct),High Volatility Expected,56.0,53.8,54.9
2024/11/05 11:00:00,USD,ISM Non-Manufacturing Prices (Oct),High Volatility Expected,58.1,58.0,59.4
2024/11/05 11:30:00,NZD,GlobalDairyTrade Price Index,Low Volatility Expected,4.8%,,-0.3%
2024/11/05 11:30:00,USD,Milk Auctions,Low Volatility Expected,"3,997.0",,"3,852.0"
2024/11/05 12:40:00,USD,Total Vehicle Sales (Oct),Low Volatility Expected,16.20M,15.60M,15.80M
2024/11/05 14:00:00,USD,10-Year Note Auction,High Volatility Expected,4.347%,,4.066%
2024/11/05 14:00:00,USD,Atlanta Fed GDPNow (Q4),Moderate Volatility Expected,2.4%,2.3%,2.3%
2024/11/05 14:30:00,CAD,BOC Summary of Deliberations,Low Volatility Expected,,,
2024/11/05 14:30:00,EUR,ECB's Schnabel Speaks,Moderate Volatility Expected,,,
2024/11/05 16:00:00,NZD,RBNZ Financial Stability Report,Moderate Volatility Expected,,,
2024/11/05 17:30:00,USD,API Weekly Crude Oil Stock,Moderate Volatility Expected,3.132M,1.800M,-0.573M
2024/11/05 17:45:00,NZD,Employment Change (QoQ) (Q3),Low Volatility Expected,-0.5%,-0.4%,0.4%
2024/11/05 17:45:00,NZD,Labor Cost Index (YoY) (Q3),Low Volatility Expected,3.4%,3.4%,3.6%
2024/11/05 17:45:00,NZD,Labor Cost Index (QoQ) (Q3),Low Volatility Expected,0.6%,0.7%,0.9%
2024/11/05 17:45:00,NZD,Participation Rate (Q3),Low Volatility Expected,71.20%,71.50%,71.70%
2024/11/05 17:45:00,NZD,Unemployment Rate (Q3),Low Volatility Expected,4.8%,5.0%,4.6%
2024/11/05 18:00:00,AUD,AIG Construction Index (Oct),Low Volatility Expected,-40.9,,-19.8
2024/11/05 18:00:00,AUD,AIG Manufacturing Index (Oct),Low Volatility Expected,-19.7,,-33.6
2024/11/05 19:00:00,JPY,Reuters Tankan Index (Nov),Low Volatility Expected,5,,7
2024/11/05 19:50:00,JPY,Monetary Policy Meeting Minutes,Moderate Volatility Expected,,,
2024/11/05 20:30:00,AUD,RBA Chart Pack Release,Low Volatility Expected,,,
2024/11/06 03:00:00,EUR,German Factory Orders (MoM) (Sep),Moderate Volatility Expected,4.2%,1.6%,-5.4%
2024/11/06 06:00:00,GBP,United Kingdom New Passenger Cars Registration (Oct),Low Volatility Expected,"144,288.0",,"275,239.0"
2024/11/06 06:00:00,EUR,German Car Registration (YoY),Low Volatility Expected,6.0%,,-7.0%
2024/11/06 06:00:00,EUR,PPI (MoM) (Sep),Low Volatility Expected,-0.6%,-0.5%,0.6%
2024/11/06 06:00:00,EUR,PPI (YoY) (Sep),Low Volatility Expected,-3.4%,-3.5%,-2.3%
2024/11/06 07:00:00,BRL,IGP-DI Inflation Index (MoM) (Oct),Low Volatility Expected,1.54%,,1.03%
2024/11/06 08:00:00,USD,MBA 30-Year Mortgage Rate,Low Volatility Expected,6.81%,,6.73%
2024/11/06 08:00:00,USD,MBA Mortgage Applications (WoW),Low Volatility Expected,-10.8%,,-0.1%
2024/11/06 08:00:00,USD,MBA Purchase Index,Low Volatility Expected,130.8,,137.8
2024/11/06 08:00:00,USD,Mortgage Market Index,Low Volatility Expected,191.4,,214.5
2024/11/06 08:00:00,USD,Mortgage Refinance Index,Low Volatility Expected,513.5,,630.0
2024/11/06 10:00:00,BRL,Auto Production (MoM) (Oct),Low Volatility Expected,8.3%,,-11.4%
2024/11/06 10:00:00,BRL,Auto Sales (MoM) (Oct),Low Volatility Expected,12.1%,,-0.4%
2024/11/06 10:00:00,EUR,ECB President Lagarde Speaks,Moderate Volatility Expected,,,
2024/11/06 10:10:00,EUR,German Buba Vice President Buch Speaks,Moderate Volatility Expected,,,
2024/11/06 10:30:00,EUR,ECB's De Guindos Speaks,Moderate Volatility Expected,,,
2024/11/06 11:00:00,CAD,Ivey PMI n.s.a (Oct),Low Volatility Expected,52.2,,54.5
2024/11/06 11:00:00,CAD,Ivey PMI (Oct),Moderate Volatility Expected,52.0,54.2,53.1
2024/11/06 11:00:00,EUR,German Buba President Nagel Speaks,Moderate Volatility Expected,,,
2024/11/06 11:30:00,USD,Crude Oil Inventories,High Volatility Expected,2.149M,0.300M,-0.515M
2024/11/06 11:30:00,USD,EIA Refinery Crude Runs (WoW),Low Volatility Expected,0.281M,,-0.031M
2024/11/06 11:30:00,USD,Crude Oil Imports,Low Volatility Expected,1.676M,,-0.605M
2024/11/06 11:30:00,USD,Cushing Crude Oil Inventories,Moderate Volatility Expected,0.522M,,0.681M
2024/11/06 11:30:00,USD,Distillate Fuel Production,Low Volatility Expected,0.233M,,-0.148M
2024/11/06 11:30:00,USD,EIA Weekly Distillates Stocks,Low Volatility Expected,2.947M,-1.500M,-0.977M
2024/11/06 11:30:00,USD,Gasoline Production,Low Volatility Expected,0.013M,,-0.259M
2024/11/06 11:30:00,USD,Heating Oil Stockpiles,Low Volatility Expected,0.335M,,0.571M
2024/11/06 11:30:00,USD,EIA Weekly Refinery Utilization Rates (WoW),Low Volatility Expected,1.4%,,-0.4%
2024/11/06 11:30:00,USD,Gasoline Inventories,Low Volatility Expected,0.412M,-1.650M,-2.707M
2024/11/06 13:00:00,EUR,Italian Car Registration (YoY) (Oct),Low Volatility Expected,-9.1%,,-10.7%
2024/11/06 13:25:00,CAD,BoC Senior Deputy Governor Rogers Speaks,Moderate Volatility Expected,,,
2024/11/06 13:30:00,BRL,Foreign Exchange Flows,Low Volatility Expected,3.743B,,-1.672B
2024/11/06 14:00:00,USD,30-Year Bond Auction,High Volatility Expected,4.608%,,4.389%
2024/11/06 14:00:00,BRL,Trade Balance (Oct),Low Volatility Expected,4.34B,4.98B,5.02B
2024/11/06 14:30:00,CAD,BOC Summary of Deliberations,Low Volatility Expected,,,
2024/11/06 15:10:00,NZD,RBNZ Gov Orr Speaks,Moderate Volatility Expected,,,
2024/11/06 17:30:00,BRL,Interest Rate Decision,Moderate Volatility Expected,11.25%,11.25%,10.75%
2024/11/06 19:00:00,KRW,Current Account (Sep),Low Volatility Expected,11.12B,,6.60B
2024/11/06 19:30:00,JPY,Overall wage income of employees (Sep),Low Volatility Expected,2.8%,3.0%,2.8%
2024/11/06 19:30:00,JPY,Overtime Pay (YoY) (Sep),Low Volatility Expected,-0.40%,,1.70%
2024/11/06 20:30:00,AUD,Building Approvals (MoM),Moderate Volatility Expected,4.4%,4.4%,-3.9%
2024/11/06 20:30:00,AUD,Exports (MoM) (Sep),Low Volatility Expected,-4.3%,,-0.6%
2024/11/06 20:30:00,AUD,Imports (MoM) (Sep),Low Volatility Expected,-3.1%,,-0.2%
2024/11/06 20:30:00,AUD,Private House Approvals,Low Volatility Expected,2.2%,,2.3%
2024/11/06 20:30:00,AUD,Trade Balance (Sep),Moderate Volatility Expected,4.609B,5.240B,5.284B
2024/11/06 23:31:30,CNY,Exports (YoY) (Oct),Moderate Volatility Expected,12.7%,5.0%,2.4%
2024/11/06 23:31:30,CNY,Imports (YoY) (Oct),Moderate Volatility Expected,-2.3%,-1.5%,0.3%
2024/11/06 23:31:30,CNY,Trade Balance (USD) (Oct),Moderate Volatility Expected,95.27B,73.50B,81.71B
2024/11/06 23:31:36,CNY,Exports (Oct),Low Volatility Expected,11.20M,,1.60M
2024/11/06 23:31:36,CNY,Imports (Oct),Low Volatility Expected,-3.70M,,-0.50M
2024/11/06 23:31:36,CNY,Trade Balance (Oct),Low Volatility Expected,679.10B,560.00B,582.62B
2024/11/06 23:35:00,JPY,10-Year JGB Auction,Moderate Volatility Expected,1.000%,,0.871%
2024/11/07 02:00:00,ZAR,Foreign Reserves (USD) (Oct),Low Volatility Expected,63.03B,,63.63B
2024/11/07 02:00:00,ZAR,Net FX Reserves (USD) (Oct),Low Volatility Expected,61.197B,,61.029B
2024/11/07 03:00:00,GBP,Halifax House Price Index (MoM) (Oct),Moderate Volatility Expected,0.2%,0.2%,0.3%
2024/11/07 03:00:00,GBP,Halifax House Price Index (YoY) (Oct),Moderate Volatility Expected,3.9%,4.2%,4.6%
2024/11/07 03:00:00,EUR,German Exports (MoM) (Sep),Low Volatility Expected,-1.7%,-1.4%,1.2%
2024/11/07 03:00:00,EUR,German Imports (MoM) (Sep),Low Volatility Expected,2.1%,0.5%,-2.6%
2024/11/07 03:00:00,EUR,German Industrial Production (MoM) (Sep),Moderate Volatility Expected,-2.5%,-1.1%,2.6%
2024/11/07 03:00:00,EUR,German Trade Balance (Sep),Moderate Volatility Expected,17.0B,20.8B,21.4B
2024/11/07 03:00:00,EUR,German Industrial Production (YoY) (Sep),Low Volatility Expected,-4.62%,,-2.82%
2024/11/07 03:45:00,EUR,French Non-Farm Payrolls (QoQ) (Q3),Low Volatility Expected,-0.1%,0.0%,0.0%
2024/11/07 04:00:00,CHF,Foreign Reserves (USD) (Oct),Low Volatility Expected,718.8B,,715.7B
2024/11/07 04:00:00,EUR,Spanish Industrial Production (YoY) (Sep),Low Volatility Expected,0.6%,0.2%,-0.1%
2024/11/07 04:00:00,CNY,FX Reserves (USD) (Oct),Low Volatility Expected,3.261T,3.290T,3.316T
2024/11/07 04:10:00,EUR,ECB's Schnabel Speaks,Moderate Volatility Expected,,,
2024/11/07 04:30:00,HKD,Foreign Reserves (USD) (Oct),Low Volatility Expected,421.40B,,422.80B
2024/11/07 05:00:00,SGD,Foreign Reserves USD (MoM) (Oct),Low Volatility Expected,383.7B,,389.8B
2024/11/07 05:30:00,GBP,Mortgage Rate (GBP) (Oct),Moderate Volatility Expected,7.69%,,7.69%
2024/11/07 05:40:00,EUR,Spanish 30-Year Obligacion Auction,Low Volatility Expected,3.877%,,3.853%
2024/11/07 05:50:00,EUR,Spanish 5-Year Bonos Auction,Low Volatility Expected,2.755%,,2.580%
2024/11/07 06:00:00,EUR,French 10-Year OAT Auction,Low Volatility Expected,3.24%,,2.92%
2024/11/07 06:00:00,EUR,French 30-Year OAT Auction,Low Volatility Expected,3.78%,,3.55%
2024/11/07 06:00:00,EUR,Retail Sales (YoY) (Sep),Low Volatility Expected,2.9%,1.3%,2.4%
2024/11/07 06:00:00,EUR,Retail Sales (MoM) (Sep),Low Volatility Expected,0.5%,0.4%,1.1%
2024/11/07 06:45:00,EUR,ECB's Elderson Speaks,Moderate Volatility Expected,,,
2024/11/07 07:00:00,CAD,Leading Index (MoM) (Oct),Low Volatility Expected,0.25%,,0.24%
2024/11/07 08:00:00,GBP,BoE MPC vote cut (Nov),Moderate Volatility Expected,8,8,1
2024/11/07 08:00:00,GBP,BoE MPC vote hike (Nov),Moderate Volatility Expected,0,0,0
2024/11/07 08:00:00,GBP,BoE MPC vote unchanged (Nov),Moderate Volatility Expected,1,1,8
